No.     Time                       Source                Destination           Protocol Length Info
      1 2012-10-11 23:31:24.544757 192.168.0.71          69.10.30.242          TCP      74     52117 > 29900 [SYN] Seq=0 Win=16384 Len=0 MSS=1460 WS=1 TSval=5590 TSecr=0

Frame 1: 74 bytes on wire (592 bits), 74 bytes captured (592 bits)
    Arrival Time: Oct 11, 2012 23:31:24.544757000 GTB Standard Time
    Epoch Time: 1349987484.544757000 seconds
    [Time delta from previous captured frame: 0.000000000 seconds]
    [Time delta from previous displayed frame: 0.000000000 seconds]
    [Time since reference or first frame: 0.000000000 seconds]
    Frame Number: 1
    Frame Length: 74 bytes (592 bits)
    Capture Length: 74 bytes (592 bits)
    [Frame is marked: False]
    [Frame is ignored: False]
    [Protocols in frame: eth:ip:tcp]
    [Coloring Rule Name: TCP SYN/FIN]
    [Coloring Rule String: tcp.flags & 0x02 || tcp.flags.fin == 1]
Ethernet II, Src: SonyComp_ea:13:f9 (00:19:c5:ea:13:f9), Dst: ZyxelCom_8d:62:30 (40:4a:03:8d:62:30)
    Destination: ZyxelCom_8d:62:30 (40:4a:03:8d:62:30)
        Address: ZyxelCom_8d:62:30 (40:4a:03:8d:62:30)
        .... ...0 .... .... .... .... = IG bit: Individual address (unicast)
        .... ..0. .... .... .... .... = LG bit: Globally unique address (factory default)
    Source: SonyComp_ea:13:f9 (00:19:c5:ea:13:f9)
        Address: SonyComp_ea:13:f9 (00:19:c5:ea:13:f9)
        .... ...0 .... .... .... .... = IG bit: Individual address (unicast)
        .... ..0. .... .... .... .... = LG bit: Globally unique address (factory default)
    Type: IP (0x0800)
Internet Protocol Version 4, Src: 192.168.0.71 (192.168.0.71), Dst: 69.10.30.242 (69.10.30.242)
    Version: 4
    Header length: 20 bytes
    Differentiated Services Field: 0x00 (DSCP 0x00: Default; ECN: 0x00: Not-ECT (Not ECN-Capable Transport))
        0000 00.. = Differentiated Services Codepoint: Default (0x00)
        .... ..00 = Explicit Congestion Notification: Not-ECT (Not ECN-Capable Transport) (0x00)
    Total Length: 60
    Identification: 0x00bf (191)
    Flags: 0x02 (Don't Fragment)
        0... .... = Reserved bit: Not set
        .1.. .... = Don't fragment: Set
        ..0. .... = More fragments: Not set
    Fragment offset: 0
    Time to live: 64
    Protocol: TCP (6)
    Header checksum: 0x1512 [correct]
        [Good: True]
        [Bad: False]
    Source: 192.168.0.71 (192.168.0.71)
    Destination: 69.10.30.242 (69.10.30.242)
Transmission Control Protocol, Src Port: 52117 (52117), Dst Port: 29900 (29900), Seq: 0, Len: 0
    Source port: 52117 (52117)
    Destination port: 29900 (29900)
    [Stream index: 0]
    Sequence number: 0    (relative sequence number)
    Header length: 40 bytes
    Flags: 0x002 (SYN)
        000. .... .... = Reserved: Not set
        ...0 .... .... = Nonce: Not set
        .... 0... .... = Congestion Window Reduced (CWR): Not set
        .... .0.. .... = ECN-Echo: Not set
        .... ..0. .... = Urgent: Not set
        .... ...0 .... = Acknowledgement: Not set
        .... .... 0... = Push: Not set
        .... .... .0.. = Reset: Not set
        .... .... ..1. = Syn: Set
            [Expert Info (Chat/Sequence): Connection establish request (SYN): server port 29900]
                [Message: Connection establish request (SYN): server port 29900]
                [Severity level: Chat]
                [Group: Sequence]
        .... .... ...0 = Fin: Not set
    Window size value: 16384
    [Calculated window size: 16384]
    Checksum: 0xf288 [validation disabled]
        [Good Checksum: False]
        [Bad Checksum: False]
    Options: (20 bytes)
        Maximum segment size: 1460 bytes
        No-Operation (NOP)
        Window scale: 0 (multiply by 1)
            Kind: Window Scale (3)
            Length: 3
            Shift count: 0
            [Multiplier: 1]
        No-Operation (NOP)
        No-Operation (NOP)
        Timestamps: TSval 5590, TSecr 0
            Kind: Timestamp (8)
            Length: 10
            Timestamp value: 5590
            Timestamp echo reply: 0

0000  40 4a 03 8d 62 30 00 19 c5 ea 13 f9 08 00 45 00   @J..b0........E.
0010  00 3c 00 bf 40 00 40 06 15 12 c0 a8 00 47 45 0a   .<..@.@......GE.
0020  1e f2 cb 95 74 cc e6 ea b6 70 00 00 00 00 a0 02   ....t....p......
0030  40 00 f2 88 00 00 02 04 05 b4 01 03 03 00 01 01   @...............
0040  08 0a 00 00 15 d6 00 00 00 00                     ..........

No.     Time                       Source                Destination           Protocol Length Info
      3 2012-10-11 23:31:24.758381 192.168.0.71          69.10.30.242          TCP      66     52117 > 29900 [ACK] Seq=1 Ack=1 Win=17520 Len=0 TSval=5590 TSecr=0

Frame 3: 66 bytes on wire (528 bits), 66 bytes captured (528 bits)
    Arrival Time: Oct 11, 2012 23:31:24.758381000 GTB Standard Time
    Epoch Time: 1349987484.758381000 seconds
    [Time delta from previous captured frame: 0.000420000 seconds]
    [Time delta from previous displayed frame: 0.213624000 seconds]
    [Time since reference or first frame: 0.213624000 seconds]
    Frame Number: 3
    Frame Length: 66 bytes (528 bits)
    Capture Length: 66 bytes (528 bits)
    [Frame is marked: False]
    [Frame is ignored: False]
    [Protocols in frame: eth:ip:tcp]
    [Coloring Rule Name: TCP]
    [Coloring Rule String: tcp]
Ethernet II, Src: SonyComp_ea:13:f9 (00:19:c5:ea:13:f9), Dst: ZyxelCom_8d:62:30 (40:4a:03:8d:62:30)
    Destination: ZyxelCom_8d:62:30 (40:4a:03:8d:62:30)
        Address: ZyxelCom_8d:62:30 (40:4a:03:8d:62:30)
        .... ...0 .... .... .... .... = IG bit: Individual address (unicast)
        .... ..0. .... .... .... .... = LG bit: Globally unique address (factory default)
    Source: SonyComp_ea:13:f9 (00:19:c5:ea:13:f9)
        Address: SonyComp_ea:13:f9 (00:19:c5:ea:13:f9)
        .... ...0 .... .... .... .... = IG bit: Individual address (unicast)
        .... ..0. .... .... .... .... = LG bit: Globally unique address (factory default)
    Type: IP (0x0800)
Internet Protocol Version 4, Src: 192.168.0.71 (192.168.0.71), Dst: 69.10.30.242 (69.10.30.242)
    Version: 4
    Header length: 20 bytes
    Differentiated Services Field: 0x00 (DSCP 0x00: Default; ECN: 0x00: Not-ECT (Not ECN-Capable Transport))
        0000 00.. = Differentiated Services Codepoint: Default (0x00)
        .... ..00 = Explicit Congestion Notification: Not-ECT (Not ECN-Capable Transport) (0x00)
    Total Length: 52
    Identification: 0x00c0 (192)
    Flags: 0x02 (Don't Fragment)
        0... .... = Reserved bit: Not set
        .1.. .... = Don't fragment: Set
        ..0. .... = More fragments: Not set
    Fragment offset: 0
    Time to live: 64
    Protocol: TCP (6)
    Header checksum: 0x1519 [correct]
        [Good: True]
        [Bad: False]
    Source: 192.168.0.71 (192.168.0.71)
    Destination: 69.10.30.242 (69.10.30.242)
Transmission Control Protocol, Src Port: 52117 (52117), Dst Port: 29900 (29900), Seq: 1, Ack: 1, Len: 0
    Source port: 52117 (52117)
    Destination port: 29900 (29900)
    [Stream index: 0]
    Sequence number: 1    (relative sequence number)
    Acknowledgement number: 1    (relative ack number)
    Header length: 32 bytes
    Flags: 0x010 (ACK)
        000. .... .... = Reserved: Not set
        ...0 .... .... = Nonce: Not set
        .... 0... .... = Congestion Window Reduced (CWR): Not set
        .... .0.. .... = ECN-Echo: Not set
        .... ..0. .... = Urgent: Not set
        .... ...1 .... = Acknowledgement: Set
        .... .... 0... = Push: Not set
        .... .... .0.. = Reset: Not set
        .... .... ..0. = Syn: Not set
        .... .... ...0 = Fin: Not set
    Window size value: 17520
    [Calculated window size: 17520]
    [Window size scaling factor: 1]
    Checksum: 0x8ef5 [validation disabled]
        [Good Checksum: False]
        [Bad Checksum: False]
    Options: (12 bytes)
        No-Operation (NOP)
        No-Operation (NOP)
        Timestamps: TSval 5590, TSecr 0
            Kind: Timestamp (8)
            Length: 10
            Timestamp value: 5590
            Timestamp echo reply: 0

0000  40 4a 03 8d 62 30 00 19 c5 ea 13 f9 08 00 45 00   @J..b0........E.
0010  00 34 00 c0 40 00 40 06 15 19 c0 a8 00 47 45 0a   .4..@.@......GE.
0020  1e f2 cb 95 74 cc e6 ea b6 71 ac 56 de 80 80 10   ....t....q.V....
0030  44 70 8e f5 00 00 01 01 08 0a 00 00 15 d6 00 00   Dp..............
0040  00 00                                             ..

No.     Time                       Source                Destination           Protocol Length Info
      4 2012-10-11 23:31:25.003919 192.168.0.71          69.10.30.242          TCP      264    52117 > 29900 [PSH, ACK] Seq=1 Ack=39 Win=17520 Len=198 TSval=5591 TSecr=16028883

Frame 4: 264 bytes on wire (2112 bits), 264 bytes captured (2112 bits)
    Arrival Time: Oct 11, 2012 23:31:25.003919000 GTB Standard Time
    Epoch Time: 1349987485.003919000 seconds
    [Time delta from previous captured frame: 0.245538000 seconds]
    [Time delta from previous displayed frame: 0.245538000 seconds]
    [Time since reference or first frame: 0.459162000 seconds]
    Frame Number: 4
    Frame Length: 264 bytes (2112 bits)
    Capture Length: 264 bytes (2112 bits)
    [Frame is marked: False]
    [Frame is ignored: False]
    [Protocols in frame: eth:ip:tcp:data]
    [Coloring Rule Name: TCP]
    [Coloring Rule String: tcp]
Ethernet II, Src: SonyComp_ea:13:f9 (00:19:c5:ea:13:f9), Dst: ZyxelCom_8d:62:30 (40:4a:03:8d:62:30)
    Destination: ZyxelCom_8d:62:30 (40:4a:03:8d:62:30)
        Address: ZyxelCom_8d:62:30 (40:4a:03:8d:62:30)
        .... ...0 .... .... .... .... = IG bit: Individual address (unicast)
        .... ..0. .... .... .... .... = LG bit: Globally unique address (factory default)
    Source: SonyComp_ea:13:f9 (00:19:c5:ea:13:f9)
        Address: SonyComp_ea:13:f9 (00:19:c5:ea:13:f9)
        .... ...0 .... .... .... .... = IG bit: Individual address (unicast)
        .... ..0. .... .... .... .... = LG bit: Globally unique address (factory default)
    Type: IP (0x0800)
Internet Protocol Version 4, Src: 192.168.0.71 (192.168.0.71), Dst: 69.10.30.242 (69.10.30.242)
    Version: 4
    Header length: 20 bytes
    Differentiated Services Field: 0x00 (DSCP 0x00: Default; ECN: 0x00: Not-ECT (Not ECN-Capable Transport))
        0000 00.. = Differentiated Services Codepoint: Default (0x00)
        .... ..00 = Explicit Congestion Notification: Not-ECT (Not ECN-Capable Transport) (0x00)
    Total Length: 250
    Identification: 0x00c1 (193)
    Flags: 0x02 (Don't Fragment)
        0... .... = Reserved bit: Not set
        .1.. .... = Don't fragment: Set
        ..0. .... = More fragments: Not set
    Fragment offset: 0
    Time to live: 64
    Protocol: TCP (6)
    Header checksum: 0x1452 [correct]
        [Good: True]
        [Bad: False]
    Source: 192.168.0.71 (192.168.0.71)
    Destination: 69.10.30.242 (69.10.30.242)
Transmission Control Protocol, Src Port: 52117 (52117), Dst Port: 29900 (29900), Seq: 1, Ack: 39, Len: 198
    Source port: 52117 (52117)
    Destination port: 29900 (29900)
    [Stream index: 0]
    Sequence number: 1    (relative sequence number)
    [Next sequence number: 199    (relative sequence number)]
    Acknowledgement number: 39    (relative ack number)
    Header length: 32 bytes
    Flags: 0x018 (PSH, ACK)
        000. .... .... = Reserved: Not set
        ...0 .... .... = Nonce: Not set
        .... 0... .... = Congestion Window Reduced (CWR): Not set
        .... .0.. .... = ECN-Echo: Not set
        .... ..0. .... = Urgent: Not set
        .... ...1 .... = Acknowledgement: Set
        .... .... 1... = Push: Set
        .... .... .0.. = Reset: Not set
        .... .... ..0. = Syn: Not set
        .... .... ...0 = Fin: Not set
    Window size value: 17520
    [Calculated window size: 17520]
    [Window size scaling factor: 1]
    Checksum: 0x1554 [validation disabled]
        [Good Checksum: False]
        [Bad Checksum: False]
    Options: (12 bytes)
        No-Operation (NOP)
        No-Operation (NOP)
        Timestamps: TSval 5591, TSecr 16028883
            Kind: Timestamp (8)
            Length: 10
            Timestamp value: 5591
            Timestamp echo reply: 16028883
    [SEQ/ACK analysis]
        [Bytes in flight: 199]
Data (198 bytes)
    Data: 5c6c6f67696e5c5c6368616c6c656e67655c327a34315970...
    [Length: 198]

0000  40 4a 03 8d 62 30 00 19 c5 ea 13 f9 08 00 45 00   @J..b0........E.
0010  00 fa 00 c1 40 00 40 06 14 52 c0 a8 00 47 45 0a   ....@.@..R...GE.
0020  1e f2 cb 95 74 cc e6 ea b6 71 ac 56 de a6 80 18   ....t....q.V....
0030  44 70 15 54 00 00 01 01 08 0a 00 00 15 d7 00 f4   Dp.T............
0040  94 d3 5c 6c 6f 67 69 6e 5c 5c 63 68 61 6c 6c 65   ..\login\\challe
0050  6e 67 65 5c 32 7a 34 31 59 70 30 66 57 33 61 7a   nge\2z41Yp0fW3az
0060  32 42 55 6a 51 44 53 74 67 39 4f 35 75 39 6d 39   2BUjQDStg9O5u9m9
0070  55 35 61 58 5c 75 6e 69 71 75 65 6e 69 63 6b 5c   U5aX\uniquenick\
0080  62 61 6a 73 6d 61 6e 6e 65 6e 5c 72 65 73 70 6f   bajsmannen\respo
0090  6e 73 65 5c 39 66 33 37 33 39 37 65 66 66 61 39   nse\9f37397effa9
00a0  35 66 63 39 32 62 32 66 66 37 37 64 62 32 39 64   5fc92b2ff77db29d
00b0  61 38 36 33 5c 66 69 72 65 77 61 6c 6c 5c 31 5c   a863\firewall\1\
00c0  70 6f 72 74 5c 30 5c 70 72 6f 64 75 63 74 69 64   port\0\productid
00d0  5c 31 30 33 30 37 5c 67 61 6d 65 6e 61 6d 65 5c   \10307\gamename\
00e0  62 66 69 65 6c 64 31 39 34 32 70 73 32 5c 6e 61   bfield1942ps2\na
00f0  6d 65 73 70 61 63 65 69 64 5c 31 33 5c 69 64 5c   mespaceid\13\id\
0100  31 5c 66 69 6e 61 6c 5c                           1\final\

No.     Time                       Source                Destination           Protocol Length Info
      5 2012-10-11 23:31:25.244911 192.168.0.71          69.10.24.135          TCP      74     52116 > http [SYN] Seq=0 Win=16384 Len=0 MSS=1460 WS=1 TSval=5591 TSecr=0

Frame 5: 74 bytes on wire (592 bits), 74 bytes captured (592 bits)
    Arrival Time: Oct 11, 2012 23:31:25.244911000 GTB Standard Time
    Epoch Time: 1349987485.244911000 seconds
    [Time delta from previous captured frame: 0.240992000 seconds]
    [Time delta from previous displayed frame: 0.240992000 seconds]
    [Time since reference or first frame: 0.700154000 seconds]
    Frame Number: 5
    Frame Length: 74 bytes (592 bits)
    Capture Length: 74 bytes (592 bits)
    [Frame is marked: False]
    [Frame is ignored: False]
    [Protocols in frame: eth:ip:tcp]
    [Coloring Rule Name: HTTP]
    [Coloring Rule String: http || tcp.port == 80]
Ethernet II, Src: SonyComp_ea:13:f9 (00:19:c5:ea:13:f9), Dst: ZyxelCom_8d:62:30 (40:4a:03:8d:62:30)
    Destination: ZyxelCom_8d:62:30 (40:4a:03:8d:62:30)
        Address: ZyxelCom_8d:62:30 (40:4a:03:8d:62:30)
        .... ...0 .... .... .... .... = IG bit: Individual address (unicast)
        .... ..0. .... .... .... .... = LG bit: Globally unique address (factory default)
    Source: SonyComp_ea:13:f9 (00:19:c5:ea:13:f9)
        Address: SonyComp_ea:13:f9 (00:19:c5:ea:13:f9)
        .... ...0 .... .... .... .... = IG bit: Individual address (unicast)
        .... ..0. .... .... .... .... = LG bit: Globally unique address (factory default)
    Type: IP (0x0800)
Internet Protocol Version 4, Src: 192.168.0.71 (192.168.0.71), Dst: 69.10.24.135 (69.10.24.135)
    Version: 4
    Header length: 20 bytes
    Differentiated Services Field: 0x00 (DSCP 0x00: Default; ECN: 0x00: Not-ECT (Not ECN-Capable Transport))
        0000 00.. = Differentiated Services Codepoint: Default (0x00)
        .... ..00 = Explicit Congestion Notification: Not-ECT (Not ECN-Capable Transport) (0x00)
    Total Length: 60
    Identification: 0x00c2 (194)
    Flags: 0x02 (Don't Fragment)
        0... .... = Reserved bit: Not set
        .1.. .... = Don't fragment: Set
        ..0. .... = More fragments: Not set
    Fragment offset: 0
    Time to live: 64
    Protocol: TCP (6)
    Header checksum: 0x1b7a [correct]
        [Good: True]
        [Bad: False]
    Source: 192.168.0.71 (192.168.0.71)
    Destination: 69.10.24.135 (69.10.24.135)
Transmission Control Protocol, Src Port: 52116 (52116), Dst Port: http (80), Seq: 0, Len: 0
    Source port: 52116 (52116)
    Destination port: http (80)
    [Stream index: 1]
    Sequence number: 0    (relative sequence number)
    Header length: 40 bytes
    Flags: 0x002 (SYN)
        000. .... .... = Reserved: Not set
        ...0 .... .... = Nonce: Not set
        .... 0... .... = Congestion Window Reduced (CWR): Not set
        .... .0.. .... = ECN-Echo: Not set
        .... ..0. .... = Urgent: Not set
        .... ...0 .... = Acknowledgement: Not set
        .... .... 0... = Push: Not set
        .... .... .0.. = Reset: Not set
        .... .... ..1. = Syn: Set
            [Expert Info (Chat/Sequence): Connection establish request (SYN): server port http]
                [Message: Connection establish request (SYN): server port http]
                [Severity level: Chat]
                [Group: Sequence]
        .... .... ...0 = Fin: Not set
    Window size value: 16384
    [Calculated window size: 16384]
    Checksum: 0xa828 [validation disabled]
        [Good Checksum: False]
        [Bad Checksum: False]
    Options: (20 bytes)
        Maximum segment size: 1460 bytes
        No-Operation (NOP)
        Window scale: 0 (multiply by 1)
            Kind: Window Scale (3)
            Length: 3
            Shift count: 0
            [Multiplier: 1]
        No-Operation (NOP)
        No-Operation (NOP)
        Timestamps: TSval 5591, TSecr 0
            Kind: Timestamp (8)
            Length: 10
            Timestamp value: 5591
            Timestamp echo reply: 0

0000  40 4a 03 8d 62 30 00 19 c5 ea 13 f9 08 00 45 00   @J..b0........E.
0010  00 3c 00 c2 40 00 40 06 1b 7a c0 a8 00 47 45 0a   .<..@.@..z...GE.
0020  18 87 cb 94 00 50 e8 6f 7a 33 00 00 00 00 a0 02   .....P.oz3......
0030  40 00 a8 28 00 00 02 04 05 b4 01 03 03 00 01 01   @..(............
0040  08 0a 00 00 15 d7 00 00 00 00                     ..........

No.     Time                       Source                Destination           Protocol Length Info
      6 2012-10-11 23:31:25.245212 192.168.0.71          69.10.24.135          TCP      74     52115 > http [SYN] Seq=0 Win=16384 Len=0 MSS=1460 WS=1 TSval=5591 TSecr=0

Frame 6: 74 bytes on wire (592 bits), 74 bytes captured (592 bits)
    Arrival Time: Oct 11, 2012 23:31:25.245212000 GTB Standard Time
    Epoch Time: 1349987485.245212000 seconds
    [Time delta from previous captured frame: 0.000301000 seconds]
    [Time delta from previous displayed frame: 0.000301000 seconds]
    [Time since reference or first frame: 0.700455000 seconds]
    Frame Number: 6
    Frame Length: 74 bytes (592 bits)
    Capture Length: 74 bytes (592 bits)
    [Frame is marked: False]
    [Frame is ignored: False]
    [Protocols in frame: eth:ip:tcp]
    [Coloring Rule Name: HTTP]
    [Coloring Rule String: http || tcp.port == 80]
Ethernet II, Src: SonyComp_ea:13:f9 (00:19:c5:ea:13:f9), Dst: ZyxelCom_8d:62:30 (40:4a:03:8d:62:30)
    Destination: ZyxelCom_8d:62:30 (40:4a:03:8d:62:30)
        Address: ZyxelCom_8d:62:30 (40:4a:03:8d:62:30)
        .... ...0 .... .... .... .... = IG bit: Individual address (unicast)
        .... ..0. .... .... .... .... = LG bit: Globally unique address (factory default)
    Source: SonyComp_ea:13:f9 (00:19:c5:ea:13:f9)
        Address: SonyComp_ea:13:f9 (00:19:c5:ea:13:f9)
        .... ...0 .... .... .... .... = IG bit: Individual address (unicast)
        .... ..0. .... .... .... .... = LG bit: Globally unique address (factory default)
    Type: IP (0x0800)
Internet Protocol Version 4, Src: 192.168.0.71 (192.168.0.71), Dst: 69.10.24.135 (69.10.24.135)
    Version: 4
    Header length: 20 bytes
    Differentiated Services Field: 0x00 (DSCP 0x00: Default; ECN: 0x00: Not-ECT (Not ECN-Capable Transport))
        0000 00.. = Differentiated Services Codepoint: Default (0x00)
        .... ..00 = Explicit Congestion Notification: Not-ECT (Not ECN-Capable Transport) (0x00)
    Total Length: 60
    Identification: 0x00c3 (195)
    Flags: 0x02 (Don't Fragment)
        0... .... = Reserved bit: Not set
        .1.. .... = Don't fragment: Set
        ..0. .... = More fragments: Not set
    Fragment offset: 0
    Time to live: 64
    Protocol: TCP (6)
    Header checksum: 0x1b79 [correct]
        [Good: True]
        [Bad: False]
    Source: 192.168.0.71 (192.168.0.71)
    Destination: 69.10.24.135 (69.10.24.135)
Transmission Control Protocol, Src Port: 52115 (52115), Dst Port: http (80), Seq: 0, Len: 0
    Source port: 52115 (52115)
    Destination port: http (80)
    [Stream index: 2]
    Sequence number: 0    (relative sequence number)
    Header length: 40 bytes
    Flags: 0x002 (SYN)
        000. .... .... = Reserved: Not set
        ...0 .... .... = Nonce: Not set
        .... 0... .... = Congestion Window Reduced (CWR): Not set
        .... .0.. .... = ECN-Echo: Not set
        .... ..0. .... = Urgent: Not set
        .... ...0 .... = Acknowledgement: Not set
        .... .... 0... = Push: Not set
        .... .... .0.. = Reset: Not set
        .... .... ..1. = Syn: Set
            [Expert Info (Chat/Sequence): Connection establish request (SYN): server port http]
                [Message: Connection establish request (SYN): server port http]
                [Severity level: Chat]
                [Group: Sequence]
        .... .... ...0 = Fin: Not set
    Window size value: 16384
    [Calculated window size: 16384]
    Checksum: 0x5ffd [validation disabled]
        [Good Checksum: False]
        [Bad Checksum: False]
    Options: (20 bytes)
        Maximum segment size: 1460 bytes
        No-Operation (NOP)
        Window scale: 0 (multiply by 1)
            Kind: Window Scale (3)
            Length: 3
            Shift count: 0
            [Multiplier: 1]
        No-Operation (NOP)
        No-Operation (NOP)
        Timestamps: TSval 5591, TSecr 0
            Kind: Timestamp (8)
            Length: 10
            Timestamp value: 5591
            Timestamp echo reply: 0

0000  40 4a 03 8d 62 30 00 19 c5 ea 13 f9 08 00 45 00   @J..b0........E.
0010  00 3c 00 c3 40 00 40 06 1b 79 c0 a8 00 47 45 0a   .<..@.@..y...GE.
0020  18 87 cb 93 00 50 e9 bf c1 0f 00 00 00 00 a0 02   .....P..........
0030  40 00 5f fd 00 00 02 04 05 b4 01 03 03 00 01 01   @._.............
0040  08 0a 00 00 15 d7 00 00 00 00                     ..........

No.     Time                       Source                Destination           Protocol Length Info
      7 2012-10-11 23:31:25.245539 192.168.0.71          69.10.24.135          TCP      74     52114 > http [SYN] Seq=0 Win=16384 Len=0 MSS=1460 WS=1 TSval=5591 TSecr=0

Frame 7: 74 bytes on wire (592 bits), 74 bytes captured (592 bits)
    Arrival Time: Oct 11, 2012 23:31:25.245539000 GTB Standard Time
    Epoch Time: 1349987485.245539000 seconds
    [Time delta from previous captured frame: 0.000327000 seconds]
    [Time delta from previous displayed frame: 0.000327000 seconds]
    [Time since reference or first frame: 0.700782000 seconds]
    Frame Number: 7
    Frame Length: 74 bytes (592 bits)
    Capture Length: 74 bytes (592 bits)
    [Frame is marked: False]
    [Frame is ignored: False]
    [Protocols in frame: eth:ip:tcp]
    [Coloring Rule Name: HTTP]
    [Coloring Rule String: http || tcp.port == 80]
Ethernet II, Src: SonyComp_ea:13:f9 (00:19:c5:ea:13:f9), Dst: ZyxelCom_8d:62:30 (40:4a:03:8d:62:30)
    Destination: ZyxelCom_8d:62:30 (40:4a:03:8d:62:30)
        Address: ZyxelCom_8d:62:30 (40:4a:03:8d:62:30)
        .... ...0 .... .... .... .... = IG bit: Individual address (unicast)
        .... ..0. .... .... .... .... = LG bit: Globally unique address (factory default)
    Source: SonyComp_ea:13:f9 (00:19:c5:ea:13:f9)
        Address: SonyComp_ea:13:f9 (00:19:c5:ea:13:f9)
        .... ...0 .... .... .... .... = IG bit: Individual address (unicast)
        .... ..0. .... .... .... .... = LG bit: Globally unique address (factory default)
    Type: IP (0x0800)
Internet Protocol Version 4, Src: 192.168.0.71 (192.168.0.71), Dst: 69.10.24.135 (69.10.24.135)
    Version: 4
    Header length: 20 bytes
    Differentiated Services Field: 0x00 (DSCP 0x00: Default; ECN: 0x00: Not-ECT (Not ECN-Capable Transport))
        0000 00.. = Differentiated Services Codepoint: Default (0x00)
        .... ..00 = Explicit Congestion Notification: Not-ECT (Not ECN-Capable Transport) (0x00)
    Total Length: 60
    Identification: 0x00c4 (196)
    Flags: 0x02 (Don't Fragment)
        0... .... = Reserved bit: Not set
        .1.. .... = Don't fragment: Set
        ..0. .... = More fragments: Not set
    Fragment offset: 0
    Time to live: 64
    Protocol: TCP (6)
    Header checksum: 0x1b78 [correct]
        [Good: True]
        [Bad: False]
    Source: 192.168.0.71 (192.168.0.71)
    Destination: 69.10.24.135 (69.10.24.135)
Transmission Control Protocol, Src Port: 52114 (52114), Dst Port: http (80), Seq: 0, Len: 0
    Source port: 52114 (52114)
    Destination port: http (80)
    [Stream index: 3]
    Sequence number: 0    (relative sequence number)
    Header length: 40 bytes
    Flags: 0x002 (SYN)
        000. .... .... = Reserved: Not set
        ...0 .... .... = Nonce: Not set
        .... 0... .... = Congestion Window Reduced (CWR): Not set
        .... .0.. .... = ECN-Echo: Not set
        .... ..0. .... = Urgent: Not set
        .... ...0 .... = Acknowledgement: Not set
        .... .... 0... = Push: Not set
        .... .... .0.. = Reset: Not set
        .... .... ..1. = Syn: Set
            [Expert Info (Chat/Sequence): Connection establish request (SYN): server port http]
                [Message: Connection establish request (SYN): server port http]
                [Severity level: Chat]
                [Group: Sequence]
        .... .... ...0 = Fin: Not set
    Window size value: 16384
    [Calculated window size: 16384]
    Checksum: 0x3a92 [validation disabled]
        [Good Checksum: False]
        [Bad Checksum: False]
    Options: (20 bytes)
        Maximum segment size: 1460 bytes
        No-Operation (NOP)
        Window scale: 0 (multiply by 1)
            Kind: Window Scale (3)
            Length: 3
            Shift count: 0
            [Multiplier: 1]
        No-Operation (NOP)
        No-Operation (NOP)
        Timestamps: TSval 5591, TSecr 0
            Kind: Timestamp (8)
            Length: 10
            Timestamp value: 5591
            Timestamp echo reply: 0

0000  40 4a 03 8d 62 30 00 19 c5 ea 13 f9 08 00 45 00   @J..b0........E.
0010  00 3c 00 c4 40 00 40 06 1b 78 c0 a8 00 47 45 0a   .<..@.@..x...GE.
0020  18 87 cb 92 00 50 ea 1b e6 1f 00 00 00 00 a0 02   .....P..........
0030  40 00 3a 92 00 00 02 04 05 b4 01 03 03 00 01 01   @.:.............
0040  08 0a 00 00 15 d7 00 00 00 00                     ..........

No.     Time                       Source                Destination           Protocol Length Info
      8 2012-10-11 23:31:25.262555 192.168.0.71          69.10.30.242          TCP      66     52117 > 29900 [ACK] Seq=199 Ack=199 Win=17520 Len=0 TSval=5591 TSecr=16028886

Frame 8: 66 bytes on wire (528 bits), 66 bytes captured (528 bits)
    Arrival Time: Oct 11, 2012 23:31:25.262555000 GTB Standard Time
    Epoch Time: 1349987485.262555000 seconds
    [Time delta from previous captured frame: 0.017016000 seconds]
    [Time delta from previous displayed frame: 0.017016000 seconds]
    [Time since reference or first frame: 0.717798000 seconds]
    Frame Number: 8
    Frame Length: 66 bytes (528 bits)
    Capture Length: 66 bytes (528 bits)
    [Frame is marked: False]
    [Frame is ignored: False]
    [Protocols in frame: eth:ip:tcp]
    [Coloring Rule Name: TCP]
    [Coloring Rule String: tcp]
Ethernet II, Src: SonyComp_ea:13:f9 (00:19:c5:ea:13:f9), Dst: ZyxelCom_8d:62:30 (40:4a:03:8d:62:30)
    Destination: ZyxelCom_8d:62:30 (40:4a:03:8d:62:30)
        Address: ZyxelCom_8d:62:30 (40:4a:03:8d:62:30)
        .... ...0 .... .... .... .... = IG bit: Individual address (unicast)
        .... ..0. .... .... .... .... = LG bit: Globally unique address (factory default)
    Source: SonyComp_ea:13:f9 (00:19:c5:ea:13:f9)
        Address: SonyComp_ea:13:f9 (00:19:c5:ea:13:f9)
        .... ...0 .... .... .... .... = IG bit: Individual address (unicast)
        .... ..0. .... .... .... .... = LG bit: Globally unique address (factory default)
    Type: IP (0x0800)
Internet Protocol Version 4, Src: 192.168.0.71 (192.168.0.71), Dst: 69.10.30.242 (69.10.30.242)
    Version: 4
    Header length: 20 bytes
    Differentiated Services Field: 0x00 (DSCP 0x00: Default; ECN: 0x00: Not-ECT (Not ECN-Capable Transport))
        0000 00.. = Differentiated Services Codepoint: Default (0x00)
        .... ..00 = Explicit Congestion Notification: Not-ECT (Not ECN-Capable Transport) (0x00)
    Total Length: 52
    Identification: 0x00c5 (197)
    Flags: 0x02 (Don't Fragment)
        0... .... = Reserved bit: Not set
        .1.. .... = Don't fragment: Set
        ..0. .... = More fragments: Not set
    Fragment offset: 0
    Time to live: 64
    Protocol: TCP (6)
    Header checksum: 0x1514 [correct]
        [Good: True]
        [Bad: False]
    Source: 192.168.0.71 (192.168.0.71)
    Destination: 69.10.30.242 (69.10.30.242)
Transmission Control Protocol, Src Port: 52117 (52117), Dst Port: 29900 (29900), Seq: 199, Ack: 199, Len: 0
    Source port: 52117 (52117)
    Destination port: 29900 (29900)
    [Stream index: 0]
    Sequence number: 199    (relative sequence number)
    Acknowledgement number: 199    (relative ack number)
    Header length: 32 bytes
    Flags: 0x010 (ACK)
        000. .... .... = Reserved: Not set
        ...0 .... .... = Nonce: Not set
        .... 0... .... = Congestion Window Reduced (CWR): Not set
        .... .0.. .... = ECN-Echo: Not set
        .... ..0. .... = Urgent: Not set
        .... ...1 .... = Acknowledgement: Set
        .... .... 0... = Push: Not set
        .... .... .0.. = Reset: Not set
        .... .... ..0. = Syn: Not set
        .... .... ...0 = Fin: Not set
    Window size value: 17520
    [Calculated window size: 17520]
    [Window size scaling factor: 1]
    Checksum: 0xf79d [validation disabled]
        [Good Checksum: False]
        [Bad Checksum: False]
    Options: (12 bytes)
        No-Operation (NOP)
        No-Operation (NOP)
        Timestamps: TSval 5591, TSecr 16028886
            Kind: Timestamp (8)
            Length: 10
            Timestamp value: 5591
            Timestamp echo reply: 16028886

0000  40 4a 03 8d 62 30 00 19 c5 ea 13 f9 08 00 45 00   @J..b0........E.
0010  00 34 00 c5 40 00 40 06 15 14 c0 a8 00 47 45 0a   .4..@.@......GE.
0020  1e f2 cb 95 74 cc e6 ea b7 37 ac 56 df 46 80 10   ....t....7.V.F..
0030  44 70 f7 9d 00 00 01 01 08 0a 00 00 15 d7 00 f4   Dp..............
0040  94 d6                                             ..

No.     Time                       Source                Destination           Protocol Length Info
      9 2012-10-11 23:31:25.264778 192.168.0.71          69.10.30.242          TCP      254    52117 > 29900 [PSH, ACK] Seq=199 Ack=199 Win=17520 Len=188 TSval=5591 TSecr=16028886

Frame 9: 254 bytes on wire (2032 bits), 254 bytes captured (2032 bits)
    Arrival Time: Oct 11, 2012 23:31:25.264778000 GTB Standard Time
    Epoch Time: 1349987485.264778000 seconds
    [Time delta from previous captured frame: 0.002223000 seconds]
    [Time delta from previous displayed frame: 0.002223000 seconds]
    [Time since reference or first frame: 0.720021000 seconds]
    Frame Number: 9
    Frame Length: 254 bytes (2032 bits)
    Capture Length: 254 bytes (2032 bits)
    [Frame is marked: False]
    [Frame is ignored: False]
    [Protocols in frame: eth:ip:tcp:data]
    [Coloring Rule Name: TCP]
    [Coloring Rule String: tcp]
Ethernet II, Src: SonyComp_ea:13:f9 (00:19:c5:ea:13:f9), Dst: ZyxelCom_8d:62:30 (40:4a:03:8d:62:30)
    Destination: ZyxelCom_8d:62:30 (40:4a:03:8d:62:30)
        Address: ZyxelCom_8d:62:30 (40:4a:03:8d:62:30)
        .... ...0 .... .... .... .... = IG bit: Individual address (unicast)
        .... ..0. .... .... .... .... = LG bit: Globally unique address (factory default)
    Source: SonyComp_ea:13:f9 (00:19:c5:ea:13:f9)
        Address: SonyComp_ea:13:f9 (00:19:c5:ea:13:f9)
        .... ...0 .... .... .... .... = IG bit: Individual address (unicast)
        .... ..0. .... .... .... .... = LG bit: Globally unique address (factory default)
    Type: IP (0x0800)
Internet Protocol Version 4, Src: 192.168.0.71 (192.168.0.71), Dst: 69.10.30.242 (69.10.30.242)
    Version: 4
    Header length: 20 bytes
    Differentiated Services Field: 0x00 (DSCP 0x00: Default; ECN: 0x00: Not-ECT (Not ECN-Capable Transport))
        0000 00.. = Differentiated Services Codepoint: Default (0x00)
        .... ..00 = Explicit Congestion Notification: Not-ECT (Not ECN-Capable Transport) (0x00)
    Total Length: 240
    Identification: 0x00c6 (198)
    Flags: 0x02 (Don't Fragment)
        0... .... = Reserved bit: Not set
        .1.. .... = Don't fragment: Set
        ..0. .... = More fragments: Not set
    Fragment offset: 0
    Time to live: 64
    Protocol: TCP (6)
    Header checksum: 0x1457 [correct]
        [Good: True]
        [Bad: False]
    Source: 192.168.0.71 (192.168.0.71)
    Destination: 69.10.30.242 (69.10.30.242)
Transmission Control Protocol, Src Port: 52117 (52117), Dst Port: 29900 (29900), Seq: 199, Ack: 199, Len: 188
    Source port: 52117 (52117)
    Destination port: 29900 (29900)
    [Stream index: 0]
    Sequence number: 199    (relative sequence number)
    [Next sequence number: 387    (relative sequence number)]
    Acknowledgement number: 199    (relative ack number)
    Header length: 32 bytes
    Flags: 0x018 (PSH, ACK)
        000. .... .... = Reserved: Not set
        ...0 .... .... = Nonce: Not set
        .... 0... .... = Congestion Window Reduced (CWR): Not set
        .... .0.. .... = ECN-Echo: Not set
        .... ..0. .... = Urgent: Not set
        .... ...1 .... = Acknowledgement: Set
        .... .... 1... = Push: Set
        .... .... .0.. = Reset: Not set
        .... .... ..0. = Syn: Not set
        .... .... ...0 = Fin: Not set
    Window size value: 17520
    [Calculated window size: 17520]
    [Window size scaling factor: 1]
    Checksum: 0x2407 [validation disabled]
        [Good Checksum: False]
        [Bad Checksum: False]
    Options: (12 bytes)
        No-Operation (NOP)
        No-Operation (NOP)
        Timestamps: TSval 5591, TSecr 16028886
            Kind: Timestamp (8)
            Length: 10
            Timestamp value: 5591
            Timestamp echo reply: 16028886
    [SEQ/ACK analysis]
        [Bytes in flight: 387]
Data (188 bytes)
    Data: 5c696e76697465746f5c5c736573736b65795c3533333238...
    [Length: 188]

0000  40 4a 03 8d 62 30 00 19 c5 ea 13 f9 08 00 45 00   @J..b0........E.
0010  00 f0 00 c6 40 00 40 06 14 57 c0 a8 00 47 45 0a   ....@.@..W...GE.
0020  1e f2 cb 95 74 cc e6 ea b7 37 ac 56 df 46 80 18   ....t....7.V.F..
0030  44 70 24 07 00 00 01 01 08 0a 00 00 15 d7 00 f4   Dp$.............
0040  94 d6 5c 69 6e 76 69 74 65 74 6f 5c 5c 73 65 73   ..\inviteto\\ses
0050  73 6b 65 79 5c 35 33 33 32 38 39 36 37 5c 70 72   skey\53328967\pr
0060  6f 64 75 63 74 73 5c 31 30 33 30 37 5c 66 69 6e   oducts\10307\fin
0070  61 6c 5c 5c 67 65 74 70 72 6f 66 69 6c 65 5c 5c   al\\getprofile\\
0080  73 65 73 73 6b 65 79 5c 35 33 33 32 38 39 36 37   sesskey\53328967
0090  5c 70 72 6f 66 69 6c 65 69 64 5c 34 31 31 30 31   \profileid\41101
00a0  30 37 30 32 5c 69 64 5c 34 5c 66 69 6e 61 6c 5c   0702\id\4\final\
00b0  5c 73 74 61 74 75 73 5c 31 5c 73 65 73 73 6b 65   \status\1\sesske
00c0  79 5c 35 33 33 32 38 39 36 37 5c 73 74 61 74 73   y\53328967\stats
00d0  74 72 69 6e 67 5c 52 65 73 74 69 6e 67 5c 6c 6f   tring\Resting\lo
00e0  63 73 74 72 69 6e 67 5c 62 66 69 65 6c 64 31 39   cstring\bfield19
00f0  34 32 70 73 32 3a 2f 5c 66 69 6e 61 6c 5c         42ps2:/\final\

No.     Time                       Source                Destination           Protocol Length Info
     10 2012-10-11 23:31:25.265170 192.168.0.71          69.10.24.135          TCP      74     52113 > http [SYN] Seq=0 Win=16384 Len=0 MSS=1460 WS=1 TSval=5591 TSecr=0

Frame 10: 74 bytes on wire (592 bits), 74 bytes captured (592 bits)
    Arrival Time: Oct 11, 2012 23:31:25.265170000 GTB Standard Time
    Epoch Time: 1349987485.265170000 seconds
    [Time delta from previous captured frame: 0.000392000 seconds]
    [Time delta from previous displayed frame: 0.000392000 seconds]
    [Time since reference or first frame: 0.720413000 seconds]
    Frame Number: 10
    Frame Length: 74 bytes (592 bits)
    Capture Length: 74 bytes (592 bits)
    [Frame is marked: False]
    [Frame is ignored: False]
    [Protocols in frame: eth:ip:tcp]
    [Coloring Rule Name: HTTP]
    [Coloring Rule String: http || tcp.port == 80]
Ethernet II, Src: SonyComp_ea:13:f9 (00:19:c5:ea:13:f9), Dst: ZyxelCom_8d:62:30 (40:4a:03:8d:62:30)
    Destination: ZyxelCom_8d:62:30 (40:4a:03:8d:62:30)
        Address: ZyxelCom_8d:62:30 (40:4a:03:8d:62:30)
        .... ...0 .... .... .... .... = IG bit: Individual address (unicast)
        .... ..0. .... .... .... .... = LG bit: Globally unique address (factory default)
    Source: SonyComp_ea:13:f9 (00:19:c5:ea:13:f9)
        Address: SonyComp_ea:13:f9 (00:19:c5:ea:13:f9)
        .... ...0 .... .... .... .... = IG bit: Individual address (unicast)
        .... ..0. .... .... .... .... = LG bit: Globally unique address (factory default)
    Type: IP (0x0800)
Internet Protocol Version 4, Src: 192.168.0.71 (192.168.0.71), Dst: 69.10.24.135 (69.10.24.135)
    Version: 4
    Header length: 20 bytes
    Differentiated Services Field: 0x00 (DSCP 0x00: Default; ECN: 0x00: Not-ECT (Not ECN-Capable Transport))
        0000 00.. = Differentiated Services Codepoint: Default (0x00)
        .... ..00 = Explicit Congestion Notification: Not-ECT (Not ECN-Capable Transport) (0x00)
    Total Length: 60
    Identification: 0x00c7 (199)
    Flags: 0x02 (Don't Fragment)
        0... .... = Reserved bit: Not set
        .1.. .... = Don't fragment: Set
        ..0. .... = More fragments: Not set
    Fragment offset: 0
    Time to live: 64
    Protocol: TCP (6)
    Header checksum: 0x1b75 [correct]
        [Good: True]
        [Bad: False]
    Source: 192.168.0.71 (192.168.0.71)
    Destination: 69.10.24.135 (69.10.24.135)
Transmission Control Protocol, Src Port: 52113 (52113), Dst Port: http (80), Seq: 0, Len: 0
    Source port: 52113 (52113)
    Destination port: http (80)
    [Stream index: 4]
    Sequence number: 0    (relative sequence number)
    Header length: 40 bytes
    Flags: 0x002 (SYN)
        000. .... .... = Reserved: Not set
        ...0 .... .... = Nonce: Not set
        .... 0... .... = Congestion Window Reduced (CWR): Not set
        .... .0.. .... = ECN-Echo: Not set
        .... ..0. .... = Urgent: Not set
        .... ...0 .... = Acknowledgement: Not set
        .... .... 0... = Push: Not set
        .... .... .0.. = Reset: Not set
        .... .... ..1. = Syn: Set
