No.     Time                       Source                Destination           Protocol Length Info
     55 2012-10-11 22:00:27.872835 192.168.0.71          62.148.192.130        DNS      89     Standard query A gate1.eu.dnas.playstation.org

Frame 55: 89 bytes on wire (712 bits), 89 bytes captured (712 bits)
    Arrival Time: Oct 11, 2012 22:00:27.872835000 GTB Standard Time
    Epoch Time: 1349982027.872835000 seconds
    [Time delta from previous captured frame: 0.000333000 seconds]
    [Time delta from previous displayed frame: 0.000000000 seconds]
    [Time since reference or first frame: 695.584938000 seconds]
    Frame Number: 55
    Frame Length: 89 bytes (712 bits)
    Capture Length: 89 bytes (712 bits)
    [Frame is marked: False]
    [Frame is ignored: False]
    [Protocols in frame: eth:ip:udp:dns]
    [Coloring Rule Name: UDP]
    [Coloring Rule String: udp]
Ethernet II, Src: SonyComp_ea:13:f9 (00:19:c5:ea:13:f9), Dst: ZyxelCom_8d:62:30 (40:4a:03:8d:62:30)
    Destination: ZyxelCom_8d:62:30 (40:4a:03:8d:62:30)
        Address: ZyxelCom_8d:62:30 (40:4a:03:8d:62:30)
        .... ...0 .... .... .... .... = IG bit: Individual address (unicast)
        .... ..0. .... .... .... .... = LG bit: Globally unique address (factory default)
    Source: SonyComp_ea:13:f9 (00:19:c5:ea:13:f9)
        Address: SonyComp_ea:13:f9 (00:19:c5:ea:13:f9)
        .... ...0 .... .... .... .... = IG bit: Individual address (unicast)
        .... ..0. .... .... .... .... = LG bit: Globally unique address (factory default)
    Type: IP (0x0800)
Internet Protocol Version 4, Src: 192.168.0.71 (192.168.0.71), Dst: 62.148.192.130 (62.148.192.130)
    Version: 4
    Header length: 20 bytes
    Differentiated Services Field: 0x00 (DSCP 0x00: Default; ECN: 0x00: Not-ECT (Not ECN-Capable Transport))
        0000 00.. = Differentiated Services Codepoint: Default (0x00)
        .... ..00 = Explicit Congestion Notification: Not-ECT (Not ECN-Capable Transport) (0x00)
    Total Length: 75
    Identification: 0x0000 (0)
    Flags: 0x00
        0... .... = Reserved bit: Not set
        .0.. .... = Don't fragment: Not set
        ..0. .... = More fragments: Not set
    Fragment offset: 0
    Time to live: 64
    Protocol: UDP (17)
    Header checksum: 0xba9c [correct]
        [Good: True]
        [Bad: False]
    Source: 192.168.0.71 (192.168.0.71)
    Destination: 62.148.192.130 (62.148.192.130)
User Datagram Protocol, Src Port: 55833 (55833), Dst Port: domain (53)
    Source port: 55833 (55833)
    Destination port: domain (53)
    Length: 55
    Checksum: 0x3de6 [validation disabled]
        [Good Checksum: False]
        [Bad Checksum: False]
Domain Name System (query)
    Transaction ID: 0x5b97
    Flags: 0x0100 (Standard query)
        0... .... .... .... = Response: Message is a query
        .000 0... .... .... = Opcode: Standard query (0)
        .... ..0. .... .... = Truncated: Message is not truncated
        .... ...1 .... .... = Recursion desired: Do query recursively
        .... .... .0.. .... = Z: reserved (0)
        .... .... ...0 .... = Non-authenticated data: Unacceptable
    Questions: 1
    Answer RRs: 0
    Authority RRs: 0
    Additional RRs: 0
    Queries
        gate1.eu.dnas.playstation.org: type A, class IN
            Name: gate1.eu.dnas.playstation.org
            Type: A (Host address)
            Class: IN (0x0001)

0000  40 4a 03 8d 62 30 00 19 c5 ea 13 f9 08 00 45 00   @J..b0........E.
0010  00 4b 00 00 00 00 40 11 ba 9c c0 a8 00 47 3e 94   .K....@......G>.
0020  c0 82 da 19 00 35 00 37 3d e6 5b 97 01 00 00 01   .....5.7=.[.....
0030  00 00 00 00 00 00 05 67 61 74 65 31 02 65 75 04   .......gate1.eu.
0040  64 6e 61 73 0b 70 6c 61 79 73 74 61 74 69 6f 6e   dnas.playstation
0050  03 6f 72 67 00 00 01 00 01                        .org.....

No.     Time                       Source                Destination           Protocol Length Info
     57 2012-10-11 22:00:28.128666 192.168.0.71          203.105.78.164        TCP      74     58638 > https [SYN] Seq=0 Win=16384 Len=0 MSS=1460 WS=1 TSval=3791 TSecr=0

Frame 57: 74 bytes on wire (592 bits), 74 bytes captured (592 bits)
    Arrival Time: Oct 11, 2012 22:00:28.128666000 GTB Standard Time
    Epoch Time: 1349982028.128666000 seconds
    [Time delta from previous captured frame: 0.000843000 seconds]
    [Time delta from previous displayed frame: 0.255831000 seconds]
    [Time since reference or first frame: 695.840769000 seconds]
    Frame Number: 57
    Frame Length: 74 bytes (592 bits)
    Capture Length: 74 bytes (592 bits)
    [Frame is marked: False]
    [Frame is ignored: False]
    [Protocols in frame: eth:ip:tcp]
    [Coloring Rule Name: TCP SYN/FIN]
    [Coloring Rule String: tcp.flags & 0x02 || tcp.flags.fin == 1]
Ethernet II, Src: SonyComp_ea:13:f9 (00:19:c5:ea:13:f9), Dst: ZyxelCom_8d:62:30 (40:4a:03:8d:62:30)
    Destination: ZyxelCom_8d:62:30 (40:4a:03:8d:62:30)
        Address: ZyxelCom_8d:62:30 (40:4a:03:8d:62:30)
        .... ...0 .... .... .... .... = IG bit: Individual address (unicast)
        .... ..0. .... .... .... .... = LG bit: Globally unique address (factory default)
    Source: SonyComp_ea:13:f9 (00:19:c5:ea:13:f9)
        Address: SonyComp_ea:13:f9 (00:19:c5:ea:13:f9)
        .... ...0 .... .... .... .... = IG bit: Individual address (unicast)
        .... ..0. .... .... .... .... = LG bit: Globally unique address (factory default)
    Type: IP (0x0800)
Internet Protocol Version 4, Src: 192.168.0.71 (192.168.0.71), Dst: 203.105.78.164 (203.105.78.164)
    Version: 4
    Header length: 20 bytes
    Differentiated Services Field: 0x00 (DSCP 0x00: Default; ECN: 0x00: Not-ECT (Not ECN-Capable Transport))
        0000 00.. = Differentiated Services Codepoint: Default (0x00)
        .... ..00 = Explicit Congestion Notification: Not-ECT (Not ECN-Capable Transport) (0x00)
    Total Length: 60
    Identification: 0x0001 (1)
    Flags: 0x02 (Don't Fragment)
        0... .... = Reserved bit: Not set
        .1.. .... = Don't fragment: Set
        ..0. .... = More fragments: Not set
    Fragment offset: 0
    Time to live: 64
    Protocol: TCP (6)
    Header checksum: 0x5fbe [correct]
        [Good: True]
        [Bad: False]
    Source: 192.168.0.71 (192.168.0.71)
    Destination: 203.105.78.164 (203.105.78.164)
Transmission Control Protocol, Src Port: 58638 (58638), Dst Port: https (443), Seq: 0, Len: 0
    Source port: 58638 (58638)
    Destination port: https (443)
    [Stream index: 3]
    Sequence number: 0    (relative sequence number)
    Header length: 40 bytes
    Flags: 0x002 (SYN)
        000. .... .... = Reserved: Not set
        ...0 .... .... = Nonce: Not set
        .... 0... .... = Congestion Window Reduced (CWR): Not set
        .... .0.. .... = ECN-Echo: Not set
        .... ..0. .... = Urgent: Not set
        .... ...0 .... = Acknowledgement: Not set
        .... .... 0... = Push: Not set
        .... .... .0.. = Reset: Not set
        .... .... ..1. = Syn: Set
            [Expert Info (Chat/Sequence): Connection establish request (SYN): server port https]
                [Message: Connection establish request (SYN): server port https]
                [Severity level: Chat]
                [Group: Sequence]
        .... .... ...0 = Fin: Not set
    Window size value: 16384
    [Calculated window size: 16384]
    Checksum: 0x37c4 [validation disabled]
        [Good Checksum: False]
        [Bad Checksum: False]
    Options: (20 bytes)
        Maximum segment size: 1460 bytes
        No-Operation (NOP)
        Window scale: 0 (multiply by 1)
            Kind: Window Scale (3)
            Length: 3
            Shift count: 0
            [Multiplier: 1]
        No-Operation (NOP)
        No-Operation (NOP)
        Timestamps: TSval 3791, TSecr 0
            Kind: Timestamp (8)
            Length: 10
            Timestamp value: 3791
            Timestamp echo reply: 0

0000  40 4a 03 8d 62 30 00 19 c5 ea 13 f9 08 00 45 00   @J..b0........E.
0010  00 3c 00 01 40 00 40 06 5f be c0 a8 00 47 cb 69   .<..@.@._....G.i
0020  4e a4 e5 0e 01 bb cf 57 33 56 00 00 00 00 a0 02   N......W3V......
0030  40 00 37 c4 00 00 02 04 05 b4 01 03 03 00 01 01   @.7.............
0040  08 0a 00 00 0e cf 00 00 00 00                     ..........

No.     Time                       Source                Destination           Protocol Length Info
     58 2012-10-11 22:00:28.440058 192.168.0.71          203.105.78.164        TCP      66     58638 > https [ACK] Seq=1 Ack=1 Win=17520 Len=0 TSval=3792 TSecr=189240938

Frame 58: 66 bytes on wire (528 bits), 66 bytes captured (528 bits)
    Arrival Time: Oct 11, 2012 22:00:28.440058000 GTB Standard Time
    Epoch Time: 1349982028.440058000 seconds
    [Time delta from previous captured frame: 0.311392000 seconds]
    [Time delta from previous displayed frame: 0.311392000 seconds]
    [Time since reference or first frame: 696.152161000 seconds]
    Frame Number: 58
    Frame Length: 66 bytes (528 bits)
    Capture Length: 66 bytes (528 bits)
    [Frame is marked: False]
    [Frame is ignored: False]
    [Protocols in frame: eth:ip:tcp]
    [Coloring Rule Name: TCP]
    [Coloring Rule String: tcp]
Ethernet II, Src: SonyComp_ea:13:f9 (00:19:c5:ea:13:f9), Dst: ZyxelCom_8d:62:30 (40:4a:03:8d:62:30)
    Destination: ZyxelCom_8d:62:30 (40:4a:03:8d:62:30)
        Address: ZyxelCom_8d:62:30 (40:4a:03:8d:62:30)
        .... ...0 .... .... .... .... = IG bit: Individual address (unicast)
        .... ..0. .... .... .... .... = LG bit: Globally unique address (factory default)
    Source: SonyComp_ea:13:f9 (00:19:c5:ea:13:f9)
        Address: SonyComp_ea:13:f9 (00:19:c5:ea:13:f9)
        .... ...0 .... .... .... .... = IG bit: Individual address (unicast)
        .... ..0. .... .... .... .... = LG bit: Globally unique address (factory default)
    Type: IP (0x0800)
Internet Protocol Version 4, Src: 192.168.0.71 (192.168.0.71), Dst: 203.105.78.164 (203.105.78.164)
    Version: 4
    Header length: 20 bytes
    Differentiated Services Field: 0x00 (DSCP 0x00: Default; ECN: 0x00: Not-ECT (Not ECN-Capable Transport))
        0000 00.. = Differentiated Services Codepoint: Default (0x00)
        .... ..00 = Explicit Congestion Notification: Not-ECT (Not ECN-Capable Transport) (0x00)
    Total Length: 52
    Identification: 0x0002 (2)
    Flags: 0x02 (Don't Fragment)
        0... .... = Reserved bit: Not set
        .1.. .... = Don't fragment: Set
        ..0. .... = More fragments: Not set
    Fragment offset: 0
    Time to live: 64
    Protocol: TCP (6)
    Header checksum: 0x5fc5 [correct]
        [Good: True]
        [Bad: False]
    Source: 192.168.0.71 (192.168.0.71)
    Destination: 203.105.78.164 (203.105.78.164)
Transmission Control Protocol, Src Port: 58638 (58638), Dst Port: https (443), Seq: 1, Ack: 1, Len: 0
    Source port: 58638 (58638)
    Destination port: https (443)
    [Stream index: 3]
    Sequence number: 1    (relative sequence number)
    Acknowledgement number: 1    (relative ack number)
    Header length: 32 bytes
    Flags: 0x010 (ACK)
        000. .... .... = Reserved: Not set
        ...0 .... .... = Nonce: Not set
        .... 0... .... = Congestion Window Reduced (CWR): Not set
        .... .0.. .... = ECN-Echo: Not set
        .... ..0. .... = Urgent: Not set
        .... ...1 .... = Acknowledgement: Set
        .... .... 0... = Push: Not set
        .... .... .0.. = Reset: Not set
        .... .... ..0. = Syn: Not set
        .... .... ...0 = Fin: Not set
    Window size value: 17520
    [Calculated window size: 17520]
    [Window size scaling factor: 1]
    Checksum: 0xede4 [validation disabled]
        [Good Checksum: False]
        [Bad Checksum: False]
    Options: (12 bytes)
        No-Operation (NOP)
        No-Operation (NOP)
        Timestamps: TSval 3792, TSecr 189240938
            Kind: Timestamp (8)
            Length: 10
            Timestamp value: 3792
            Timestamp echo reply: 189240938

0000  40 4a 03 8d 62 30 00 19 c5 ea 13 f9 08 00 45 00   @J..b0........E.
0010  00 34 00 02 40 00 40 06 5f c5 c0 a8 00 47 cb 69   .4..@.@._....G.i
0020  4e a4 e5 0e 01 bb cf 57 33 57 90 f9 3e 77 80 10   N......W3W..>w..
0030  44 70 ed e4 00 00 01 01 08 0a 00 00 0e d0 0b 47   Dp.............G
0040  96 6a                                             .j

No.     Time                       Source                Destination           Protocol Length Info
     59 2012-10-11 22:00:28.441306 192.168.0.71          203.105.78.164        SSLv2    168    Client Hello

Frame 59: 168 bytes on wire (1344 bits), 168 bytes captured (1344 bits)
    Arrival Time: Oct 11, 2012 22:00:28.441306000 GTB Standard Time
    Epoch Time: 1349982028.441306000 seconds
    [Time delta from previous captured frame: 0.001248000 seconds]
    [Time delta from previous displayed frame: 0.001248000 seconds]
    [Time since reference or first frame: 696.153409000 seconds]
    Frame Number: 59
    Frame Length: 168 bytes (1344 bits)
    Capture Length: 168 bytes (1344 bits)
    [Frame is marked: False]
    [Frame is ignored: False]
    [Protocols in frame: eth:ip:tcp:ssl]
    [Coloring Rule Name: TCP]
    [Coloring Rule String: tcp]
Ethernet II, Src: SonyComp_ea:13:f9 (00:19:c5:ea:13:f9), Dst: ZyxelCom_8d:62:30 (40:4a:03:8d:62:30)
    Destination: ZyxelCom_8d:62:30 (40:4a:03:8d:62:30)
        Address: ZyxelCom_8d:62:30 (40:4a:03:8d:62:30)
        .... ...0 .... .... .... .... = IG bit: Individual address (unicast)
        .... ..0. .... .... .... .... = LG bit: Globally unique address (factory default)
    Source: SonyComp_ea:13:f9 (00:19:c5:ea:13:f9)
        Address: SonyComp_ea:13:f9 (00:19:c5:ea:13:f9)
        .... ...0 .... .... .... .... = IG bit: Individual address (unicast)
        .... ..0. .... .... .... .... = LG bit: Globally unique address (factory default)
    Type: IP (0x0800)
Internet Protocol Version 4, Src: 192.168.0.71 (192.168.0.71), Dst: 203.105.78.164 (203.105.78.164)
    Version: 4
    Header length: 20 bytes
    Differentiated Services Field: 0x00 (DSCP 0x00: Default; ECN: 0x00: Not-ECT (Not ECN-Capable Transport))
        0000 00.. = Differentiated Services Codepoint: Default (0x00)
        .... ..00 = Explicit Congestion Notification: Not-ECT (Not ECN-Capable Transport) (0x00)
    Total Length: 154
    Identification: 0x0003 (3)
    Flags: 0x02 (Don't Fragment)
        0... .... = Reserved bit: Not set
        .1.. .... = Don't fragment: Set
        ..0. .... = More fragments: Not set
    Fragment offset: 0
    Time to live: 64
    Protocol: TCP (6)
    Header checksum: 0x5f5e [correct]
        [Good: True]
        [Bad: False]
    Source: 192.168.0.71 (192.168.0.71)
    Destination: 203.105.78.164 (203.105.78.164)
Transmission Control Protocol, Src Port: 58638 (58638), Dst Port: https (443), Seq: 1, Ack: 1, Len: 102
    Source port: 58638 (58638)
    Destination port: https (443)
    [Stream index: 3]
    Sequence number: 1    (relative sequence number)
    [Next sequence number: 103    (relative sequence number)]
    Acknowledgement number: 1    (relative ack number)
    Header length: 32 bytes
    Flags: 0x018 (PSH, ACK)
        000. .... .... = Reserved: Not set
        ...0 .... .... = Nonce: Not set
        .... 0... .... = Congestion Window Reduced (CWR): Not set
        .... .0.. .... = ECN-Echo: Not set
        .... ..0. .... = Urgent: Not set
        .... ...1 .... = Acknowledgement: Set
        .... .... 1... = Push: Set
        .... .... .0.. = Reset: Not set
        .... .... ..0. = Syn: Not set
        .... .... ...0 = Fin: Not set
    Window size value: 17520
    [Calculated window size: 17520]
    [Window size scaling factor: 1]
    Checksum: 0x8802 [validation disabled]
        [Good Checksum: False]
        [Bad Checksum: False]
    Options: (12 bytes)
        No-Operation (NOP)
        No-Operation (NOP)
        Timestamps: TSval 3792, TSecr 189240938
            Kind: Timestamp (8)
            Length: 10
            Timestamp value: 3792
            Timestamp echo reply: 189240938
    [SEQ/ACK analysis]
        [Bytes in flight: 103]
Secure Sockets Layer
    SSLv2 Record Layer: Client Hello
        [Version: SSL 2.0 (0x0002)]
        Length: 100
        Handshake Message Type: Client Hello (1)
        Version: TLS 1.0 (0x0301)
        Cipher Spec Length: 75
        Session ID Length: 0
        Challenge Length: 16
        Cipher Specs (25 specs)
            Cipher Spec: TLS_DHE_DSS_WITH_RC4_128_SHA (0x000066)
            Cipher Spec: TLS_DHE_RSA_WITH_3DES_EDE_CBC_SHA (0x000016)
            Cipher Spec: TLS_DHE_DSS_WITH_3DES_EDE_CBC_SHA (0x000013)
            Cipher Spec: TLS_RSA_WITH_3DES_EDE_CBC_SHA (0x00000a)
            Cipher Spec: TLS_RSA_WITH_RC4_128_SHA (0x000005)
            Cipher Spec: TLS_RSA_WITH_RC4_128_MD5 (0x000004)
            Cipher Spec: TLS_DHE_RSA_WITH_DES_CBC_SHA (0x000015)
            Cipher Spec: TLS_DHE_DSS_WITH_DES_CBC_SHA (0x000012)
            Cipher Spec: TLS_RSA_WITH_DES_CBC_SHA (0x000009)
            Cipher Spec: SSL2_DES_192_EDE3_CBC_WITH_MD5 (0x0700c0)
            Cipher Spec: SSL2_RC2_CBC_128_CBC_WITH_MD5 (0x030080)
            Cipher Spec: SSL2_RC4_128_WITH_MD5 (0x010080)
            Cipher Spec: SSL2_DES_64_CBC_WITH_MD5 (0x060040)
            Cipher Spec: TLS_DHE_DSS_EXPORT1024_WITH_DES_CBC_SHA (0x000063)
            Cipher Spec: TLS_DHE_DSS_EXPORT1024_WITH_RC4_56_SHA (0x000065)
            Cipher Spec: TLS_RSA_EXPORT1024_WITH_DES_CBC_SHA (0x000062)
            Cipher Spec: TLS_RSA_EXPORT1024_WITH_RC4_56_SHA (0x000064)
            Cipher Spec: TLS_DHE_RSA_EXPORT_WITH_DES40_CBC_SHA (0x000014)
            Cipher Spec: TLS_DHE_DSS_EXPORT_WITH_DES40_CBC_SHA (0x000011)
            Cipher Spec: TLS_RSA_EXPORT_WITH_DES40_CBC_SHA (0x000008)
            Cipher Spec: TLS_RSA_EXPORT_WITH_RC2_CBC_40_MD5 (0x000006)
            Cipher Spec: TLS_RSA_EXPORT_WITH_RC4_40_MD5 (0x000003)
            Cipher Spec: SSL2_RC2_CBC_128_CBC_WITH_MD5 (0x040080)
            Cipher Spec: SSL2_RC4_128_EXPORT40_WITH_MD5 (0x020080)
            Cipher Spec: SSL2_RC4_64_WITH_MD5 (0x080080)
        Challenge

0000  40 4a 03 8d 62 30 00 19 c5 ea 13 f9 08 00 45 00   @J..b0........E.
0010  00 9a 00 03 40 00 40 06 5f 5e c0 a8 00 47 cb 69   ....@.@._^...G.i
0020  4e a4 e5 0e 01 bb cf 57 33 57 90 f9 3e 77 80 18   N......W3W..>w..
0030  44 70 88 02 00 00 01 01 08 0a 00 00 0e d0 0b 47   Dp.............G
0040  96 6a 80 64 01 03 01 00 4b 00 00 00 10 00 00 66   .j.d....K......f
0050  00 00 16 00 00 13 00 00 0a 00 00 05 00 00 04 00   ................
0060  00 15 00 00 12 00 00 09 07 00 c0 03 00 80 01 00   ................
0070  80 06 00 40 00 00 63 00 00 65 00 00 62 00 00 64   ...@..c..e..b..d
0080  00 00 14 00 00 11 00 00 08 00 00 06 00 00 03 04   ................
0090  00 80 02 00 80 08 00 80 34 9d 0d dc 46 11 d5 8d   ........4...F...
00a0  81 79 38 ab 00 1c 88 5f                           .y8...._

No.     Time                       Source                Destination           Protocol Length Info
     60 2012-10-11 22:00:28.755807 192.168.0.71          203.105.78.164        TCP      66     58638 > https [ACK] Seq=103 Ack=2182 Win=15346 Len=0 TSval=3793 TSecr=189241253

Frame 60: 66 bytes on wire (528 bits), 66 bytes captured (528 bits)
    Arrival Time: Oct 11, 2012 22:00:28.755807000 GTB Standard Time
    Epoch Time: 1349982028.755807000 seconds
    [Time delta from previous captured frame: 0.314501000 seconds]
    [Time delta from previous displayed frame: 0.314501000 seconds]
    [Time since reference or first frame: 696.467910000 seconds]
    Frame Number: 60
    Frame Length: 66 bytes (528 bits)
    Capture Length: 66 bytes (528 bits)
    [Frame is marked: False]
    [Frame is ignored: False]
    [Protocols in frame: eth:ip:tcp]
    [Coloring Rule Name: TCP]
    [Coloring Rule String: tcp]
Ethernet II, Src: SonyComp_ea:13:f9 (00:19:c5:ea:13:f9), Dst: ZyxelCom_8d:62:30 (40:4a:03:8d:62:30)
    Destination: ZyxelCom_8d:62:30 (40:4a:03:8d:62:30)
        Address: ZyxelCom_8d:62:30 (40:4a:03:8d:62:30)
        .... ...0 .... .... .... .... = IG bit: Individual address (unicast)
        .... ..0. .... .... .... .... = LG bit: Globally unique address (factory default)
    Source: SonyComp_ea:13:f9 (00:19:c5:ea:13:f9)
        Address: SonyComp_ea:13:f9 (00:19:c5:ea:13:f9)
        .... ...0 .... .... .... .... = IG bit: Individual address (unicast)
        .... ..0. .... .... .... .... = LG bit: Globally unique address (factory default)
    Type: IP (0x0800)
Internet Protocol Version 4, Src: 192.168.0.71 (192.168.0.71), Dst: 203.105.78.164 (203.105.78.164)
    Version: 4
    Header length: 20 bytes
    Differentiated Services Field: 0x00 (DSCP 0x00: Default; ECN: 0x00: Not-ECT (Not ECN-Capable Transport))
        0000 00.. = Differentiated Services Codepoint: Default (0x00)
        .... ..00 = Explicit Congestion Notification: Not-ECT (Not ECN-Capable Transport) (0x00)
    Total Length: 52
    Identification: 0x0004 (4)
    Flags: 0x02 (Don't Fragment)
        0... .... = Reserved bit: Not set
        .1.. .... = Don't fragment: Set
        ..0. .... = More fragments: Not set
    Fragment offset: 0
    Time to live: 64
    Protocol: TCP (6)
    Header checksum: 0x5fc3 [correct]
        [Good: True]
        [Bad: False]
    Source: 192.168.0.71 (192.168.0.71)
    Destination: 203.105.78.164 (203.105.78.164)
Transmission Control Protocol, Src Port: 58638 (58638), Dst Port: https (443), Seq: 103, Ack: 2182, Len: 0
    Source port: 58638 (58638)
    Destination port: https (443)
    [Stream index: 3]
    Sequence number: 103    (relative sequence number)
    Acknowledgement number: 2182    (relative ack number)
    Header length: 32 bytes
    Flags: 0x010 (ACK)
        000. .... .... = Reserved: Not set
        ...0 .... .... = Nonce: Not set
        .... 0... .... = Congestion Window Reduced (CWR): Not set
        .... .0.. .... = ECN-Echo: Not set
        .... ..0. .... = Urgent: Not set
        .... ...1 .... = Acknowledgement: Set
        .... .... 0... = Push: Not set
        .... .... .0.. = Reset: Not set
        .... .... ..0. = Syn: Not set
        .... .... ...0 = Fin: Not set
    Window size value: 15346
    [Calculated window size: 15346]
    [Window size scaling factor: 1]
    Checksum: 0xec3b [validation disabled]
        [Good Checksum: False]
        [Bad Checksum: False]
    Options: (12 bytes)
        No-Operation (NOP)
        No-Operation (NOP)
        Timestamps: TSval 3793, TSecr 189241253
            Kind: Timestamp (8)
            Length: 10
            Timestamp value: 3793
            Timestamp echo reply: 189241253

0000  40 4a 03 8d 62 30 00 19 c5 ea 13 f9 08 00 45 00   @J..b0........E.
0010  00 34 00 04 40 00 40 06 5f c3 c0 a8 00 47 cb 69   .4..@.@._....G.i
0020  4e a4 e5 0e 01 bb cf 57 33 bd 90 f9 46 fc 80 10   N......W3...F...
0030  3b f2 ec 3b 00 00 01 01 08 0a 00 00 0e d1 0b 47   ;..;...........G
0040  97 a5                                             ..

No.     Time                       Source                Destination           Protocol Length Info
     61 2012-10-11 22:00:28.778808 192.168.0.71          203.105.78.164        TLSv1    256    Client Key Exchange, Change Cipher Spec, Encrypted Handshake Message

Frame 61: 256 bytes on wire (2048 bits), 256 bytes captured (2048 bits)
    Arrival Time: Oct 11, 2012 22:00:28.778808000 GTB Standard Time
    Epoch Time: 1349982028.778808000 seconds
    [Time delta from previous captured frame: 0.023001000 seconds]
    [Time delta from previous displayed frame: 0.023001000 seconds]
    [Time since reference or first frame: 696.490911000 seconds]
    Frame Number: 61
    Frame Length: 256 bytes (2048 bits)
    Capture Length: 256 bytes (2048 bits)
    [Frame is marked: False]
    [Frame is ignored: False]
    [Protocols in frame: eth:ip:tcp:ssl]
    [Coloring Rule Name: TCP]
    [Coloring Rule String: tcp]
Ethernet II, Src: SonyComp_ea:13:f9 (00:19:c5:ea:13:f9), Dst: ZyxelCom_8d:62:30 (40:4a:03:8d:62:30)
    Destination: ZyxelCom_8d:62:30 (40:4a:03:8d:62:30)
        Address: ZyxelCom_8d:62:30 (40:4a:03:8d:62:30)
        .... ...0 .... .... .... .... = IG bit: Individual address (unicast)
        .... ..0. .... .... .... .... = LG bit: Globally unique address (factory default)
    Source: SonyComp_ea:13:f9 (00:19:c5:ea:13:f9)
        Address: SonyComp_ea:13:f9 (00:19:c5:ea:13:f9)
        .... ...0 .... .... .... .... = IG bit: Individual address (unicast)
        .... ..0. .... .... .... .... = LG bit: Globally unique address (factory default)
    Type: IP (0x0800)
Internet Protocol Version 4, Src: 192.168.0.71 (192.168.0.71), Dst: 203.105.78.164 (203.105.78.164)
    Version: 4
    Header length: 20 bytes
    Differentiated Services Field: 0x00 (DSCP 0x00: Default; ECN: 0x00: Not-ECT (Not ECN-Capable Transport))
        0000 00.. = Differentiated Services Codepoint: Default (0x00)
        .... ..00 = Explicit Congestion Notification: Not-ECT (Not ECN-Capable Transport) (0x00)
    Total Length: 242
    Identification: 0x0005 (5)
    Flags: 0x02 (Don't Fragment)
        0... .... = Reserved bit: Not set
        .1.. .... = Don't fragment: Set
        ..0. .... = More fragments: Not set
    Fragment offset: 0
    Time to live: 64
    Protocol: TCP (6)
    Header checksum: 0x5f04 [correct]
        [Good: True]
        [Bad: False]
    Source: 192.168.0.71 (192.168.0.71)
    Destination: 203.105.78.164 (203.105.78.164)
Transmission Control Protocol, Src Port: 58638 (58638), Dst Port: https (443), Seq: 103, Ack: 2182, Len: 190
    Source port: 58638 (58638)
    Destination port: https (443)
    [Stream index: 3]
    Sequence number: 103    (relative sequence number)
    [Next sequence number: 293    (relative sequence number)]
    Acknowledgement number: 2182    (relative ack number)
    Header length: 32 bytes
    Flags: 0x018 (PSH, ACK)
        000. .... .... = Reserved: Not set
        ...0 .... .... = Nonce: Not set
        .... 0... .... = Congestion Window Reduced (CWR): Not set
        .... .0.. .... = ECN-Echo: Not set
        .... ..0. .... = Urgent: Not set
        .... ...1 .... = Acknowledgement: Set
        .... .... 1... = Push: Set
        .... .... .0.. = Reset: Not set
        .... .... ..0. = Syn: Not set
        .... .... ...0 = Fin: Not set
    Window size value: 17520
    [Calculated window size: 17520]
    [Window size scaling factor: 1]
    Checksum: 0xdc24 [validation disabled]
        [Good Checksum: False]
        [Bad Checksum: False]
    Options: (12 bytes)
        No-Operation (NOP)
        No-Operation (NOP)
        Timestamps: TSval 3793, TSecr 189241253
            Kind: Timestamp (8)
            Length: 10
            Timestamp value: 3793
            Timestamp echo reply: 189241253
    [SEQ/ACK analysis]
        [Bytes in flight: 293]
Secure Sockets Layer
    TLSv1 Record Layer: Handshake Protocol: Client Key Exchange
        Content Type: Handshake (22)
        Version: TLS 1.0 (0x0301)
        Length: 134
        Handshake Protocol: Client Key Exchange
            Handshake Type: Client Key Exchange (16)
            Length: 130
    TLSv1 Record Layer: Change Cipher Spec Protocol: Change Cipher Spec
        Content Type: Change Cipher Spec (20)
        Version: TLS 1.0 (0x0301)
        Length: 1
        Change Cipher Spec Message
    TLSv1 Record Layer: Handshake Protocol: Encrypted Handshake Message
        Content Type: Handshake (22)
        Version: TLS 1.0 (0x0301)
        Length: 40
        Handshake Protocol: Encrypted Handshake Message

0000  40 4a 03 8d 62 30 00 19 c5 ea 13 f9 08 00 45 00   @J..b0........E.
0010  00 f2 00 05 40 00 40 06 5f 04 c0 a8 00 47 cb 69   ....@.@._....G.i
0020  4e a4 e5 0e 01 bb cf 57 33 bd 90 f9 46 fc 80 18   N......W3...F...
0030  44 70 dc 24 00 00 01 01 08 0a 00 00 0e d1 0b 47   Dp.$...........G
0040  97 a5 16 03 01 00 86 10 00 00 82 00 80 b6 8a 9c   ................
0050  44 e1 c2 aa 8d b4 c9 a8 f0 5e 30 9b 4c 41 54 16   D........^0.LAT.
0060  fe 20 63 79 eb c6 99 dc a7 26 41 60 79 14 91 75   . cy.....&A`y..u
0070  5d 00 9f 65 c0 69 42 65 13 7f 45 6e 38 f8 af 85   ]..e.iBe..En8...
0080  da b9 e8 6a fe 00 31 9e 75 56 5b 24 58 22 76 e1   ...j..1.uV[$X"v.
0090  c0 3e 06 ba 0f 04 21 d4 c3 9e 5a b0 f7 41 9c c1   .>....!...Z..A..
00a0  d2 71 9c 89 7d a5 f8 4a 43 05 e7 2a 17 96 ec 71   .q..}..JC..*...q
00b0  ca 7a 08 42 7b 86 c0 97 ae 54 bf 7e 32 e7 c9 e9   .z.B{....T.~2...
00c0  78 0b c7 94 70 f5 a1 6b 43 19 8b 3c c0 14 03 01   x...p..kC..<....
00d0  00 01 01 16 03 01 00 28 e3 5e c5 7f 3f 2f 72 2b   .......(.^..?/r+
00e0  85 74 94 41 37 fe 50 33 be d5 c6 1e 43 ba e9 bc   .t.A7.P3....C...
00f0  24 f4 cf 8c 96 b0 a0 76 5b 39 e9 7e 25 53 ac 4a   $......v[9.~%S.J

No.     Time                       Source                Destination           Protocol Length Info
     62 2012-10-11 22:00:29.101903 192.168.0.71          203.105.78.164        TLSv1    519    Application Data

Frame 62: 519 bytes on wire (4152 bits), 519 bytes captured (4152 bits)
    Arrival Time: Oct 11, 2012 22:00:29.101903000 GTB Standard Time
    Epoch Time: 1349982029.101903000 seconds
    [Time delta from previous captured frame: 0.323095000 seconds]
    [Time delta from previous displayed frame: 0.323095000 seconds]
    [Time since reference or first frame: 696.814006000 seconds]
    Frame Number: 62
    Frame Length: 519 bytes (4152 bits)
    Capture Length: 519 bytes (4152 bits)
    [Frame is marked: False]
    [Frame is ignored: False]
    [Protocols in frame: eth:ip:tcp:ssl]
    [Coloring Rule Name: TCP]
    [Coloring Rule String: tcp]
Ethernet II, Src: SonyComp_ea:13:f9 (00:19:c5:ea:13:f9), Dst: ZyxelCom_8d:62:30 (40:4a:03:8d:62:30)
    Destination: ZyxelCom_8d:62:30 (40:4a:03:8d:62:30)
        Address: ZyxelCom_8d:62:30 (40:4a:03:8d:62:30)
        .... ...0 .... .... .... .... = IG bit: Individual address (unicast)
        .... ..0. .... .... .... .... = LG bit: Globally unique address (factory default)
    Source: SonyComp_ea:13:f9 (00:19:c5:ea:13:f9)
        Address: SonyComp_ea:13:f9 (00:19:c5:ea:13:f9)
        .... ...0 .... .... .... .... = IG bit: Individual address (unicast)
        .... ..0. .... .... .... .... = LG bit: Globally unique address (factory default)
    Type: IP (0x0800)
Internet Protocol Version 4, Src: 192.168.0.71 (192.168.0.71), Dst: 203.105.78.164 (203.105.78.164)
    Version: 4
    Header length: 20 bytes
    Differentiated Services Field: 0x00 (DSCP 0x00: Default; ECN: 0x00: Not-ECT (Not ECN-Capable Transport))
        0000 00.. = Differentiated Services Codepoint: Default (0x00)
        .... ..00 = Explicit Congestion Notification: Not-ECT (Not ECN-Capable Transport) (0x00)
    Total Length: 505
    Identification: 0x0006 (6)
    Flags: 0x02 (Don't Fragment)
        0... .... = Reserved bit: Not set
        .1.. .... = Don't fragment: Set
        ..0. .... = More fragments: Not set
    Fragment offset: 0
    Time to live: 64
    Protocol: TCP (6)
    Header checksum: 0x5dfc [correct]
        [Good: True]
        [Bad: False]
    Source: 192.168.0.71 (192.168.0.71)
    Destination: 203.105.78.164 (203.105.78.164)
Transmission Control Protocol, Src Port: 58638 (58638), Dst Port: https (443), Seq: 293, Ack: 2233, Len: 453
    Source port: 58638 (58638)
    Destination port: https (443)
    [Stream index: 3]
    Sequence number: 293    (relative sequence number)
    [Next sequence number: 746    (relative sequence number)]
    Acknowledgement number: 2233    (relative ack number)
    Header length: 32 bytes
    Flags: 0x018 (PSH, ACK)
        000. .... .... = Reserved: Not set
        ...0 .... .... = Nonce: Not set
        .... 0... .... = Congestion Window Reduced (CWR): Not set
        .... .0.. .... = ECN-Echo: Not set
        .... ..0. .... = Urgent: Not set
        .... ...1 .... = Acknowledgement: Set
        .... .... 1... = Push: Set
        .... .... .0.. = Reset: Not set
        .... .... ..0. = Syn: Not set
        .... .... ...0 = Fin: Not set
    Window size value: 17520
    [Calculated window size: 17520]
    [Window size scaling factor: 1]
    Checksum: 0x1b7f [validation disabled]
        [Good Checksum: False]
        [Bad Checksum: False]
    Options: (12 bytes)
        No-Operation (NOP)
        No-Operation (NOP)
        Timestamps: TSval 3793, TSecr 189241589
            Kind: Timestamp (8)
            Length: 10
            Timestamp value: 3793
            Timestamp echo reply: 189241589
    [SEQ/ACK analysis]
        [Bytes in flight: 746]
Secure Sockets Layer
    TLSv1 Record Layer: Application Data Protocol: http
        Content Type: Application Data (23)
        Version: TLS 1.0 (0x0301)
        Length: 448
        Encrypted Application Data: aa7b2da6901973226ca8af1a13aee910a23619af0e01dd70...

0000  40 4a 03 8d 62 30 00 19 c5 ea 13 f9 08 00 45 00   @J..b0........E.
0010  01 f9 00 06 40 00 40 06 5d fc c0 a8 00 47 cb 69   ....@.@.]....G.i
0020  4e a4 e5 0e 01 bb cf 57 34 7b 90 f9 47 2f 80 18   N......W4{..G/..
0030  44 70 1b 7f 00 00 01 01 08 0a 00 00 0e d1 0b 47   Dp.............G
0040  98 f5 17 03 01 01 c0 aa 7b 2d a6 90 19 73 22 6c   ........{-...s"l
0050  a8 af 1a 13 ae e9 10 a2 36 19 af 0e 01 dd 70 38   ........6.....p8
0060  65 1d e3 0f 56 a5 2d 67 e4 6a 07 3e e3 69 e5 14   e...V.-g.j.>.i..
0070  b1 6d 15 b6 3d 2d f9 d1 48 13 72 d4 0c de bd 6e   .m..=-..H.r....n
0080  f8 8d b5 4f 21 7e 0e 6b 9a 0a 76 d0 6f 44 dc 97   ...O!~.k..v.oD..
0090  6a d1 ce dd db fb 10 25 e2 49 ed ca ed 29 11 ac   j......%.I...)..
00a0  32 ba 81 8b 59 ba 64 6c 30 f9 79 b0 25 bf 0b 69   2...Y.dl0.y.%..i
00b0  01 23 74 bc 37 7e 25 5a 0c 1d be 82 66 12 db bd   .#t.7~%Z....f...
00c0  15 cc 05 bd 1c 31 4e 8a 96 c1 a9 bc 92 51 d3 2c   .....1N......Q.,
00d0  76 8f 13 5f ad e8 e0 47 7d 21 d5 78 bf 52 ca 65   v.._...G}!.x.R.e
00e0  6d 91 76 d7 ea ba 04 26 9f 03 4c 7c 9d f3 24 28   m.v....&..L|..$(
00f0  60 4c b5 d1 bd fa 07 27 df 30 e0 4e 82 2a 1a bb   `L.....'.0.N.*..
0100  77 2d 04 62 ad 68 80 24 ed c7 95 95 4c 88 fc 3d   w-.b.h.$....L..=
0110  39 2c a7 67 ea 42 99 d1 ba fe 39 45 79 00 95 e6   9,.g.B....9Ey...
0120  d0 b1 2e 6a 26 2d b0 43 c7 f2 10 bc 0e a9 13 7a   ...j&-.C.......z
0130  76 fc 96 9d 5e 21 55 dd c6 27 c8 03 f4 0a 6a 3a   v...^!U..'....j:
0140  ec 67 b7 98 8a 86 71 28 70 df c1 21 27 3c 84 5e   .g....q(p..!'<.^
0150  3d 69 5d f6 5c 95 a6 39 d4 73 96 33 55 98 7d fc   =i].\..9.s.3U.}.
0160  fa bd 6a 4d 55 24 9f ce 4b 97 6c f4 f8 8d 84 f4   ..jMU$..K.l.....
0170  2d 31 01 5d a2 a7 d8 89 78 10 65 06 2b 6b d0 09   -1.]....x.e.+k..
0180  a8 d3 e5 72 3a ce 42 d8 fb 9d dc c5 60 d5 56 07   ...r:.B.....`.V.
0190  7a de d4 6c 0e d6 5e 72 cb 4f d5 a3 5a 8b aa ac   z..l..^r.O..Z...
01a0  1e d2 29 c1 b8 76 a3 25 02 2d 09 da 75 17 20 55   ..)..v.%.-..u. U
01b0  05 b2 ba 82 8a 79 45 22 3a 1d 07 28 97 62 3c 72   .....yE":..(.b<r
01c0  0c e9 5c 34 89 1b 7b 3e e5 ed a8 ae 24 b1 40 14   ..\4..{>....$.@.
01d0  df 67 f2 35 e8 a0 8c 91 df 34 00 cb 56 38 8c fb   .g.5.....4..V8..
01e0  29 dd 85 86 a9 72 cf 90 a2 f9 71 18 e6 7f b1 6c   )....r....q....l
01f0  6a 72 8d ff a7 66 ca 79 5e cf a7 91 aa 5a f7 48   jr...f.y^....Z.H
0200  91 72 50 20 26 8f 71                              .rP &.q

No.     Time                       Source                Destination           Protocol Length Info
     63 2012-10-11 22:00:29.418020 192.168.0.71          203.105.78.164        TCP      66     58638 > https [ACK] Seq=746 Ack=2712 Win=17041 Len=0 TSval=3794 TSecr=189241916

Frame 63: 66 bytes on wire (528 bits), 66 bytes captured (528 bits)
    Arrival Time: Oct 11, 2012 22:00:29.418020000 GTB Standard Time
    Epoch Time: 1349982029.418020000 seconds
    [Time delta from previous captured frame: 0.316117000 seconds]
    [Time delta from previous displayed frame: 0.316117000 seconds]
    [Time since reference or first frame: 697.130123000 seconds]
    Frame Number: 63
    Frame Length: 66 bytes (528 bits)
    Capture Length: 66 bytes (528 bits)
    [Frame is marked: False]
    [Frame is ignored: False]
    [Protocols in frame: eth:ip:tcp]
    [Coloring Rule Name: TCP]
    [Coloring Rule String: tcp]
Ethernet II, Src: SonyComp_ea:13:f9 (00:19:c5:ea:13:f9), Dst: ZyxelCom_8d:62:30 (40:4a:03:8d:62:30)
    Destination: ZyxelCom_8d:62:30 (40:4a:03:8d:62:30)
        Address: ZyxelCom_8d:62:30 (40:4a:03:8d:62:30)
        .... ...0 .... .... .... .... = IG bit: Individual address (unicast)
        .... ..0. .... .... .... .... = LG bit: Globally unique address (factory default)
    Source: SonyComp_ea:13:f9 (00:19:c5:ea:13:f9)
        Address: SonyComp_ea:13:f9 (00:19:c5:ea:13:f9)
        .... ...0 .... .... .... .... = IG bit: Individual address (unicast)
        .... ..0. .... .... .... .... = LG bit: Globally unique address (factory default)
    Type: IP (0x0800)
Internet Protocol Version 4, Src: 192.168.0.71 (192.168.0.71), Dst: 203.105.78.164 (203.105.78.164)
    Version: 4
    Header length: 20 bytes
    Differentiated Services Field: 0x00 (DSCP 0x00: Default; ECN: 0x00: Not-ECT (Not ECN-Capable Transport))
        0000 00.. = Differentiated Services Codepoint: Default (0x00)
        .... ..00 = Explicit Congestion Notification: Not-ECT (Not ECN-Capable Transport) (0x00)
    Total Length: 52
    Identification: 0x0007 (7)
    Flags: 0x02 (Don't Fragment)
        0... .... = Reserved bit: Not set
        .1.. .... = Don't fragment: Set
        ..0. .... = More fragments: Not set
    Fragment offset: 0
    Time to live: 64
    Protocol: TCP (6)
    Header checksum: 0x5fc0 [correct]
        [Good: True]
        [Bad: False]
    Source: 192.168.0.71 (192.168.0.71)
    Destination: 203.105.78.164 (203.105.78.164)
Transmission Control Protocol, Src Port: 58638 (58638), Dst Port: https (443), Seq: 746, Ack: 2712, Len: 0
    Source port: 58638 (58638)
    Destination port: https (443)
    [Stream index: 3]
    Sequence number: 746    (relative sequence number)
    Acknowledgement number: 2712    (relative ack number)
    Header length: 32 bytes
    Flags: 0x010 (ACK)
        000. .... .... = Reserved: Not set
        ...0 .... .... = Nonce: Not set
        .... 0... .... = Congestion Window Reduced (CWR): Not set
        .... .0.. .... = ECN-Echo: Not set
        .... ..0. .... = Urgent: Not set
        .... ...1 .... = Acknowledgement: Set
        .... .... 0... = Push: Not set
        .... .... .0.. = Reset: Not set
        .... .... ..0. = Syn: Not set
        .... .... ...0 = Fin: Not set
    Window size value: 17041
    [Calculated window size: 17041]
    [Window size scaling factor: 1]
    Checksum: 0xde6f [validation disabled]
        [Good Checksum: False]
        [Bad Checksum: False]
    Options: (12 bytes)
        No-Operation (NOP)
        No-Operation (NOP)
        Timestamps: TSval 3794, TSecr 189241916
            Kind: Timestamp (8)
            Length: 10
            Timestamp value: 3794
            Timestamp echo reply: 189241916

0000  40 4a 03 8d 62 30 00 19 c5 ea 13 f9 08 00 45 00   @J..b0........E.
0010  00 34 00 07 40 00 40 06 5f c0 c0 a8 00 47 cb 69   .4..@.@._....G.i
0020  4e a4 e5 0e 01 bb cf 57 36 40 90 f9 49 0e 80 10   N......W6@..I...
0030  42 91 de 6f 00 00 01 01 08 0a 00 00 0e d2 0b 47   B..o...........G
0040  9a 3c                                             .<

