No.     Time                       Source                Destination           Protocol Length Info
      1 2012-10-11 22:26:50.286747 192.168.0.71          85.236.101.18         UDP      60     Source port: 55800  Destination port: kingfisher

Frame 1: 60 bytes on wire (480 bits), 60 bytes captured (480 bits)
    Arrival Time: Oct 11, 2012 22:26:50.286747000 GTB Standard Time
    Epoch Time: 1349983610.286747000 seconds
    [Time delta from previous captured frame: 0.000000000 seconds]
    [Time delta from previous displayed frame: 0.000000000 seconds]
    [Time since reference or first frame: 0.000000000 seconds]
    Frame Number: 1
    Frame Length: 60 bytes (480 bits)
    Capture Length: 60 bytes (480 bits)
    [Frame is marked: False]
    [Frame is ignored: False]
    [Protocols in frame: eth:ip:udp:data]
    [Coloring Rule Name: UDP]
    [Coloring Rule String: udp]
Ethernet II, Src: SonyComp_ea:13:f9 (00:19:c5:ea:13:f9), Dst: ZyxelCom_8d:62:30 (40:4a:03:8d:62:30)
    Destination: ZyxelCom_8d:62:30 (40:4a:03:8d:62:30)
        Address: ZyxelCom_8d:62:30 (40:4a:03:8d:62:30)
        .... ...0 .... .... .... .... = IG bit: Individual address (unicast)
        .... ..0. .... .... .... .... = LG bit: Globally unique address (factory default)
    Source: SonyComp_ea:13:f9 (00:19:c5:ea:13:f9)
        Address: SonyComp_ea:13:f9 (00:19:c5:ea:13:f9)
        .... ...0 .... .... .... .... = IG bit: Individual address (unicast)
        .... ..0. .... .... .... .... = LG bit: Globally unique address (factory default)
    Type: IP (0x0800)
    Trailer: 000000000000000000000000
Internet Protocol Version 4, Src: 192.168.0.71 (192.168.0.71), Dst: 85.236.101.18 (85.236.101.18)
    Version: 4
    Header length: 20 bytes
    Differentiated Services Field: 0x00 (DSCP 0x00: Default; ECN: 0x00: Not-ECT (Not ECN-Capable Transport))
        0000 00.. = Differentiated Services Codepoint: Default (0x00)
        .... ..00 = Explicit Congestion Notification: Not-ECT (Not ECN-Capable Transport) (0x00)
    Total Length: 34
    Identification: 0x02af (687)
    Flags: 0x00
        0... .... = Reserved bit: Not set
        .0.. .... = Don't fragment: Not set
        ..0. .... = More fragments: Not set
    Fragment offset: 0
    Time to live: 64
    Protocol: UDP (17)
    Header checksum: 0xfc2e [correct]
        [Good: True]
        [Bad: False]
    Source: 192.168.0.71 (192.168.0.71)
    Destination: 85.236.101.18 (85.236.101.18)
User Datagram Protocol, Src Port: 55800 (55800), Dst Port: kingfisher (4058)
    Source port: 55800 (55800)
    Destination port: kingfisher (4058)
    Length: 14
    Checksum: 0xd5dc [validation disabled]
        [Good Checksum: False]
        [Bad Checksum: False]
Data (6 bytes)
    Data: 0400c0000034
    [Length: 6]

0000  40 4a 03 8d 62 30 00 19 c5 ea 13 f9 08 00 45 00   @J..b0........E.
0010  00 22 02 af 00 00 40 11 fc 2e c0 a8 00 47 55 ec   ."....@......GU.
0020  65 12 d9 f8 0f da 00 0e d5 dc 04 00 c0 00 00 34   e..............4
0030  00 00 00 00 00 00 00 00 00 00 00 00               ............

No.     Time                       Source                Destination           Protocol Length Info
      2 2012-10-11 22:26:50.366265 192.168.0.71          85.236.101.18         UDP      60     Source port: 55800  Destination port: kingfisher

Frame 2: 60 bytes on wire (480 bits), 60 bytes captured (480 bits)
    Arrival Time: Oct 11, 2012 22:26:50.366265000 GTB Standard Time
    Epoch Time: 1349983610.366265000 seconds
    [Time delta from previous captured frame: 0.079518000 seconds]
    [Time delta from previous displayed frame: 0.079518000 seconds]
    [Time since reference or first frame: 0.079518000 seconds]
    Frame Number: 2
    Frame Length: 60 bytes (480 bits)
    Capture Length: 60 bytes (480 bits)
    [Frame is marked: False]
    [Frame is ignored: False]
    [Protocols in frame: eth:ip:udp:data]
    [Coloring Rule Name: UDP]
    [Coloring Rule String: udp]
Ethernet II, Src: SonyComp_ea:13:f9 (00:19:c5:ea:13:f9), Dst: ZyxelCom_8d:62:30 (40:4a:03:8d:62:30)
    Destination: ZyxelCom_8d:62:30 (40:4a:03:8d:62:30)
        Address: ZyxelCom_8d:62:30 (40:4a:03:8d:62:30)
        .... ...0 .... .... .... .... = IG bit: Individual address (unicast)
        .... ..0. .... .... .... .... = LG bit: Globally unique address (factory default)
    Source: SonyComp_ea:13:f9 (00:19:c5:ea:13:f9)
        Address: SonyComp_ea:13:f9 (00:19:c5:ea:13:f9)
        .... ...0 .... .... .... .... = IG bit: Individual address (unicast)
        .... ..0. .... .... .... .... = LG bit: Globally unique address (factory default)
    Type: IP (0x0800)
    Trailer: 000000000000000000000000
Internet Protocol Version 4, Src: 192.168.0.71 (192.168.0.71), Dst: 85.236.101.18 (85.236.101.18)
    Version: 4
    Header length: 20 bytes
    Differentiated Services Field: 0x00 (DSCP 0x00: Default; ECN: 0x00: Not-ECT (Not ECN-Capable Transport))
        0000 00.. = Differentiated Services Codepoint: Default (0x00)
        .... ..00 = Explicit Congestion Notification: Not-ECT (Not ECN-Capable Transport) (0x00)
    Total Length: 34
    Identification: 0x02b0 (688)
    Flags: 0x00
        0... .... = Reserved bit: Not set
        .0.. .... = Don't fragment: Not set
        ..0. .... = More fragments: Not set
    Fragment offset: 0
    Time to live: 64
    Protocol: UDP (17)
    Header checksum: 0xfc2d [correct]
        [Good: True]
        [Bad: False]
    Source: 192.168.0.71 (192.168.0.71)
    Destination: 85.236.101.18 (85.236.101.18)
User Datagram Protocol, Src Port: 55800 (55800), Dst Port: kingfisher (4058)
    Source port: 55800 (55800)
    Destination port: kingfisher (4058)
    Length: 14
    Checksum: 0xd5dc [validation disabled]
        [Good Checksum: False]
        [Bad Checksum: False]
Data (6 bytes)
    Data: 0400c0000034
    [Length: 6]

0000  40 4a 03 8d 62 30 00 19 c5 ea 13 f9 08 00 45 00   @J..b0........E.
0010  00 22 02 b0 00 00 40 11 fc 2d c0 a8 00 47 55 ec   ."....@..-...GU.
0020  65 12 d9 f8 0f da 00 0e d5 dc 04 00 c0 00 00 34   e..............4
0030  00 00 00 00 00 00 00 00 00 00 00 00               ............

No.     Time                       Source                Destination           Protocol Length Info
      3 2012-10-11 22:26:50.486266 192.168.0.71          85.236.101.18         UDP      60     Source port: 55800  Destination port: kingfisher

Frame 3: 60 bytes on wire (480 bits), 60 bytes captured (480 bits)
    Arrival Time: Oct 11, 2012 22:26:50.486266000 GTB Standard Time
    Epoch Time: 1349983610.486266000 seconds
    [Time delta from previous captured frame: 0.120001000 seconds]
    [Time delta from previous displayed frame: 0.120001000 seconds]
    [Time since reference or first frame: 0.199519000 seconds]
    Frame Number: 3
    Frame Length: 60 bytes (480 bits)
    Capture Length: 60 bytes (480 bits)
    [Frame is marked: False]
    [Frame is ignored: False]
    [Protocols in frame: eth:ip:udp:data]
    [Coloring Rule Name: UDP]
    [Coloring Rule String: udp]
Ethernet II, Src: SonyComp_ea:13:f9 (00:19:c5:ea:13:f9), Dst: ZyxelCom_8d:62:30 (40:4a:03:8d:62:30)
    Destination: ZyxelCom_8d:62:30 (40:4a:03:8d:62:30)
        Address: ZyxelCom_8d:62:30 (40:4a:03:8d:62:30)
        .... ...0 .... .... .... .... = IG bit: Individual address (unicast)
        .... ..0. .... .... .... .... = LG bit: Globally unique address (factory default)
    Source: SonyComp_ea:13:f9 (00:19:c5:ea:13:f9)
        Address: SonyComp_ea:13:f9 (00:19:c5:ea:13:f9)
        .... ...0 .... .... .... .... = IG bit: Individual address (unicast)
        .... ..0. .... .... .... .... = LG bit: Globally unique address (factory default)
    Type: IP (0x0800)
    Trailer: 000000000000000000000000
Internet Protocol Version 4, Src: 192.168.0.71 (192.168.0.71), Dst: 85.236.101.18 (85.236.101.18)
    Version: 4
    Header length: 20 bytes
    Differentiated Services Field: 0x00 (DSCP 0x00: Default; ECN: 0x00: Not-ECT (Not ECN-Capable Transport))
        0000 00.. = Differentiated Services Codepoint: Default (0x00)
        .... ..00 = Explicit Congestion Notification: Not-ECT (Not ECN-Capable Transport) (0x00)
    Total Length: 34
    Identification: 0x02b1 (689)
    Flags: 0x00
        0... .... = Reserved bit: Not set
        .0.. .... = Don't fragment: Not set
        ..0. .... = More fragments: Not set
    Fragment offset: 0
    Time to live: 64
    Protocol: UDP (17)
    Header checksum: 0xfc2c [correct]
        [Good: True]
        [Bad: False]
    Source: 192.168.0.71 (192.168.0.71)
    Destination: 85.236.101.18 (85.236.101.18)
User Datagram Protocol, Src Port: 55800 (55800), Dst Port: kingfisher (4058)
    Source port: 55800 (55800)
    Destination port: kingfisher (4058)
    Length: 14
    Checksum: 0xb5d0 [validation disabled]
        [Good Checksum: False]
        [Bad Checksum: False]
Data (6 bytes)
    Data: 0400e0000040
    [Length: 6]

0000  40 4a 03 8d 62 30 00 19 c5 ea 13 f9 08 00 45 00   @J..b0........E.
0010  00 22 02 b1 00 00 40 11 fc 2c c0 a8 00 47 55 ec   ."....@..,...GU.
0020  65 12 d9 f8 0f da 00 0e b5 d0 04 00 e0 00 00 40   e..............@
0030  00 00 00 00 00 00 00 00 00 00 00 00               ............

No.     Time                       Source                Destination           Protocol Length Info
      4 2012-10-11 22:26:50.586313 192.168.0.71          85.236.101.18         UDP      60     Source port: 55800  Destination port: kingfisher

Frame 4: 60 bytes on wire (480 bits), 60 bytes captured (480 bits)
    Arrival Time: Oct 11, 2012 22:26:50.586313000 GTB Standard Time
    Epoch Time: 1349983610.586313000 seconds
    [Time delta from previous captured frame: 0.100047000 seconds]
    [Time delta from previous displayed frame: 0.100047000 seconds]
    [Time since reference or first frame: 0.299566000 seconds]
    Frame Number: 4
    Frame Length: 60 bytes (480 bits)
    Capture Length: 60 bytes (480 bits)
    [Frame is marked: False]
    [Frame is ignored: False]
    [Protocols in frame: eth:ip:udp:data]
    [Coloring Rule Name: UDP]
    [Coloring Rule String: udp]
Ethernet II, Src: SonyComp_ea:13:f9 (00:19:c5:ea:13:f9), Dst: ZyxelCom_8d:62:30 (40:4a:03:8d:62:30)
    Destination: ZyxelCom_8d:62:30 (40:4a:03:8d:62:30)
        Address: ZyxelCom_8d:62:30 (40:4a:03:8d:62:30)
        .... ...0 .... .... .... .... = IG bit: Individual address (unicast)
        .... ..0. .... .... .... .... = LG bit: Globally unique address (factory default)
    Source: SonyComp_ea:13:f9 (00:19:c5:ea:13:f9)
        Address: SonyComp_ea:13:f9 (00:19:c5:ea:13:f9)
        .... ...0 .... .... .... .... = IG bit: Individual address (unicast)
        .... ..0. .... .... .... .... = LG bit: Globally unique address (factory default)
    Type: IP (0x0800)
    Trailer: 000000000000000000000000
Internet Protocol Version 4, Src: 192.168.0.71 (192.168.0.71), Dst: 85.236.101.18 (85.236.101.18)
    Version: 4
    Header length: 20 bytes
    Differentiated Services Field: 0x00 (DSCP 0x00: Default; ECN: 0x00: Not-ECT (Not ECN-Capable Transport))
        0000 00.. = Differentiated Services Codepoint: Default (0x00)
        .... ..00 = Explicit Congestion Notification: Not-ECT (Not ECN-Capable Transport) (0x00)
    Total Length: 34
    Identification: 0x02b2 (690)
    Flags: 0x00
        0... .... = Reserved bit: Not set
        .0.. .... = Don't fragment: Not set
        ..0. .... = More fragments: Not set
    Fragment offset: 0
    Time to live: 64
    Protocol: UDP (17)
    Header checksum: 0xfc2b [correct]
        [Good: True]
        [Bad: False]
    Source: 192.168.0.71 (192.168.0.71)
    Destination: 85.236.101.18 (85.236.101.18)
User Datagram Protocol, Src Port: 55800 (55800), Dst Port: kingfisher (4058)
    Source port: 55800 (55800)
    Destination port: kingfisher (4058)
    Length: 14
    Checksum: 0xb5d0 [validation disabled]
        [Good Checksum: False]
        [Bad Checksum: False]
Data (6 bytes)
    Data: 0400e0000040
    [Length: 6]

0000  40 4a 03 8d 62 30 00 19 c5 ea 13 f9 08 00 45 00   @J..b0........E.
0010  00 22 02 b2 00 00 40 11 fc 2b c0 a8 00 47 55 ec   ."....@..+...GU.
0020  65 12 d9 f8 0f da 00 0e b5 d0 04 00 e0 00 00 40   e..............@
0030  00 00 00 00 00 00 00 00 00 00 00 00               ............

No.     Time                       Source                Destination           Protocol Length Info
      5 2012-10-11 22:26:50.626246 192.168.0.71          85.236.101.18         UDP      96     Source port: 55800  Destination port: kingfisher

Frame 5: 96 bytes on wire (768 bits), 96 bytes captured (768 bits)
    Arrival Time: Oct 11, 2012 22:26:50.626246000 GTB Standard Time
    Epoch Time: 1349983610.626246000 seconds
    [Time delta from previous captured frame: 0.039933000 seconds]
    [Time delta from previous displayed frame: 0.039933000 seconds]
    [Time since reference or first frame: 0.339499000 seconds]
    Frame Number: 5
    Frame Length: 96 bytes (768 bits)
    Capture Length: 96 bytes (768 bits)
    [Frame is marked: False]
    [Frame is ignored: False]
    [Protocols in frame: eth:ip:udp:data]
    [Coloring Rule Name: UDP]
    [Coloring Rule String: udp]
Ethernet II, Src: SonyComp_ea:13:f9 (00:19:c5:ea:13:f9), Dst: ZyxelCom_8d:62:30 (40:4a:03:8d:62:30)
    Destination: ZyxelCom_8d:62:30 (40:4a:03:8d:62:30)
        Address: ZyxelCom_8d:62:30 (40:4a:03:8d:62:30)
        .... ...0 .... .... .... .... = IG bit: Individual address (unicast)
        .... ..0. .... .... .... .... = LG bit: Globally unique address (factory default)
    Source: SonyComp_ea:13:f9 (00:19:c5:ea:13:f9)
        Address: SonyComp_ea:13:f9 (00:19:c5:ea:13:f9)
        .... ...0 .... .... .... .... = IG bit: Individual address (unicast)
        .... ..0. .... .... .... .... = LG bit: Globally unique address (factory default)
    Type: IP (0x0800)
Internet Protocol Version 4, Src: 192.168.0.71 (192.168.0.71), Dst: 85.236.101.18 (85.236.101.18)
    Version: 4
    Header length: 20 bytes
    Differentiated Services Field: 0x00 (DSCP 0x00: Default; ECN: 0x00: Not-ECT (Not ECN-Capable Transport))
        0000 00.. = Differentiated Services Codepoint: Default (0x00)
        .... ..00 = Explicit Congestion Notification: Not-ECT (Not ECN-Capable Transport) (0x00)
    Total Length: 82
    Identification: 0x02b3 (691)
    Flags: 0x00
        0... .... = Reserved bit: Not set
        .0.. .... = Don't fragment: Not set
        ..0. .... = More fragments: Not set
    Fragment offset: 0
    Time to live: 64
    Protocol: UDP (17)
    Header checksum: 0xfbfa [correct]
        [Good: True]
        [Bad: False]
    Source: 192.168.0.71 (192.168.0.71)
    Destination: 85.236.101.18 (85.236.101.18)
User Datagram Protocol, Src Port: 55800 (55800), Dst Port: kingfisher (4058)
    Source port: 55800 (55800)
    Destination port: kingfisher (4058)
    Length: 62
    Checksum: 0xcbaf [validation disabled]
        [Good Checksum: False]
        [Bad Checksum: False]
Data (54 bytes)
    Data: 3400c000000ab1369c004a94f000020c0008008800298985...
    [Length: 54]

0000  40 4a 03 8d 62 30 00 19 c5 ea 13 f9 08 00 45 00   @J..b0........E.
0010  00 52 02 b3 00 00 40 11 fb fa c0 a8 00 47 55 ec   .R....@......GU.
0020  65 12 d9 f8 0f da 00 3e cb af 34 00 c0 00 00 0a   e......>..4.....
0030  b1 36 9c 00 4a 94 f0 00 02 0c 00 08 00 88 00 29   .6..J..........)
0040  89 85 a9 cd b5 85 b9 b9 95 b8 00 00 00 40 c0 c0   .............@..
0050  c4 e5 0c d5 15 04 c4 cd 18 e4 c0 c0 c0 c0 10 27   ...............'

No.     Time                       Source                Destination           Protocol Length Info
      6 2012-10-11 22:26:50.769886 192.168.0.71          85.236.101.18         UDP      113    Source port: 55800  Destination port: kingfisher

Frame 6: 113 bytes on wire (904 bits), 113 bytes captured (904 bits)
    Arrival Time: Oct 11, 2012 22:26:50.769886000 GTB Standard Time
    Epoch Time: 1349983610.769886000 seconds
    [Time delta from previous captured frame: 0.143640000 seconds]
    [Time delta from previous displayed frame: 0.143640000 seconds]
    [Time since reference or first frame: 0.483139000 seconds]
    Frame Number: 6
    Frame Length: 113 bytes (904 bits)
    Capture Length: 113 bytes (904 bits)
    [Frame is marked: False]
    [Frame is ignored: False]
    [Protocols in frame: eth:ip:udp:data]
    [Coloring Rule Name: UDP]
    [Coloring Rule String: udp]
Ethernet II, Src: SonyComp_ea:13:f9 (00:19:c5:ea:13:f9), Dst: ZyxelCom_8d:62:30 (40:4a:03:8d:62:30)
    Destination: ZyxelCom_8d:62:30 (40:4a:03:8d:62:30)
        Address: ZyxelCom_8d:62:30 (40:4a:03:8d:62:30)
        .... ...0 .... .... .... .... = IG bit: Individual address (unicast)
        .... ..0. .... .... .... .... = LG bit: Globally unique address (factory default)
    Source: SonyComp_ea:13:f9 (00:19:c5:ea:13:f9)
        Address: SonyComp_ea:13:f9 (00:19:c5:ea:13:f9)
        .... ...0 .... .... .... .... = IG bit: Individual address (unicast)
        .... ..0. .... .... .... .... = LG bit: Globally unique address (factory default)
    Type: IP (0x0800)
Internet Protocol Version 4, Src: 192.168.0.71 (192.168.0.71), Dst: 85.236.101.18 (85.236.101.18)
    Version: 4
    Header length: 20 bytes
    Differentiated Services Field: 0x00 (DSCP 0x00: Default; ECN: 0x00: Not-ECT (Not ECN-Capable Transport))
        0000 00.. = Differentiated Services Codepoint: Default (0x00)
        .... ..00 = Explicit Congestion Notification: Not-ECT (Not ECN-Capable Transport) (0x00)
    Total Length: 99
    Identification: 0x02b4 (692)
    Flags: 0x00
        0... .... = Reserved bit: Not set
        .0.. .... = Don't fragment: Not set
        ..0. .... = More fragments: Not set
    Fragment offset: 0
    Time to live: 64
    Protocol: UDP (17)
    Header checksum: 0xfbe8 [correct]
        [Good: True]
        [Bad: False]
    Source: 192.168.0.71 (192.168.0.71)
    Destination: 85.236.101.18 (85.236.101.18)
User Datagram Protocol, Src Port: 55800 (55800), Dst Port: kingfisher (4058)
    Source port: 55800 (55800)
    Destination port: kingfisher (4058)
    Length: 79
    Checksum: 0xf7ed [validation disabled]
        [Good Checksum: False]
        [Bad Checksum: False]
Data (71 bytes)
    Data: 4500c000081502c542d173aa9d048bff62973e5841c36c56...
    [Length: 71]

0000  40 4a 03 8d 62 30 00 19 c5 ea 13 f9 08 00 45 00   @J..b0........E.
0010  00 63 02 b4 00 00 40 11 fb e8 c0 a8 00 47 55 ec   .c....@......GU.
0020  65 12 d9 f8 0f da 00 4f f7 ed 45 00 c0 00 08 15   e......O..E.....
0030  02 c5 42 d1 73 aa 9d 04 8b ff 62 97 3e 58 41 c3   ..B.s.....b.>XA.
0040  6c 56 c6 77 a0 0a 82 fd 57 87 18 4a e8 c1 6f 3a   lV.w....W..J..o:
0050  bb 7b ac 8c 76 7b fc 0b da 4a 62 da 56 a3 77 6a   .{..v{...Jb.V.wj
0060  d2 6b f7 f4 ef 23 ef 9e 48 62 c9 bf e6 8a 2f 5b   .k...#..Hb..../[
0070  fb                                                .

No.     Time                       Source                Destination           Protocol Length Info
      7 2012-10-11 22:26:50.846975 192.168.0.71          85.236.101.18         UDP      76     Source port: 55800  Destination port: kingfisher

Frame 7: 76 bytes on wire (608 bits), 76 bytes captured (608 bits)
    Arrival Time: Oct 11, 2012 22:26:50.846975000 GTB Standard Time
    Epoch Time: 1349983610.846975000 seconds
    [Time delta from previous captured frame: 0.077089000 seconds]
    [Time delta from previous displayed frame: 0.077089000 seconds]
    [Time since reference or first frame: 0.560228000 seconds]
    Frame Number: 7
    Frame Length: 76 bytes (608 bits)
    Capture Length: 76 bytes (608 bits)
    [Frame is marked: False]
    [Frame is ignored: False]
    [Protocols in frame: eth:ip:udp:data]
    [Coloring Rule Name: UDP]
    [Coloring Rule String: udp]
Ethernet II, Src: SonyComp_ea:13:f9 (00:19:c5:ea:13:f9), Dst: ZyxelCom_8d:62:30 (40:4a:03:8d:62:30)
    Destination: ZyxelCom_8d:62:30 (40:4a:03:8d:62:30)
        Address: ZyxelCom_8d:62:30 (40:4a:03:8d:62:30)
        .... ...0 .... .... .... .... = IG bit: Individual address (unicast)
        .... ..0. .... .... .... .... = LG bit: Globally unique address (factory default)
    Source: SonyComp_ea:13:f9 (00:19:c5:ea:13:f9)
        Address: SonyComp_ea:13:f9 (00:19:c5:ea:13:f9)
        .... ...0 .... .... .... .... = IG bit: Individual address (unicast)
        .... ..0. .... .... .... .... = LG bit: Globally unique address (factory default)
    Type: IP (0x0800)
Internet Protocol Version 4, Src: 192.168.0.71 (192.168.0.71), Dst: 85.236.101.18 (85.236.101.18)
    Version: 4
    Header length: 20 bytes
    Differentiated Services Field: 0x00 (DSCP 0x00: Default; ECN: 0x00: Not-ECT (Not ECN-Capable Transport))
        0000 00.. = Differentiated Services Codepoint: Default (0x00)
        .... ..00 = Explicit Congestion Notification: Not-ECT (Not ECN-Capable Transport) (0x00)
    Total Length: 62
    Identification: 0x02b5 (693)
    Flags: 0x00
        0... .... = Reserved bit: Not set
        .0.. .... = Don't fragment: Not set
        ..0. .... = More fragments: Not set
    Fragment offset: 0
    Time to live: 64
    Protocol: UDP (17)
    Header checksum: 0xfc0c [correct]
        [Good: True]
        [Bad: False]
    Source: 192.168.0.71 (192.168.0.71)
    Destination: 85.236.101.18 (85.236.101.18)
User Datagram Protocol, Src Port: 55800 (55800), Dst Port: kingfisher (4058)
    Source port: 55800 (55800)
    Destination port: kingfisher (4058)
    Length: 42
    Checksum: 0xc125 [validation disabled]
        [Good Checksum: False]
        [Bad Checksum: False]
Data (34 bytes)
    Data: 1b00a400085001000000000000e9b1936a40705f99655e95...
    [Length: 34]

0000  40 4a 03 8d 62 30 00 19 c5 ea 13 f9 08 00 45 00   @J..b0........E.
0010  00 3e 02 b5 00 00 40 11 fc 0c c0 a8 00 47 55 ec   .>....@......GU.
0020  65 12 d9 f8 0f da 00 2a c1 25 1b 00 a4 00 08 50   e......*.%.....P
0030  01 00 00 00 00 00 00 e9 b1 93 6a 40 70 5f 99 65   ..........j@p_.e
0040  5e 95 e9 de 9d e3 02 80 00 84 00 85               ^...........

No.     Time                       Source                Destination           Protocol Length Info
      8 2012-10-11 22:26:50.886670 192.168.0.71          85.236.101.18         UDP      63     Source port: 55800  Destination port: kingfisher

Frame 8: 63 bytes on wire (504 bits), 63 bytes captured (504 bits)
    Arrival Time: Oct 11, 2012 22:26:50.886670000 GTB Standard Time
    Epoch Time: 1349983610.886670000 seconds
    [Time delta from previous captured frame: 0.039695000 seconds]
    [Time delta from previous displayed frame: 0.039695000 seconds]
    [Time since reference or first frame: 0.599923000 seconds]
    Frame Number: 8
    Frame Length: 63 bytes (504 bits)
    Capture Length: 63 bytes (504 bits)
    [Frame is marked: False]
    [Frame is ignored: False]
    [Protocols in frame: eth:ip:udp:data]
    [Coloring Rule Name: UDP]
    [Coloring Rule String: udp]
Ethernet II, Src: SonyComp_ea:13:f9 (00:19:c5:ea:13:f9), Dst: ZyxelCom_8d:62:30 (40:4a:03:8d:62:30)
    Destination: ZyxelCom_8d:62:30 (40:4a:03:8d:62:30)
        Address: ZyxelCom_8d:62:30 (40:4a:03:8d:62:30)
        .... ...0 .... .... .... .... = IG bit: Individual address (unicast)
        .... ..0. .... .... .... .... = LG bit: Globally unique address (factory default)
    Source: SonyComp_ea:13:f9 (00:19:c5:ea:13:f9)
        Address: SonyComp_ea:13:f9 (00:19:c5:ea:13:f9)
        .... ...0 .... .... .... .... = IG bit: Individual address (unicast)
        .... ..0. .... .... .... .... = LG bit: Globally unique address (factory default)
    Type: IP (0x0800)
Internet Protocol Version 4, Src: 192.168.0.71 (192.168.0.71), Dst: 85.236.101.18 (85.236.101.18)
    Version: 4
    Header length: 20 bytes
    Differentiated Services Field: 0x00 (DSCP 0x00: Default; ECN: 0x00: Not-ECT (Not ECN-Capable Transport))
        0000 00.. = Differentiated Services Codepoint: Default (0x00)
        .... ..00 = Explicit Congestion Notification: Not-ECT (Not ECN-Capable Transport) (0x00)
    Total Length: 49
    Identification: 0x02b6 (694)
    Flags: 0x00
        0... .... = Reserved bit: Not set
        .0.. .... = Don't fragment: Not set
        ..0. .... = More fragments: Not set
    Fragment offset: 0
    Time to live: 64
    Protocol: UDP (17)
    Header checksum: 0xfc18 [correct]
        [Good: True]
        [Bad: False]
    Source: 192.168.0.71 (192.168.0.71)
    Destination: 85.236.101.18 (85.236.101.18)
User Datagram Protocol, Src Port: 55800 (55800), Dst Port: kingfisher (4058)
    Source port: 55800 (55800)
    Destination port: kingfisher (4058)
    Length: 29
    Checksum: 0xfff7 [validation disabled]
        [Good Checksum: False]
        [Bad Checksum: False]
Data (21 bytes)
    Data: 13000800085002000000000000da152e2bf387afab
    [Length: 21]

0000  40 4a 03 8d 62 30 00 19 c5 ea 13 f9 08 00 45 00   @J..b0........E.
0010  00 31 02 b6 00 00 40 11 fc 18 c0 a8 00 47 55 ec   .1....@......GU.
0020  65 12 d9 f8 0f da 00 1d ff f7 13 00 08 00 08 50   e..............P
0030  02 00 00 00 00 00 00 da 15 2e 2b f3 87 af ab      ..........+....

No.     Time                       Source                Destination           Protocol Length Info
      9 2012-10-11 22:26:50.926555 192.168.0.71          85.236.101.18         UDP      79     Source port: 55800  Destination port: kingfisher

Frame 9: 79 bytes on wire (632 bits), 79 bytes captured (632 bits)
    Arrival Time: Oct 11, 2012 22:26:50.926555000 GTB Standard Time
    Epoch Time: 1349983610.926555000 seconds
    [Time delta from previous captured frame: 0.039885000 seconds]
    [Time delta from previous displayed frame: 0.039885000 seconds]
    [Time since reference or first frame: 0.639808000 seconds]
    Frame Number: 9
    Frame Length: 79 bytes (632 bits)
    Capture Length: 79 bytes (632 bits)
    [Frame is marked: False]
    [Frame is ignored: False]
    [Protocols in frame: eth:ip:udp:data]
Ethernet II, Src: SonyComp_ea:13:f9 (00:19:c5:ea:13:f9), Dst: ZyxelCom_8d:62:30 (40:4a:03:8d:62:30)
    Destination: ZyxelCom_8d:62:30 (40:4a:03:8d:62:30)
        Address: ZyxelCom_8d:62:30 (40:4a:03:8d:62:30)
        .... ...0 .... .... .... .... = IG bit: Individual address (unicast)
        .... ..0. .... .... .... .... = LG bit: Globally unique address (factory default)
    Source: SonyComp_ea:13:f9 (00:19:c5:ea:13:f9)
        Address: SonyComp_ea:13:f9 (00:19:c5:ea:13:f9)
        .... ...0 .... .... .... .... = IG bit: Individual address (unicast)
        .... ..0. .... .... .... .... = LG bit: Globally unique address (factory default)
    Type: IP (0x0800)
Internet Protocol Version 4, Src: 192.168.0.71 (192.168.0.71), Dst: 85.236.101.18 (85.236.101.18)
    Version: 4
    Header length: 20 bytes
    Differentiated Services Field: 0x00 (DSCP 0x00: Default; ECN: 0x00: Not-ECT (Not ECN-Capable Transport))
        0000 00.. = Differentiated Services Codepoint: Default (0x00)
        .... ..00 = Explicit Congestion Notification: Not-ECT (Not ECN-Capable Transport) (0x00)
    Total Length: 65
    Identification: 0x02b7 (695)
    Flags: 0x00
        0... .... = Reserved bit: Not set
        .0.. .... = Don't fragment: Not set
        ..0. .... = More fragments: Not set
    Fragment offset: 0
    Time to live: 64
    Protocol: UDP (17)
    Header checksum: 0xfc07 [correct]
        [Good: True]
        [Bad: False]
    Source: 192.168.0.71 (192.168.0.71)
    Destination: 85.236.101.18 (85.236.101.18)
User Datagram Protocol, Src Port: 55800 (55800), Dst Port: kingfisher (4058)
    Source port: 55800 (55800)
    Destination port: kingfisher (4058)
    Length: 45
    Checksum: 0xa2c9 [validation disabled]
        [Good Checksum: False]
        [Bad Checksum: False]
Data (37 bytes)
    Data: 2300b00008500300000000000047d29e5331b39ab5d8e7c5...
    [Length: 37]

0000  40 4a 03 8d 62 30 00 19 c5 ea 13 f9 08 00 45 00   @J..b0........E.
0010  00 41 02 b7 00 00 40 11 fc 07 c0 a8 00 47 55 ec   .A....@......GU.
0020  65 12 d9 f8 0f da 00 2d a2 c9 23 00 b0 00 08 50   e......-..#....P
0030  03 00 00 00 00 00 00 47 d2 9e 53 31 b3 9a b5 d8   .......G..S1....
0040  e7 c5 2a 3b 5f 78 da ed 32 8c 16 79 ea c1 09      ..*;_x..2..y...

No.     Time                       Source                Destination           Protocol Length Info
     10 2012-10-11 22:26:50.927283 192.168.0.71          69.10.30.242          TCP      180    58625 > 29900 [PSH, ACK] Seq=1 Ack=1 Win=17520 Len=114 TSval=6957 TSecr=26308001

Frame 10: 180 bytes on wire (1440 bits), 180 bytes captured (1440 bits)
    Arrival Time: Oct 11, 2012 22:26:50.927283000 GTB Standard Time
    Epoch Time: 1349983610.927283000 seconds
    [Time delta from previous captured frame: 0.000728000 seconds]
    [Time delta from previous displayed frame: 0.000728000 seconds]
    [Time since reference or first frame: 0.640536000 seconds]
    Frame Number: 10
    Frame Length: 180 bytes (1440 bits)
    Capture Length: 180 bytes (1440 bits)
    [Frame is marked: False]
    [Frame is ignored: False]
    [Protocols in frame: eth:ip:tcp:data]
Ethernet II, Src: SonyComp_ea:13:f9 (00:19:c5:ea:13:f9), Dst: ZyxelCom_8d:62:30 (40:4a:03:8d:62:30)
    Destination: ZyxelCom_8d:62:30 (40:4a:03:8d:62:30)
        Address: ZyxelCom_8d:62:30 (40:4a:03:8d:62:30)
        .... ...0 .... .... .... .... = IG bit: Individual address (unicast)
        .... ..0. .... .... .... .... = LG bit: Globally unique address (factory default)
    Source: SonyComp_ea:13:f9 (00:19:c5:ea:13:f9)
        Address: SonyComp_ea:13:f9 (00:19:c5:ea:13:f9)
        .... ...0 .... .... .... .... = IG bit: Individual address (unicast)
        .... ..0. .... .... .... .... = LG bit: Globally unique address (factory default)
    Type: IP (0x0800)
Internet Protocol Version 4, Src: 192.168.0.71 (192.168.0.71), Dst: 69.10.30.242 (69.10.30.242)
    Version: 4
    Header length: 20 bytes
    Differentiated Services Field: 0x00 (DSCP 0x00: Default; ECN: 0x00: Not-ECT (Not ECN-Capable Transport))
        0000 00.. = Differentiated Services Codepoint: Default (0x00)
        .... ..00 = Explicit Congestion Notification: Not-ECT (Not ECN-Capable Transport) (0x00)
    Total Length: 166
    Identification: 0x02b8 (696)
    Flags: 0x02 (Don't Fragment)
        0... .... = Reserved bit: Not set
        .1.. .... = Don't fragment: Set
        ..0. .... = More fragments: Not set
    Fragment offset: 0
    Time to live: 64
    Protocol: TCP (6)
    Header checksum: 0x12af [correct]
        [Good: True]
        [Bad: False]
    Source: 192.168.0.71 (192.168.0.71)
    Destination: 69.10.30.242 (69.10.30.242)
Transmission Control Protocol, Src Port: 58625 (58625), Dst Port: 29900 (29900), Seq: 1, Ack: 1, Len: 114
    Source port: 58625 (58625)
    Destination port: 29900 (29900)
    [Stream index: 0]
    Sequence number: 1    (relative sequence number)
    [Next sequence number: 115    (relative sequence number)]
    Acknowledgement number: 1    (relative ack number)
    Header length: 32 bytes
    Flags: 0x018 (PSH, ACK)
        000. .... .... = Reserved: Not set
        ...0 .... .... = Nonce: Not set
        .... 0... .... = Congestion Window Reduced (CWR): Not set
        .... .0.. .... = ECN-Echo: Not set
        .... ..0. .... = Urgent: Not set
        .... ...1 .... = Acknowledgement: Set
        .... .... 1... = Push: Set
        .... .... .0.. = Reset: Not set
        .... .... ..0. = Syn: Not set
        .... .... ...0 = Fin: Not set
    Window size value: 17520
    [Calculated window size: 17520]
    [Window size scaling factor: -1 (unknown)]
    Checksum: 0xe2e1 [validation disabled]
        [Good Checksum: False]
        [Bad Checksum: False]
    Options: (12 bytes)
        No-Operation (NOP)
        No-Operation (NOP)
        Timestamps: TSval 6957, TSecr 26308001
            Kind: Timestamp (8)
            Length: 10
            Timestamp value: 6957
            Timestamp echo reply: 26308001
    [SEQ/ACK analysis]
        [Bytes in flight: 114]
Data (114 bytes)
    Data: 5c7374617475735c325c736573736b65795c313031363434...
    [Length: 114]

0000  40 4a 03 8d 62 30 00 19 c5 ea 13 f9 08 00 45 00   @J..b0........E.
0010  00 a6 02 b8 40 00 40 06 12 af c0 a8 00 47 45 0a   ....@.@......GE.
0020  1e f2 e5 01 74 cc b8 50 c5 b2 20 c9 13 13 80 18   ....t..P.. .....
0030  44 70 e2 e1 00 00 01 01 08 0a 00 00 1b 2d 01 91   Dp...........-..
0040  6d a1 5c 73 74 61 74 75 73 5c 32 5c 73 65 73 73   m.\status\2\sess
0050  6b 65 79 5c 31 30 31 36 34 34 36 39 30 5c 73 74   key\101644690\st
0060  61 74 73 74 72 69 6e 67 5c 50 6c 61 79 69 6e 67   atstring\Playing
0070  5c 6c 6f 63 73 74 72 69 6e 67 5c 62 66 69 65 6c   \locstring\bfiel
0080  64 31 39 34 32 70 73 32 3a 2f 4d 75 6c 74 69 70   d1942ps2:/Multip
0090  6c 61 79 20 50 75 62 20 30 37 40 38 35 2e 32 33   lay Pub 07@85.23
00a0  36 2e 31 30 31 2e 31 38 3a 34 30 36 38 5c 66 69   6.101.18:4068\fi
00b0  6e 61 6c 5c                                       nal\

No.     Time                       Source                Destination           Protocol Length Info
     11 2012-10-11 22:26:50.927824 192.168.0.71          85.236.101.18         UDP      79     Source port: 55800  Destination port: kingfisher

Frame 11: 79 bytes on wire (632 bits), 79 bytes captured (632 bits)
    Arrival Time: Oct 11, 2012 22:26:50.927824000 GTB Standard Time
    Epoch Time: 1349983610.927824000 seconds
    [Time delta from previous captured frame: 0.000541000 seconds]
    [Time delta from previous displayed frame: 0.000541000 seconds]
    [Time since reference or first frame: 0.641077000 seconds]
    Frame Number: 11
    Frame Length: 79 bytes (632 bits)
    Capture Length: 79 bytes (632 bits)
    [Frame is marked: False]
    [Frame is ignored: False]
    [Protocols in frame: eth:ip:udp:data]
Ethernet II, Src: SonyComp_ea:13:f9 (00:19:c5:ea:13:f9), Dst: ZyxelCom_8d:62:30 (40:4a:03:8d:62:30)
    Destination: ZyxelCom_8d:62:30 (40:4a:03:8d:62:30)
        Address: ZyxelCom_8d:62:30 (40:4a:03:8d:62:30)
        .... ...0 .... .... .... .... = IG bit: Individual address (unicast)
        .... ..0. .... .... .... .... = LG bit: Globally unique address (factory default)
    Source: SonyComp_ea:13:f9 (00:19:c5:ea:13:f9)
        Address: SonyComp_ea:13:f9 (00:19:c5:ea:13:f9)
        .... ...0 .... .... .... .... = IG bit: Individual address (unicast)
        .... ..0. .... .... .... .... = LG bit: Globally unique address (factory default)
    Type: IP (0x0800)
Internet Protocol Version 4, Src: 192.168.0.71 (192.168.0.71), Dst: 85.236.101.18 (85.236.101.18)
    Version: 4
    Header length: 20 bytes
    Differentiated Services Field: 0x00 (DSCP 0x00: Default; ECN: 0x00: Not-ECT (Not ECN-Capable Transport))
        0000 00.. = Differentiated Services Codepoint: Default (0x00)
        .... ..00 = Explicit Congestion Notification: Not-ECT (Not ECN-Capable Transport) (0x00)
    Total Length: 65
    Identification: 0x02b9 (697)
    Flags: 0x00
        0... .... = Reserved bit: Not set
        .0.. .... = Don't fragment: Not set
        ..0. .... = More fragments: Not set
    Fragment offset: 0
    Time to live: 64
    Protocol: UDP (17)
    Header checksum: 0xfc05 [correct]
        [Good: True]
        [Bad: False]
    Source: 192.168.0.71 (192.168.0.71)
    Destination: 85.236.101.18 (85.236.101.18)
User Datagram Protocol, Src Port: 55800 (55800), Dst Port: kingfisher (4058)
    Source port: 55800 (55800)
    Destination port: kingfisher (4058)
    Length: 45
    Checksum: 0xbc34 [validation disabled]
        [Good Checksum: False]
        [Bad Checksum: False]
Data (37 bytes)
    Data: 230018000850040080000000c0bf803487877d82dd9b3a75...
    [Length: 37]

0000  40 4a 03 8d 62 30 00 19 c5 ea 13 f9 08 00 45 00   @J..b0........E.
0010  00 41 02 b9 00 00 40 11 fc 05 c0 a8 00 47 55 ec   .A....@......GU.
0020  65 12 d9 f8 0f da 00 2d bc 34 23 00 18 00 08 50   e......-.4#....P
0030  04 00 80 00 00 00 c0 bf 80 34 87 87 7d 82 dd 9b   .........4..}...
0040  3a 75 94 0a fe 20 79 38 63 0c 2d 79 d3 54 49      :u... y8c.-y.TI

No.     Time                       Source                Destination           Protocol Length Info
     12 2012-10-11 22:26:50.966763 192.168.0.71          85.236.101.18         UDP      63     Source port: 55800  Destination port: kingfisher

Frame 12: 63 bytes on wire (504 bits), 63 bytes captured (504 bits)
    Arrival Time: Oct 11, 2012 22:26:50.966763000 GTB Standard Time
    Epoch Time: 1349983610.966763000 seconds
    [Time delta from previous captured frame: 0.038939000 seconds]
    [Time delta from previous displayed frame: 0.038939000 seconds]
    [Time since reference or first frame: 0.680016000 seconds]
    Frame Number: 12
    Frame Length: 63 bytes (504 bits)
    Capture Length: 63 bytes (504 bits)
    [Frame is marked: False]
    [Frame is ignored: False]
    [Protocols in frame: eth:ip:udp:data]
Ethernet II, Src: SonyComp_ea:13:f9 (00:19:c5:ea:13:f9), Dst: ZyxelCom_8d:62:30 (40:4a:03:8d:62:30)
    Destination: ZyxelCom_8d:62:30 (40:4a:03:8d:62:30)
        Address: ZyxelCom_8d:62:30 (40:4a:03:8d:62:30)
        .... ...0 .... .... .... .... = IG bit: Individual address (unicast)
        .... ..0. .... .... .... .... = LG bit: Globally unique address (factory default)
    Source: SonyComp_ea:13:f9 (00:19:c5:ea:13:f9)
        Address: SonyComp_ea:13:f9 (00:19:c5:ea:13:f9)
        .... ...0 .... .... .... .... = IG bit: Individual address (unicast)
        .... ..0. .... .... .... .... = LG bit: Globally unique address (factory default)
    Type: IP (0x0800)
Internet Protocol Version 4, Src: 192.168.0.71 (192.168.0.71), Dst: 85.236.101.18 (85.236.101.18)
    Version: 4
    Header length: 20 bytes
    Differentiated Services Field: 0x00 (DSCP 0x00: Default; ECN: 0x00: Not-ECT (Not ECN-Capable Transport))
        0000 00.. = Differentiated Services Codepoint: Default (0x00)
        .... ..00 = Explicit Congestion Notification: Not-ECT (Not ECN-Capable Transport) (0x00)
    Total Length: 49
    Identification: 0x02ba (698)
    Flags: 0x00
        0... .... = Reserved bit: Not set
        .0.. .... = Don't fragment: Not set
        ..0. .... = More fragments: Not set
    Fragment offset: 0
    Time to live: 64
    Protocol: UDP (17)
    Header checksum: 0xfc14 [correct]
        [Good: True]
        [Bad: False]
    Source: 192.168.0.71 (192.168.0.71)
    Destination: 85.236.101.18 (85.236.101.18)
User Datagram Protocol, Src Port: 55800 (55800), Dst Port: kingfisher (4058)
    Source port: 55800 (55800)
    Destination port: kingfisher (4058)
    Length: 29
    Checksum: 0x17bc [validation disabled]
        [Good Checksum: False]
        [Bad Checksum: False]
Data (21 bytes)
    Data: 13000c000850050080000000c07c5a599eef1f20fd
    [Length: 21]

0000  40 4a 03 8d 62 30 00 19 c5 ea 13 f9 08 00 45 00   @J..b0........E.
0010  00 31 02 ba 00 00 40 11 fc 14 c0 a8 00 47 55 ec   .1....@......GU.
0020  65 12 d9 f8 0f da 00 1d 17 bc 13 00 0c 00 08 50   e..............P
0030  05 00 80 00 00 00 c0 7c 5a 59 9e ef 1f 20 fd      .......|ZY... .

No.     Time                       Source                Destination           Protocol Length Info
     13 2012-10-11 22:26:51.126694 192.168.0.71          85.236.101.18         UDP      71     Source port: 55800  Destination port: kingfisher

Frame 13: 71 bytes on wire (568 bits), 71 bytes captured (568 bits)
