No.     Time                       Source                Destination           Protocol Length Info
     14 2012-10-11 22:47:16.198691 192.168.0.71          62.148.192.130        DNS      89     Standard query A gate1.eu.dnas.playstation.org

Frame 14: 89 bytes on wire (712 bits), 89 bytes captured (712 bits)
    Arrival Time: Oct 11, 2012 22:47:16.198691000 GTB Standard Time
    Epoch Time: 1349984836.198691000 seconds
    [Time delta from previous captured frame: 0.000379000 seconds]
    [Time delta from previous displayed frame: 0.000000000 seconds]
    [Time since reference or first frame: 7.778803000 seconds]
    Frame Number: 14
    Frame Length: 89 bytes (712 bits)
    Capture Length: 89 bytes (712 bits)
    [Frame is marked: False]
    [Frame is ignored: False]
    [Protocols in frame: eth:ip:udp:dns]
    [Coloring Rule Name: UDP]
    [Coloring Rule String: udp]
Ethernet II, Src: SonyComp_ea:13:f9 (00:19:c5:ea:13:f9), Dst: ZyxelCom_8d:62:30 (40:4a:03:8d:62:30)
    Destination: ZyxelCom_8d:62:30 (40:4a:03:8d:62:30)
        Address: ZyxelCom_8d:62:30 (40:4a:03:8d:62:30)
        .... ...0 .... .... .... .... = IG bit: Individual address (unicast)
        .... ..0. .... .... .... .... = LG bit: Globally unique address (factory default)
    Source: SonyComp_ea:13:f9 (00:19:c5:ea:13:f9)
        Address: SonyComp_ea:13:f9 (00:19:c5:ea:13:f9)
        .... ...0 .... .... .... .... = IG bit: Individual address (unicast)
        .... ..0. .... .... .... .... = LG bit: Globally unique address (factory default)
    Type: IP (0x0800)
Internet Protocol Version 4, Src: 192.168.0.71 (192.168.0.71), Dst: 62.148.192.130 (62.148.192.130)
    Version: 4
    Header length: 20 bytes
    Differentiated Services Field: 0x00 (DSCP 0x00: Default; ECN: 0x00: Not-ECT (Not ECN-Capable Transport))
        0000 00.. = Differentiated Services Codepoint: Default (0x00)
        .... ..00 = Explicit Congestion Notification: Not-ECT (Not ECN-Capable Transport) (0x00)
    Total Length: 75
    Identification: 0x001d (29)
    Flags: 0x00
        0... .... = Reserved bit: Not set
        .0.. .... = Don't fragment: Not set
        ..0. .... = More fragments: Not set
    Fragment offset: 0
    Time to live: 64
    Protocol: UDP (17)
    Header checksum: 0xba7f [correct]
        [Good: True]
        [Bad: False]
    Source: 192.168.0.71 (192.168.0.71)
    Destination: 62.148.192.130 (62.148.192.130)
User Datagram Protocol, Src Port: 59779 (59779), Dst Port: domain (53)
    Source port: 59779 (59779)
    Destination port: domain (53)
    Length: 55
    Checksum: 0xdea5 [validation disabled]
        [Good Checksum: False]
        [Bad Checksum: False]
Domain Name System (query)
    Transaction ID: 0xab6d
    Flags: 0x0100 (Standard query)
        0... .... .... .... = Response: Message is a query
        .000 0... .... .... = Opcode: Standard query (0)
        .... ..0. .... .... = Truncated: Message is not truncated
        .... ...1 .... .... = Recursion desired: Do query recursively
        .... .... .0.. .... = Z: reserved (0)
        .... .... ...0 .... = Non-authenticated data: Unacceptable
    Questions: 1
    Answer RRs: 0
    Authority RRs: 0
    Additional RRs: 0
    Queries
        gate1.eu.dnas.playstation.org: type A, class IN
            Name: gate1.eu.dnas.playstation.org
            Type: A (Host address)
            Class: IN (0x0001)

0000  40 4a 03 8d 62 30 00 19 c5 ea 13 f9 08 00 45 00   @J..b0........E.
0010  00 4b 00 1d 00 00 40 11 ba 7f c0 a8 00 47 3e 94   .K....@......G>.
0020  c0 82 e9 83 00 35 00 37 de a5 ab 6d 01 00 00 01   .....5.7...m....
0030  00 00 00 00 00 00 05 67 61 74 65 31 02 65 75 04   .......gate1.eu.
0040  64 6e 61 73 0b 70 6c 61 79 73 74 61 74 69 6f 6e   dnas.playstation
0050  03 6f 72 67 00 00 01 00 01                        .org.....

No.     Time                       Source                Destination           Protocol Length Info
     15 2012-10-11 22:47:16.398075 192.168.0.71          203.105.78.164        TCP      74     52130 > https [SYN] Seq=0 Win=16384 Len=0 MSS=1460 WS=1 TSval=294 TSecr=0

Frame 15: 74 bytes on wire (592 bits), 74 bytes captured (592 bits)
    Arrival Time: Oct 11, 2012 22:47:16.398075000 GTB Standard Time
    Epoch Time: 1349984836.398075000 seconds
    [Time delta from previous captured frame: 0.199384000 seconds]
    [Time delta from previous displayed frame: 0.199384000 seconds]
    [Time since reference or first frame: 7.978187000 seconds]
    Frame Number: 15
    Frame Length: 74 bytes (592 bits)
    Capture Length: 74 bytes (592 bits)
    [Frame is marked: False]
    [Frame is ignored: False]
    [Protocols in frame: eth:ip:tcp]
    [Coloring Rule Name: TCP SYN/FIN]
    [Coloring Rule String: tcp.flags & 0x02 || tcp.flags.fin == 1]
Ethernet II, Src: SonyComp_ea:13:f9 (00:19:c5:ea:13:f9), Dst: ZyxelCom_8d:62:30 (40:4a:03:8d:62:30)
    Destination: ZyxelCom_8d:62:30 (40:4a:03:8d:62:30)
        Address: ZyxelCom_8d:62:30 (40:4a:03:8d:62:30)
        .... ...0 .... .... .... .... = IG bit: Individual address (unicast)
        .... ..0. .... .... .... .... = LG bit: Globally unique address (factory default)
    Source: SonyComp_ea:13:f9 (00:19:c5:ea:13:f9)
        Address: SonyComp_ea:13:f9 (00:19:c5:ea:13:f9)
        .... ...0 .... .... .... .... = IG bit: Individual address (unicast)
        .... ..0. .... .... .... .... = LG bit: Globally unique address (factory default)
    Type: IP (0x0800)
Internet Protocol Version 4, Src: 192.168.0.71 (192.168.0.71), Dst: 203.105.78.164 (203.105.78.164)
    Version: 4
    Header length: 20 bytes
    Differentiated Services Field: 0x00 (DSCP 0x00: Default; ECN: 0x00: Not-ECT (Not ECN-Capable Transport))
        0000 00.. = Differentiated Services Codepoint: Default (0x00)
        .... ..00 = Explicit Congestion Notification: Not-ECT (Not ECN-Capable Transport) (0x00)
    Total Length: 60
    Identification: 0x001e (30)
    Flags: 0x02 (Don't Fragment)
        0... .... = Reserved bit: Not set
        .1.. .... = Don't fragment: Set
        ..0. .... = More fragments: Not set
    Fragment offset: 0
    Time to live: 64
    Protocol: TCP (6)
    Header checksum: 0x5fa1 [correct]
        [Good: True]
        [Bad: False]
    Source: 192.168.0.71 (192.168.0.71)
    Destination: 203.105.78.164 (203.105.78.164)
Transmission Control Protocol, Src Port: 52130 (52130), Dst Port: https (443), Seq: 0, Len: 0
    Source port: 52130 (52130)
    Destination port: https (443)
    [Stream index: 2]
    Sequence number: 0    (relative sequence number)
    Header length: 40 bytes
    Flags: 0x002 (SYN)
        000. .... .... = Reserved: Not set
        ...0 .... .... = Nonce: Not set
        .... 0... .... = Congestion Window Reduced (CWR): Not set
        .... .0.. .... = ECN-Echo: Not set
        .... ..0. .... = Urgent: Not set
        .... ...0 .... = Acknowledgement: Not set
        .... .... 0... = Push: Not set
        .... .... .0.. = Reset: Not set
        .... .... ..1. = Syn: Set
            [Expert Info (Chat/Sequence): Connection establish request (SYN): server port https]
                [Message: Connection establish request (SYN): server port https]
                [Severity level: Chat]
                [Group: Sequence]
        .... .... ...0 = Fin: Not set
    Window size value: 16384
    [Calculated window size: 16384]
    Checksum: 0x3896 [validation disabled]
        [Good Checksum: False]
        [Bad Checksum: False]
    Options: (20 bytes)
        Maximum segment size: 1460 bytes
        No-Operation (NOP)
        Window scale: 0 (multiply by 1)
            Kind: Window Scale (3)
            Length: 3
            Shift count: 0
            [Multiplier: 1]
        No-Operation (NOP)
        No-Operation (NOP)
        Timestamps: TSval 294, TSecr 0
            Kind: Timestamp (8)
            Length: 10
            Timestamp value: 294
            Timestamp echo reply: 0

0000  40 4a 03 8d 62 30 00 19 c5 ea 13 f9 08 00 45 00   @J..b0........E.
0010  00 3c 00 1e 40 00 40 06 5f a1 c0 a8 00 47 cb 69   .<..@.@._....G.i
0020  4e a4 cb a2 01 bb 29 93 ff 5d 00 00 00 00 a0 02   N.....)..]......
0030  40 00 38 96 00 00 02 04 05 b4 01 03 03 00 01 01   @.8.............
0040  08 0a 00 00 01 26 00 00 00 00                     .....&....

No.     Time                       Source                Destination           Protocol Length Info
     16 2012-10-11 22:47:16.721475 192.168.0.71          203.105.78.164        TCP      66     52130 > https [ACK] Seq=1 Ack=1 Win=17520 Len=0 TSval=295 TSecr=192049401

Frame 16: 66 bytes on wire (528 bits), 66 bytes captured (528 bits)
    Arrival Time: Oct 11, 2012 22:47:16.721475000 GTB Standard Time
    Epoch Time: 1349984836.721475000 seconds
    [Time delta from previous captured frame: 0.323400000 seconds]
    [Time delta from previous displayed frame: 0.323400000 seconds]
    [Time since reference or first frame: 8.301587000 seconds]
    Frame Number: 16
    Frame Length: 66 bytes (528 bits)
    Capture Length: 66 bytes (528 bits)
    [Frame is marked: False]
    [Frame is ignored: False]
    [Protocols in frame: eth:ip:tcp]
    [Coloring Rule Name: TCP]
    [Coloring Rule String: tcp]
Ethernet II, Src: SonyComp_ea:13:f9 (00:19:c5:ea:13:f9), Dst: ZyxelCom_8d:62:30 (40:4a:03:8d:62:30)
    Destination: ZyxelCom_8d:62:30 (40:4a:03:8d:62:30)
        Address: ZyxelCom_8d:62:30 (40:4a:03:8d:62:30)
        .... ...0 .... .... .... .... = IG bit: Individual address (unicast)
        .... ..0. .... .... .... .... = LG bit: Globally unique address (factory default)
    Source: SonyComp_ea:13:f9 (00:19:c5:ea:13:f9)
        Address: SonyComp_ea:13:f9 (00:19:c5:ea:13:f9)
        .... ...0 .... .... .... .... = IG bit: Individual address (unicast)
        .... ..0. .... .... .... .... = LG bit: Globally unique address (factory default)
    Type: IP (0x0800)
Internet Protocol Version 4, Src: 192.168.0.71 (192.168.0.71), Dst: 203.105.78.164 (203.105.78.164)
    Version: 4
    Header length: 20 bytes
    Differentiated Services Field: 0x00 (DSCP 0x00: Default; ECN: 0x00: Not-ECT (Not ECN-Capable Transport))
        0000 00.. = Differentiated Services Codepoint: Default (0x00)
        .... ..00 = Explicit Congestion Notification: Not-ECT (Not ECN-Capable Transport) (0x00)
    Total Length: 52
    Identification: 0x001f (31)
    Flags: 0x02 (Don't Fragment)
        0... .... = Reserved bit: Not set
        .1.. .... = Don't fragment: Set
        ..0. .... = More fragments: Not set
    Fragment offset: 0
    Time to live: 64
    Protocol: TCP (6)
    Header checksum: 0x5fa8 [correct]
        [Good: True]
        [Bad: False]
    Source: 192.168.0.71 (192.168.0.71)
    Destination: 203.105.78.164 (203.105.78.164)
Transmission Control Protocol, Src Port: 52130 (52130), Dst Port: https (443), Seq: 1, Ack: 1, Len: 0
    Source port: 52130 (52130)
    Destination port: https (443)
    [Stream index: 2]
    Sequence number: 1    (relative sequence number)
    Acknowledgement number: 1    (relative ack number)
    Header length: 32 bytes
    Flags: 0x010 (ACK)
        000. .... .... = Reserved: Not set
        ...0 .... .... = Nonce: Not set
        .... 0... .... = Congestion Window Reduced (CWR): Not set
        .... .0.. .... = ECN-Echo: Not set
        .... ..0. .... = Urgent: Not set
        .... ...1 .... = Acknowledgement: Set
        .... .... 0... = Push: Not set
        .... .... .0.. = Reset: Not set
        .... .... ..0. = Syn: Not set
        .... .... ...0 = Fin: Not set
    Window size value: 17520
    [Calculated window size: 17520]
    [Window size scaling factor: 1]
    Checksum: 0xa369 [validation disabled]
        [Good Checksum: False]
        [Bad Checksum: False]
    Options: (12 bytes)
        No-Operation (NOP)
        No-Operation (NOP)
        Timestamps: TSval 295, TSecr 192049401
            Kind: Timestamp (8)
            Length: 10
            Timestamp value: 295
            Timestamp echo reply: 192049401

0000  40 4a 03 8d 62 30 00 19 c5 ea 13 f9 08 00 45 00   @J..b0........E.
0010  00 34 00 1f 40 00 40 06 5f a8 c0 a8 00 47 cb 69   .4..@.@._....G.i
0020  4e a4 cb a2 01 bb 29 93 ff 5e 56 58 e9 ab 80 10   N.....)..^VX....
0030  44 70 a3 69 00 00 01 01 08 0a 00 00 01 27 0b 72   Dp.i.........'.r
0040  70 f9                                             p.

No.     Time                       Source                Destination           Protocol Length Info
     17 2012-10-11 22:47:16.722742 192.168.0.71          203.105.78.164        SSLv2    168    Client Hello

Frame 17: 168 bytes on wire (1344 bits), 168 bytes captured (1344 bits)
    Arrival Time: Oct 11, 2012 22:47:16.722742000 GTB Standard Time
    Epoch Time: 1349984836.722742000 seconds
    [Time delta from previous captured frame: 0.001267000 seconds]
    [Time delta from previous displayed frame: 0.001267000 seconds]
    [Time since reference or first frame: 8.302854000 seconds]
    Frame Number: 17
    Frame Length: 168 bytes (1344 bits)
    Capture Length: 168 bytes (1344 bits)
    [Frame is marked: False]
    [Frame is ignored: False]
    [Protocols in frame: eth:ip:tcp:ssl]
    [Coloring Rule Name: TCP]
    [Coloring Rule String: tcp]
Ethernet II, Src: SonyComp_ea:13:f9 (00:19:c5:ea:13:f9), Dst: ZyxelCom_8d:62:30 (40:4a:03:8d:62:30)
    Destination: ZyxelCom_8d:62:30 (40:4a:03:8d:62:30)
        Address: ZyxelCom_8d:62:30 (40:4a:03:8d:62:30)
        .... ...0 .... .... .... .... = IG bit: Individual address (unicast)
        .... ..0. .... .... .... .... = LG bit: Globally unique address (factory default)
    Source: SonyComp_ea:13:f9 (00:19:c5:ea:13:f9)
        Address: SonyComp_ea:13:f9 (00:19:c5:ea:13:f9)
        .... ...0 .... .... .... .... = IG bit: Individual address (unicast)
        .... ..0. .... .... .... .... = LG bit: Globally unique address (factory default)
    Type: IP (0x0800)
Internet Protocol Version 4, Src: 192.168.0.71 (192.168.0.71), Dst: 203.105.78.164 (203.105.78.164)
    Version: 4
    Header length: 20 bytes
    Differentiated Services Field: 0x00 (DSCP 0x00: Default; ECN: 0x00: Not-ECT (Not ECN-Capable Transport))
        0000 00.. = Differentiated Services Codepoint: Default (0x00)
        .... ..00 = Explicit Congestion Notification: Not-ECT (Not ECN-Capable Transport) (0x00)
    Total Length: 154
    Identification: 0x0020 (32)
    Flags: 0x02 (Don't Fragment)
        0... .... = Reserved bit: Not set
        .1.. .... = Don't fragment: Set
        ..0. .... = More fragments: Not set
    Fragment offset: 0
    Time to live: 64
    Protocol: TCP (6)
    Header checksum: 0x5f41 [correct]
        [Good: True]
        [Bad: False]
    Source: 192.168.0.71 (192.168.0.71)
    Destination: 203.105.78.164 (203.105.78.164)
Transmission Control Protocol, Src Port: 52130 (52130), Dst Port: https (443), Seq: 1, Ack: 1, Len: 102
    Source port: 52130 (52130)
    Destination port: https (443)
    [Stream index: 2]
    Sequence number: 1    (relative sequence number)
    [Next sequence number: 103    (relative sequence number)]
    Acknowledgement number: 1    (relative ack number)
    Header length: 32 bytes
    Flags: 0x018 (PSH, ACK)
        000. .... .... = Reserved: Not set
        ...0 .... .... = Nonce: Not set
        .... 0... .... = Congestion Window Reduced (CWR): Not set
        .... .0.. .... = ECN-Echo: Not set
        .... ..0. .... = Urgent: Not set
        .... ...1 .... = Acknowledgement: Set
        .... .... 1... = Push: Set
        .... .... .0.. = Reset: Not set
        .... .... ..0. = Syn: Not set
        .... .... ...0 = Fin: Not set
    Window size value: 17520
    [Calculated window size: 17520]
    [Window size scaling factor: 1]
    Checksum: 0x237a [validation disabled]
        [Good Checksum: False]
        [Bad Checksum: False]
    Options: (12 bytes)
        No-Operation (NOP)
        No-Operation (NOP)
        Timestamps: TSval 295, TSecr 192049401
            Kind: Timestamp (8)
            Length: 10
            Timestamp value: 295
            Timestamp echo reply: 192049401
    [SEQ/ACK analysis]
        [Bytes in flight: 103]
Secure Sockets Layer
    SSLv2 Record Layer: Client Hello
        [Version: SSL 2.0 (0x0002)]
        Length: 100
        Handshake Message Type: Client Hello (1)
        Version: TLS 1.0 (0x0301)
        Cipher Spec Length: 75
        Session ID Length: 0
        Challenge Length: 16
        Cipher Specs (25 specs)
            Cipher Spec: TLS_DHE_DSS_WITH_RC4_128_SHA (0x000066)
            Cipher Spec: TLS_DHE_RSA_WITH_3DES_EDE_CBC_SHA (0x000016)
            Cipher Spec: TLS_DHE_DSS_WITH_3DES_EDE_CBC_SHA (0x000013)
            Cipher Spec: TLS_RSA_WITH_3DES_EDE_CBC_SHA (0x00000a)
            Cipher Spec: TLS_RSA_WITH_RC4_128_SHA (0x000005)
            Cipher Spec: TLS_RSA_WITH_RC4_128_MD5 (0x000004)
            Cipher Spec: TLS_DHE_RSA_WITH_DES_CBC_SHA (0x000015)
            Cipher Spec: TLS_DHE_DSS_WITH_DES_CBC_SHA (0x000012)
            Cipher Spec: TLS_RSA_WITH_DES_CBC_SHA (0x000009)
            Cipher Spec: SSL2_DES_192_EDE3_CBC_WITH_MD5 (0x0700c0)
            Cipher Spec: SSL2_RC2_CBC_128_CBC_WITH_MD5 (0x030080)
            Cipher Spec: SSL2_RC4_128_WITH_MD5 (0x010080)
            Cipher Spec: SSL2_DES_64_CBC_WITH_MD5 (0x060040)
            Cipher Spec: TLS_DHE_DSS_EXPORT1024_WITH_DES_CBC_SHA (0x000063)
            Cipher Spec: TLS_DHE_DSS_EXPORT1024_WITH_RC4_56_SHA (0x000065)
            Cipher Spec: TLS_RSA_EXPORT1024_WITH_DES_CBC_SHA (0x000062)
            Cipher Spec: TLS_RSA_EXPORT1024_WITH_RC4_56_SHA (0x000064)
            Cipher Spec: TLS_DHE_RSA_EXPORT_WITH_DES40_CBC_SHA (0x000014)
            Cipher Spec: TLS_DHE_DSS_EXPORT_WITH_DES40_CBC_SHA (0x000011)
            Cipher Spec: TLS_RSA_EXPORT_WITH_DES40_CBC_SHA (0x000008)
            Cipher Spec: TLS_RSA_EXPORT_WITH_RC2_CBC_40_MD5 (0x000006)
            Cipher Spec: TLS_RSA_EXPORT_WITH_RC4_40_MD5 (0x000003)
            Cipher Spec: SSL2_RC2_CBC_128_CBC_WITH_MD5 (0x040080)
            Cipher Spec: SSL2_RC4_128_EXPORT40_WITH_MD5 (0x020080)
            Cipher Spec: SSL2_RC4_64_WITH_MD5 (0x080080)
        Challenge

0000  40 4a 03 8d 62 30 00 19 c5 ea 13 f9 08 00 45 00   @J..b0........E.
0010  00 9a 00 20 40 00 40 06 5f 41 c0 a8 00 47 cb 69   ... @.@._A...G.i
0020  4e a4 cb a2 01 bb 29 93 ff 5e 56 58 e9 ab 80 18   N.....)..^VX....
0030  44 70 23 7a 00 00 01 01 08 0a 00 00 01 27 0b 72   Dp#z.........'.r
0040  70 f9 80 64 01 03 01 00 4b 00 00 00 10 00 00 66   p..d....K......f
0050  00 00 16 00 00 13 00 00 0a 00 00 05 00 00 04 00   ................
0060  00 15 00 00 12 00 00 09 07 00 c0 03 00 80 01 00   ................
0070  80 06 00 40 00 00 63 00 00 65 00 00 62 00 00 64   ...@..c..e..b..d
0080  00 00 14 00 00 11 00 00 08 00 00 06 00 00 03 04   ................
0090  00 80 02 00 80 08 00 80 ae 6e ec df 0b bb e9 91   .........n......
00a0  e2 8a 9e 00 ff 30 aa 6d                           .....0.m

No.     Time                       Source                Destination           Protocol Length Info
     18 2012-10-11 22:47:17.047886 192.168.0.71          203.105.78.164        TCP      66     52130 > https [ACK] Seq=103 Ack=2182 Win=15346 Len=0 TSval=296 TSecr=192049727

Frame 18: 66 bytes on wire (528 bits), 66 bytes captured (528 bits)
    Arrival Time: Oct 11, 2012 22:47:17.047886000 GTB Standard Time
    Epoch Time: 1349984837.047886000 seconds
    [Time delta from previous captured frame: 0.325144000 seconds]
    [Time delta from previous displayed frame: 0.325144000 seconds]
    [Time since reference or first frame: 8.627998000 seconds]
    Frame Number: 18
    Frame Length: 66 bytes (528 bits)
    Capture Length: 66 bytes (528 bits)
    [Frame is marked: False]
    [Frame is ignored: False]
    [Protocols in frame: eth:ip:tcp]
    [Coloring Rule Name: TCP]
    [Coloring Rule String: tcp]
Ethernet II, Src: SonyComp_ea:13:f9 (00:19:c5:ea:13:f9), Dst: ZyxelCom_8d:62:30 (40:4a:03:8d:62:30)
    Destination: ZyxelCom_8d:62:30 (40:4a:03:8d:62:30)
        Address: ZyxelCom_8d:62:30 (40:4a:03:8d:62:30)
        .... ...0 .... .... .... .... = IG bit: Individual address (unicast)
        .... ..0. .... .... .... .... = LG bit: Globally unique address (factory default)
    Source: SonyComp_ea:13:f9 (00:19:c5:ea:13:f9)
        Address: SonyComp_ea:13:f9 (00:19:c5:ea:13:f9)
        .... ...0 .... .... .... .... = IG bit: Individual address (unicast)
        .... ..0. .... .... .... .... = LG bit: Globally unique address (factory default)
    Type: IP (0x0800)
Internet Protocol Version 4, Src: 192.168.0.71 (192.168.0.71), Dst: 203.105.78.164 (203.105.78.164)
    Version: 4
    Header length: 20 bytes
    Differentiated Services Field: 0x00 (DSCP 0x00: Default; ECN: 0x00: Not-ECT (Not ECN-Capable Transport))
        0000 00.. = Differentiated Services Codepoint: Default (0x00)
        .... ..00 = Explicit Congestion Notification: Not-ECT (Not ECN-Capable Transport) (0x00)
    Total Length: 52
    Identification: 0x0021 (33)
    Flags: 0x02 (Don't Fragment)
        0... .... = Reserved bit: Not set
        .1.. .... = Don't fragment: Set
        ..0. .... = More fragments: Not set
    Fragment offset: 0
    Time to live: 64
    Protocol: TCP (6)
    Header checksum: 0x5fa6 [correct]
        [Good: True]
        [Bad: False]
    Source: 192.168.0.71 (192.168.0.71)
    Destination: 203.105.78.164 (203.105.78.164)
Transmission Control Protocol, Src Port: 52130 (52130), Dst Port: https (443), Seq: 103, Ack: 2182, Len: 0
    Source port: 52130 (52130)
    Destination port: https (443)
    [Stream index: 2]
    Sequence number: 103    (relative sequence number)
    Acknowledgement number: 2182    (relative ack number)
    Header length: 32 bytes
    Flags: 0x010 (ACK)
        000. .... .... = Reserved: Not set
        ...0 .... .... = Nonce: Not set
        .... 0... .... = Congestion Window Reduced (CWR): Not set
        .... .0.. .... = ECN-Echo: Not set
        .... ..0. .... = Urgent: Not set
        .... ...1 .... = Acknowledgement: Set
        .... .... 0... = Push: Not set
        .... .... .0.. = Reset: Not set
        .... .... ..0. = Syn: Not set
        .... .... ...0 = Fin: Not set
    Window size value: 15346
    [Calculated window size: 15346]
    [Window size scaling factor: 1]
    Checksum: 0xa1b5 [validation disabled]
        [Good Checksum: False]
        [Bad Checksum: False]
    Options: (12 bytes)
        No-Operation (NOP)
        No-Operation (NOP)
        Timestamps: TSval 296, TSecr 192049727
            Kind: Timestamp (8)
            Length: 10
            Timestamp value: 296
            Timestamp echo reply: 192049727

0000  40 4a 03 8d 62 30 00 19 c5 ea 13 f9 08 00 45 00   @J..b0........E.
0010  00 34 00 21 40 00 40 06 5f a6 c0 a8 00 47 cb 69   .4.!@.@._....G.i
0020  4e a4 cb a2 01 bb 29 93 ff c4 56 58 f2 30 80 10   N.....)...VX.0..
0030  3b f2 a1 b5 00 00 01 01 08 0a 00 00 01 28 0b 72   ;............(.r
0040  72 3f                                             r?

No.     Time                       Source                Destination           Protocol Length Info
     19 2012-10-11 22:47:17.070828 192.168.0.71          203.105.78.164        TLSv1    256    Client Key Exchange, Change Cipher Spec, Encrypted Handshake Message

Frame 19: 256 bytes on wire (2048 bits), 256 bytes captured (2048 bits)
    Arrival Time: Oct 11, 2012 22:47:17.070828000 GTB Standard Time
    Epoch Time: 1349984837.070828000 seconds
    [Time delta from previous captured frame: 0.022942000 seconds]
    [Time delta from previous displayed frame: 0.022942000 seconds]
    [Time since reference or first frame: 8.650940000 seconds]
    Frame Number: 19
    Frame Length: 256 bytes (2048 bits)
    Capture Length: 256 bytes (2048 bits)
    [Frame is marked: False]
    [Frame is ignored: False]
    [Protocols in frame: eth:ip:tcp:ssl]
    [Coloring Rule Name: TCP]
    [Coloring Rule String: tcp]
Ethernet II, Src: SonyComp_ea:13:f9 (00:19:c5:ea:13:f9), Dst: ZyxelCom_8d:62:30 (40:4a:03:8d:62:30)
    Destination: ZyxelCom_8d:62:30 (40:4a:03:8d:62:30)
        Address: ZyxelCom_8d:62:30 (40:4a:03:8d:62:30)
        .... ...0 .... .... .... .... = IG bit: Individual address (unicast)
        .... ..0. .... .... .... .... = LG bit: Globally unique address (factory default)
    Source: SonyComp_ea:13:f9 (00:19:c5:ea:13:f9)
        Address: SonyComp_ea:13:f9 (00:19:c5:ea:13:f9)
        .... ...0 .... .... .... .... = IG bit: Individual address (unicast)
        .... ..0. .... .... .... .... = LG bit: Globally unique address (factory default)
    Type: IP (0x0800)
Internet Protocol Version 4, Src: 192.168.0.71 (192.168.0.71), Dst: 203.105.78.164 (203.105.78.164)
    Version: 4
    Header length: 20 bytes
    Differentiated Services Field: 0x00 (DSCP 0x00: Default; ECN: 0x00: Not-ECT (Not ECN-Capable Transport))
        0000 00.. = Differentiated Services Codepoint: Default (0x00)
        .... ..00 = Explicit Congestion Notification: Not-ECT (Not ECN-Capable Transport) (0x00)
    Total Length: 242
    Identification: 0x0022 (34)
    Flags: 0x02 (Don't Fragment)
        0... .... = Reserved bit: Not set
        .1.. .... = Don't fragment: Set
        ..0. .... = More fragments: Not set
    Fragment offset: 0
    Time to live: 64
    Protocol: TCP (6)
    Header checksum: 0x5ee7 [correct]
        [Good: True]
        [Bad: False]
    Source: 192.168.0.71 (192.168.0.71)
    Destination: 203.105.78.164 (203.105.78.164)
Transmission Control Protocol, Src Port: 52130 (52130), Dst Port: https (443), Seq: 103, Ack: 2182, Len: 190
    Source port: 52130 (52130)
    Destination port: https (443)
    [Stream index: 2]
    Sequence number: 103    (relative sequence number)
    [Next sequence number: 293    (relative sequence number)]
    Acknowledgement number: 2182    (relative ack number)
    Header length: 32 bytes
    Flags: 0x018 (PSH, ACK)
        000. .... .... = Reserved: Not set
        ...0 .... .... = Nonce: Not set
        .... 0... .... = Congestion Window Reduced (CWR): Not set
        .... .0.. .... = ECN-Echo: Not set
        .... ..0. .... = Urgent: Not set
        .... ...1 .... = Acknowledgement: Set
        .... .... 1... = Push: Set
        .... .... .0.. = Reset: Not set
        .... .... ..0. = Syn: Not set
        .... .... ...0 = Fin: Not set
    Window size value: 17520
    [Calculated window size: 17520]
    [Window size scaling factor: 1]
    Checksum: 0x3ab3 [validation disabled]
        [Good Checksum: False]
        [Bad Checksum: False]
    Options: (12 bytes)
        No-Operation (NOP)
        No-Operation (NOP)
        Timestamps: TSval 296, TSecr 192049727
            Kind: Timestamp (8)
            Length: 10
            Timestamp value: 296
            Timestamp echo reply: 192049727
    [SEQ/ACK analysis]
        [Bytes in flight: 293]
Secure Sockets Layer
    TLSv1 Record Layer: Handshake Protocol: Client Key Exchange
        Content Type: Handshake (22)
        Version: TLS 1.0 (0x0301)
        Length: 134
        Handshake Protocol: Client Key Exchange
            Handshake Type: Client Key Exchange (16)
            Length: 130
    TLSv1 Record Layer: Change Cipher Spec Protocol: Change Cipher Spec
        Content Type: Change Cipher Spec (20)
        Version: TLS 1.0 (0x0301)
        Length: 1
        Change Cipher Spec Message
    TLSv1 Record Layer: Handshake Protocol: Encrypted Handshake Message
        Content Type: Handshake (22)
        Version: TLS 1.0 (0x0301)
        Length: 40
        Handshake Protocol: Encrypted Handshake Message

0000  40 4a 03 8d 62 30 00 19 c5 ea 13 f9 08 00 45 00   @J..b0........E.
0010  00 f2 00 22 40 00 40 06 5e e7 c0 a8 00 47 cb 69   ..."@.@.^....G.i
0020  4e a4 cb a2 01 bb 29 93 ff c4 56 58 f2 30 80 18   N.....)...VX.0..
0030  44 70 3a b3 00 00 01 01 08 0a 00 00 01 28 0b 72   Dp:..........(.r
0040  72 3f 16 03 01 00 86 10 00 00 82 00 80 56 47 1c   r?...........VG.
0050  98 53 79 5f 05 b5 b3 47 1d 05 55 e2 44 78 9c 5b   .Sy_...G..U.Dx.[
0060  b0 1a b3 d9 c8 76 91 41 06 71 4a 0a a8 66 20 49   .....v.A.qJ..f I
0070  2c 89 58 47 02 61 eb 3e e1 84 f2 40 66 d4 b6 ec   ,.XG.a.>...@f...
0080  89 d5 00 fb 5c f5 a5 22 e1 26 a8 b8 91 28 ef 26   ....\..".&...(.&
0090  81 95 ac 76 08 00 57 f5 7d 9b c1 e5 c2 4f 7c 3a   ...v..W.}....O|:
00a0  85 5a b5 31 48 88 ef d5 d5 e3 6a b3 08 5b 0b 47   .Z.1H.....j..[.G
00b0  9e e6 50 17 1b ca e9 74 30 02 af 5c 93 bb a2 99   ..P....t0..\....
00c0  29 9e 0c 2f 35 fb 69 81 6c 04 79 97 86 14 03 01   )../5.i.l.y.....
00d0  00 01 01 16 03 01 00 28 52 bc 0f e3 29 53 a1 2f   .......(R...)S./
00e0  38 96 bc 7f 11 65 76 2e 5f 85 90 49 18 5a 86 78   8....ev._..I.Z.x
00f0  6c 68 7e ea 27 bb 97 ae 56 28 09 36 7e 3a a0 c5   lh~.'...V(.6~:..

No.     Time                       Source                Destination           Protocol Length Info
     20 2012-10-11 22:47:17.406219 192.168.0.71          203.105.78.164        TLSv1    519    Application Data

Frame 20: 519 bytes on wire (4152 bits), 519 bytes captured (4152 bits)
    Arrival Time: Oct 11, 2012 22:47:17.406219000 GTB Standard Time
    Epoch Time: 1349984837.406219000 seconds
    [Time delta from previous captured frame: 0.335391000 seconds]
    [Time delta from previous displayed frame: 0.335391000 seconds]
    [Time since reference or first frame: 8.986331000 seconds]
    Frame Number: 20
    Frame Length: 519 bytes (4152 bits)
    Capture Length: 519 bytes (4152 bits)
    [Frame is marked: False]
    [Frame is ignored: False]
    [Protocols in frame: eth:ip:tcp:ssl]
    [Coloring Rule Name: TCP]
    [Coloring Rule String: tcp]
Ethernet II, Src: SonyComp_ea:13:f9 (00:19:c5:ea:13:f9), Dst: ZyxelCom_8d:62:30 (40:4a:03:8d:62:30)
    Destination: ZyxelCom_8d:62:30 (40:4a:03:8d:62:30)
        Address: ZyxelCom_8d:62:30 (40:4a:03:8d:62:30)
        .... ...0 .... .... .... .... = IG bit: Individual address (unicast)
        .... ..0. .... .... .... .... = LG bit: Globally unique address (factory default)
    Source: SonyComp_ea:13:f9 (00:19:c5:ea:13:f9)
        Address: SonyComp_ea:13:f9 (00:19:c5:ea:13:f9)
        .... ...0 .... .... .... .... = IG bit: Individual address (unicast)
        .... ..0. .... .... .... .... = LG bit: Globally unique address (factory default)
    Type: IP (0x0800)
Internet Protocol Version 4, Src: 192.168.0.71 (192.168.0.71), Dst: 203.105.78.164 (203.105.78.164)
    Version: 4
    Header length: 20 bytes
    Differentiated Services Field: 0x00 (DSCP 0x00: Default; ECN: 0x00: Not-ECT (Not ECN-Capable Transport))
        0000 00.. = Differentiated Services Codepoint: Default (0x00)
        .... ..00 = Explicit Congestion Notification: Not-ECT (Not ECN-Capable Transport) (0x00)
    Total Length: 505
    Identification: 0x0023 (35)
    Flags: 0x02 (Don't Fragment)
        0... .... = Reserved bit: Not set
        .1.. .... = Don't fragment: Set
        ..0. .... = More fragments: Not set
    Fragment offset: 0
    Time to live: 64
    Protocol: TCP (6)
    Header checksum: 0x5ddf [correct]
        [Good: True]
        [Bad: False]
    Source: 192.168.0.71 (192.168.0.71)
    Destination: 203.105.78.164 (203.105.78.164)
Transmission Control Protocol, Src Port: 52130 (52130), Dst Port: https (443), Seq: 293, Ack: 2233, Len: 453
    Source port: 52130 (52130)
    Destination port: https (443)
    [Stream index: 2]
    Sequence number: 293    (relative sequence number)
    [Next sequence number: 746    (relative sequence number)]
    Acknowledgement number: 2233    (relative ack number)
    Header length: 32 bytes
    Flags: 0x018 (PSH, ACK)
        000. .... .... = Reserved: Not set
        ...0 .... .... = Nonce: Not set
        .... 0... .... = Congestion Window Reduced (CWR): Not set
        .... .0.. .... = ECN-Echo: Not set
        .... ..0. .... = Urgent: Not set
        .... ...1 .... = Acknowledgement: Set
        .... .... 1... = Push: Set
        .... .... .0.. = Reset: Not set
        .... .... ..0. = Syn: Not set
        .... .... ...0 = Fin: Not set
    Window size value: 17520
    [Calculated window size: 17520]
    [Window size scaling factor: 1]
    Checksum: 0x28fe [validation disabled]
        [Good Checksum: False]
        [Bad Checksum: False]
    Options: (12 bytes)
        No-Operation (NOP)
        No-Operation (NOP)
        Timestamps: TSval 296, TSecr 192050075
            Kind: Timestamp (8)
            Length: 10
            Timestamp value: 296
            Timestamp echo reply: 192050075
    [SEQ/ACK analysis]
        [Bytes in flight: 746]
Secure Sockets Layer
    TLSv1 Record Layer: Application Data Protocol: http
        Content Type: Application Data (23)
        Version: TLS 1.0 (0x0301)
        Length: 448
        Encrypted Application Data: 20038448e2f805dde46cfe6f31d10056c41b195f8e95f4ae...

0000  40 4a 03 8d 62 30 00 19 c5 ea 13 f9 08 00 45 00   @J..b0........E.
0010  01 f9 00 23 40 00 40 06 5d df c0 a8 00 47 cb 69   ...#@.@.]....G.i
0020  4e a4 cb a2 01 bb 29 94 00 82 56 58 f2 63 80 18   N.....)...VX.c..
0030  44 70 28 fe 00 00 01 01 08 0a 00 00 01 28 0b 72   Dp(..........(.r
0040  73 9b 17 03 01 01 c0 20 03 84 48 e2 f8 05 dd e4   s...... ..H.....
0050  6c fe 6f 31 d1 00 56 c4 1b 19 5f 8e 95 f4 ae 17   l.o1..V..._.....
0060  e6 de a5 ee 2c ce b0 8d 87 22 6f 86 7d 0b 9e cd   ....,...."o.}...
0070  0e 5a d5 24 0f 6e 96 a3 91 e1 0d 7a 4f 16 f6 96   .Z.$.n.....zO...
0080  45 1e 04 fa ae 94 33 5f b4 4f e2 ad af 5a df 70   E.....3_.O...Z.p
0090  8c 00 5c 75 19 64 2a 35 e8 25 04 f7 de 9e 9c 31   ..\u.d*5.%.....1
00a0  b4 2c c1 36 8a 70 8f 6d df d4 47 fd 8c d8 91 92   .,.6.p.m..G.....
00b0  1d fe b8 a4 9d 52 cb 0b 6d 48 41 08 f1 8d 9e c9   .....R..mHA.....
00c0  91 ee 92 ad 48 77 5c 39 3d ac 96 84 22 5d a9 19   ....Hw\9=..."]..
00d0  db 9d b8 c2 cd 5c 14 5b 98 4e a7 58 88 48 f0 a9   .....\.[.N.X.H..
00e0  3c 01 7e 31 ba 1a 29 28 0d 24 4c 59 97 c0 75 f8   <.~1..)(.$LY..u.
00f0  05 a7 49 be df f6 ff d3 17 23 66 da 59 e7 94 82   ..I......#f.Y...
0100  2f f3 f3 d6 b1 63 41 59 59 af 79 4b e7 b2 4c e0   /....cAYY.yK..L.
0110  67 50 a1 fe 8f 84 f9 86 46 c4 0e f3 60 9f 0c e7   gP......F...`...
0120  a1 37 0e dc 9b fc 72 c8 1d 65 15 df 55 90 b8 71   .7....r..e..U..q
0130  be 5a cd ad 72 e0 9e 96 66 9b 75 71 3a c3 4c d8   .Z..r...f.uq:.L.
0140  56 d6 cb 32 0e 04 03 4f 17 40 ea 2d 8a be fb 4f   V..2...O.@.-...O
0150  6c be 85 78 91 dc 0e cc b8 3c 0c a6 dc c6 2c 69   l..x.....<....,i
0160  9c 77 1a 70 f9 7c 83 5d 97 21 7a 40 0e 18 d1 47   .w.p.|.].!z@...G
0170  ab c2 32 e3 88 5e 13 a0 79 d4 53 83 8e 63 b2 8f   ..2..^..y.S..c..
0180  cb 17 9e 0a b4 c7 ff cc 5d 57 f6 42 25 b3 3b 73   ........]W.B%.;s
0190  1f 0d cf 9e 3d d2 dd e9 a5 7c 88 62 41 33 80 ba   ....=....|.bA3..
01a0  83 65 ad 2d 44 63 3a b2 16 71 ed 18 84 d6 7d dd   .e.-Dc:..q....}.
01b0  8c 4f 31 ba 1c fd 6b 13 c2 b3 fe 84 ba 24 97 14   .O1...k......$..
01c0  20 b9 50 bc 16 30 45 81 30 7d ae 74 54 a7 a9 fd    .P..0E.0}.tT...
01d0  c2 15 cd 39 e7 5f 00 f4 74 2f a5 9b 26 0a b2 f1   ...9._..t/..&...
01e0  2b 78 55 6e 0a 98 cb a4 2c 51 bb 54 12 ab d9 6d   +xUn....,Q.T...m
01f0  dd e9 b0 42 ee b1 ed a0 15 42 4a 66 3d 76 2b e4   ...B.....BJf=v+.
0200  0b f5 5f c7 f7 3a 63                              .._..:c

No.     Time                       Source                Destination           Protocol Length Info
     21 2012-10-11 22:47:17.735564 192.168.0.71          203.105.78.164        TCP      66     52130 > https [ACK] Seq=746 Ack=2712 Win=17041 Len=0 TSval=297 TSecr=192050415

Frame 21: 66 bytes on wire (528 bits), 66 bytes captured (528 bits)
    Arrival Time: Oct 11, 2012 22:47:17.735564000 GTB Standard Time
    Epoch Time: 1349984837.735564000 seconds
    [Time delta from previous captured frame: 0.329345000 seconds]
    [Time delta from previous displayed frame: 0.329345000 seconds]
    [Time since reference or first frame: 9.315676000 seconds]
    Frame Number: 21
    Frame Length: 66 bytes (528 bits)
    Capture Length: 66 bytes (528 bits)
    [Frame is marked: False]
    [Frame is ignored: False]
    [Protocols in frame: eth:ip:tcp]
    [Coloring Rule Name: TCP]
    [Coloring Rule String: tcp]
Ethernet II, Src: SonyComp_ea:13:f9 (00:19:c5:ea:13:f9), Dst: ZyxelCom_8d:62:30 (40:4a:03:8d:62:30)
    Destination: ZyxelCom_8d:62:30 (40:4a:03:8d:62:30)
        Address: ZyxelCom_8d:62:30 (40:4a:03:8d:62:30)
        .... ...0 .... .... .... .... = IG bit: Individual address (unicast)
        .... ..0. .... .... .... .... = LG bit: Globally unique address (factory default)
    Source: SonyComp_ea:13:f9 (00:19:c5:ea:13:f9)
        Address: SonyComp_ea:13:f9 (00:19:c5:ea:13:f9)
        .... ...0 .... .... .... .... = IG bit: Individual address (unicast)
        .... ..0. .... .... .... .... = LG bit: Globally unique address (factory default)
    Type: IP (0x0800)
Internet Protocol Version 4, Src: 192.168.0.71 (192.168.0.71), Dst: 203.105.78.164 (203.105.78.164)
    Version: 4
    Header length: 20 bytes
    Differentiated Services Field: 0x00 (DSCP 0x00: Default; ECN: 0x00: Not-ECT (Not ECN-Capable Transport))
        0000 00.. = Differentiated Services Codepoint: Default (0x00)
        .... ..00 = Explicit Congestion Notification: Not-ECT (Not ECN-Capable Transport) (0x00)
    Total Length: 52
    Identification: 0x0024 (36)
    Flags: 0x02 (Don't Fragment)
        0... .... = Reserved bit: Not set
        .1.. .... = Don't fragment: Set
        ..0. .... = More fragments: Not set
    Fragment offset: 0
    Time to live: 64
    Protocol: TCP (6)
    Header checksum: 0x5fa3 [correct]
        [Good: True]
        [Bad: False]
    Source: 192.168.0.71 (192.168.0.71)
    Destination: 203.105.78.164 (203.105.78.164)
Transmission Control Protocol, Src Port: 52130 (52130), Dst Port: https (443), Seq: 746, Ack: 2712, Len: 0
    Source port: 52130 (52130)
    Destination port: https (443)
    [Stream index: 2]
    Sequence number: 746    (relative sequence number)
    Acknowledgement number: 2712    (relative ack number)
    Header length: 32 bytes
    Flags: 0x010 (ACK)
        000. .... .... = Reserved: Not set
        ...0 .... .... = Nonce: Not set
        .... 0... .... = Congestion Window Reduced (CWR): Not set
        .... .0.. .... = ECN-Echo: Not set
        .... ..0. .... = Urgent: Not set
        .... ...1 .... = Acknowledgement: Set
        .... .... 0... = Push: Not set
        .... .... .0.. = Reset: Not set
        .... .... ..0. = Syn: Not set
        .... .... ...0 = Fin: Not set
    Window size value: 17041
    [Calculated window size: 17041]
    [Window size scaling factor: 1]
    Checksum: 0x93d0 [validation disabled]
        [Good Checksum: False]
        [Bad Checksum: False]
    Options: (12 bytes)
        No-Operation (NOP)
        No-Operation (NOP)
        Timestamps: TSval 297, TSecr 192050415
            Kind: Timestamp (8)
            Length: 10
            Timestamp value: 297
            Timestamp echo reply: 192050415

0000  40 4a 03 8d 62 30 00 19 c5 ea 13 f9 08 00 45 00   @J..b0........E.
0010  00 34 00 24 40 00 40 06 5f a3 c0 a8 00 47 cb 69   .4.$@.@._....G.i
0020  4e a4 cb a2 01 bb 29 94 02 47 56 58 f4 42 80 10   N.....)..GVX.B..
0030  42 91 93 d0 00 00 01 01 08 0a 00 00 01 29 0b 72   B............).r
0040  74 ef                                             t.

