No.     Time                       Source                Destination           Protocol Length Info
      1 2012-10-11 22:08:42.005096 192.168.0.71          69.10.30.242          TCP      74     58625 > 29900 [SYN] Seq=0 Win=16384 Len=0 MSS=1460 WS=1 TSval=4779 TSecr=0

Frame 1: 74 bytes on wire (592 bits), 74 bytes captured (592 bits)
    Arrival Time: Oct 11, 2012 22:08:42.005096000 GTB Standard Time
    Epoch Time: 1349982522.005096000 seconds
    [Time delta from previous captured frame: 0.000000000 seconds]
    [Time delta from previous displayed frame: 0.000000000 seconds]
    [Time since reference or first frame: 0.000000000 seconds]
    Frame Number: 1
    Frame Length: 74 bytes (592 bits)
    Capture Length: 74 bytes (592 bits)
    [Frame is marked: False]
    [Frame is ignored: False]
    [Protocols in frame: eth:ip:tcp]
    [Coloring Rule Name: TCP SYN/FIN]
    [Coloring Rule String: tcp.flags & 0x02 || tcp.flags.fin == 1]
Ethernet II, Src: SonyComp_ea:13:f9 (00:19:c5:ea:13:f9), Dst: ZyxelCom_8d:62:30 (40:4a:03:8d:62:30)
    Destination: ZyxelCom_8d:62:30 (40:4a:03:8d:62:30)
        Address: ZyxelCom_8d:62:30 (40:4a:03:8d:62:30)
        .... ...0 .... .... .... .... = IG bit: Individual address (unicast)
        .... ..0. .... .... .... .... = LG bit: Globally unique address (factory default)
    Source: SonyComp_ea:13:f9 (00:19:c5:ea:13:f9)
        Address: SonyComp_ea:13:f9 (00:19:c5:ea:13:f9)
        .... ...0 .... .... .... .... = IG bit: Individual address (unicast)
        .... ..0. .... .... .... .... = LG bit: Globally unique address (factory default)
    Type: IP (0x0800)
Internet Protocol Version 4, Src: 192.168.0.71 (192.168.0.71), Dst: 69.10.30.242 (69.10.30.242)
    Version: 4
    Header length: 20 bytes
    Differentiated Services Field: 0x00 (DSCP 0x00: Default; ECN: 0x00: Not-ECT (Not ECN-Capable Transport))
        0000 00.. = Differentiated Services Codepoint: Default (0x00)
        .... ..00 = Explicit Congestion Notification: Not-ECT (Not ECN-Capable Transport) (0x00)
    Total Length: 60
    Identification: 0x008f (143)
    Flags: 0x02 (Don't Fragment)
        0... .... = Reserved bit: Not set
        .1.. .... = Don't fragment: Set
        ..0. .... = More fragments: Not set
    Fragment offset: 0
    Time to live: 64
    Protocol: TCP (6)
    Header checksum: 0x1542 [correct]
        [Good: True]
        [Bad: False]
    Source: 192.168.0.71 (192.168.0.71)
    Destination: 69.10.30.242 (69.10.30.242)
Transmission Control Protocol, Src Port: 58625 (58625), Dst Port: 29900 (29900), Seq: 0, Len: 0
    Source port: 58625 (58625)
    Destination port: 29900 (29900)
    [Stream index: 0]
    Sequence number: 0    (relative sequence number)
    Header length: 40 bytes
    Flags: 0x002 (SYN)
        000. .... .... = Reserved: Not set
        ...0 .... .... = Nonce: Not set
        .... 0... .... = Congestion Window Reduced (CWR): Not set
        .... .0.. .... = ECN-Echo: Not set
        .... ..0. .... = Urgent: Not set
        .... ...0 .... = Acknowledgement: Not set
        .... .... 0... = Push: Not set
        .... .... .0.. = Reset: Not set
        .... .... ..1. = Syn: Set
            [Expert Info (Chat/Sequence): Connection establish request (SYN): server port 29900]
                [Message: Connection establish request (SYN): server port 29900]
                [Severity level: Chat]
                [Group: Sequence]
        .... .... ...0 = Fin: Not set
    Window size value: 16384
    [Calculated window size: 16384]
    Checksum: 0xfdef [validation disabled]
        [Good Checksum: False]
        [Bad Checksum: False]
    Options: (20 bytes)
        Maximum segment size: 1460 bytes
        No-Operation (NOP)
        Window scale: 0 (multiply by 1)
            Kind: Window Scale (3)
            Length: 3
            Shift count: 0
            [Multiplier: 1]
        No-Operation (NOP)
        No-Operation (NOP)
        Timestamps: TSval 4779, TSecr 0
            Kind: Timestamp (8)
            Length: 10
            Timestamp value: 4779
            Timestamp echo reply: 0

0000  40 4a 03 8d 62 30 00 19 c5 ea 13 f9 08 00 45 00   @J..b0........E.
0010  00 3c 00 8f 40 00 40 06 15 42 c0 a8 00 47 45 0a   .<..@.@..B...GE.
0020  1e f2 e5 01 74 cc b8 50 c3 62 00 00 00 00 a0 02   ....t..P.b......
0030  40 00 fd ef 00 00 02 04 05 b4 01 03 03 00 01 01   @...............
0040  08 0a 00 00 12 ab 00 00 00 00                     ..........

No.     Time                       Source                Destination           Protocol Length Info
      3 2012-10-11 22:08:42.217714 192.168.0.71          69.10.30.242          TCP      66     58625 > 29900 [ACK] Seq=1 Ack=1 Win=17520 Len=0 TSval=4779 TSecr=0

Frame 3: 66 bytes on wire (528 bits), 66 bytes captured (528 bits)
    Arrival Time: Oct 11, 2012 22:08:42.217714000 GTB Standard Time
    Epoch Time: 1349982522.217714000 seconds
    [Time delta from previous captured frame: 0.000522000 seconds]
    [Time delta from previous displayed frame: 0.212618000 seconds]
    [Time since reference or first frame: 0.212618000 seconds]
    Frame Number: 3
    Frame Length: 66 bytes (528 bits)
    Capture Length: 66 bytes (528 bits)
    [Frame is marked: False]
    [Frame is ignored: False]
    [Protocols in frame: eth:ip:tcp]
    [Coloring Rule Name: TCP]
    [Coloring Rule String: tcp]
Ethernet II, Src: SonyComp_ea:13:f9 (00:19:c5:ea:13:f9), Dst: ZyxelCom_8d:62:30 (40:4a:03:8d:62:30)
    Destination: ZyxelCom_8d:62:30 (40:4a:03:8d:62:30)
        Address: ZyxelCom_8d:62:30 (40:4a:03:8d:62:30)
        .... ...0 .... .... .... .... = IG bit: Individual address (unicast)
        .... ..0. .... .... .... .... = LG bit: Globally unique address (factory default)
    Source: SonyComp_ea:13:f9 (00:19:c5:ea:13:f9)
        Address: SonyComp_ea:13:f9 (00:19:c5:ea:13:f9)
        .... ...0 .... .... .... .... = IG bit: Individual address (unicast)
        .... ..0. .... .... .... .... = LG bit: Globally unique address (factory default)
    Type: IP (0x0800)
Internet Protocol Version 4, Src: 192.168.0.71 (192.168.0.71), Dst: 69.10.30.242 (69.10.30.242)
    Version: 4
    Header length: 20 bytes
    Differentiated Services Field: 0x00 (DSCP 0x00: Default; ECN: 0x00: Not-ECT (Not ECN-Capable Transport))
        0000 00.. = Differentiated Services Codepoint: Default (0x00)
        .... ..00 = Explicit Congestion Notification: Not-ECT (Not ECN-Capable Transport) (0x00)
    Total Length: 52
    Identification: 0x0090 (144)
    Flags: 0x02 (Don't Fragment)
        0... .... = Reserved bit: Not set
        .1.. .... = Don't fragment: Set
        ..0. .... = More fragments: Not set
    Fragment offset: 0
    Time to live: 64
    Protocol: TCP (6)
    Header checksum: 0x1549 [correct]
        [Good: True]
        [Bad: False]
    Source: 192.168.0.71 (192.168.0.71)
    Destination: 69.10.30.242 (69.10.30.242)
Transmission Control Protocol, Src Port: 58625 (58625), Dst Port: 29900 (29900), Seq: 1, Ack: 1, Len: 0
    Source port: 58625 (58625)
    Destination port: 29900 (29900)
    [Stream index: 0]
    Sequence number: 1    (relative sequence number)
    Acknowledgement number: 1    (relative ack number)
    Header length: 32 bytes
    Flags: 0x010 (ACK)
        000. .... .... = Reserved: Not set
        ...0 .... .... = Nonce: Not set
        .... 0... .... = Congestion Window Reduced (CWR): Not set
        .... .0.. .... = ECN-Echo: Not set
        .... ..0. .... = Urgent: Not set
        .... ...1 .... = Acknowledgement: Set
        .... .... 0... = Push: Not set
        .... .... .0.. = Reset: Not set
        .... .... ..0. = Syn: Not set
        .... .... ...0 = Fin: Not set
    Window size value: 17520
    [Calculated window size: 17520]
    [Window size scaling factor: 1]
    Checksum: 0xf57b [validation disabled]
        [Good Checksum: False]
        [Bad Checksum: False]
    Options: (12 bytes)
        No-Operation (NOP)
        No-Operation (NOP)
        Timestamps: TSval 4779, TSecr 0
            Kind: Timestamp (8)
            Length: 10
            Timestamp value: 4779
            Timestamp echo reply: 0

0000  40 4a 03 8d 62 30 00 19 c5 ea 13 f9 08 00 45 00   @J..b0........E.
0010  00 34 00 90 40 00 40 06 15 49 c0 a8 00 47 45 0a   .4..@.@..I...GE.
0020  1e f2 e5 01 74 cc b8 50 c3 63 20 c9 0e ef 80 10   ....t..P.c .....
0030  44 70 f5 7b 00 00 01 01 08 0a 00 00 12 ab 00 00   Dp.{............
0040  00 00                                             ..

No.     Time                       Source                Destination           Protocol Length Info
      4 2012-10-11 22:08:42.464394 192.168.0.71          69.10.30.242          TCP      264    58625 > 29900 [PSH, ACK] Seq=1 Ack=39 Win=17520 Len=198 TSval=4780 TSecr=26298091

Frame 4: 264 bytes on wire (2112 bits), 264 bytes captured (2112 bits)
    Arrival Time: Oct 11, 2012 22:08:42.464394000 GTB Standard Time
    Epoch Time: 1349982522.464394000 seconds
    [Time delta from previous captured frame: 0.246680000 seconds]
    [Time delta from previous displayed frame: 0.246680000 seconds]
    [Time since reference or first frame: 0.459298000 seconds]
    Frame Number: 4
    Frame Length: 264 bytes (2112 bits)
    Capture Length: 264 bytes (2112 bits)
    [Frame is marked: False]
    [Frame is ignored: False]
    [Protocols in frame: eth:ip:tcp:data]
    [Coloring Rule Name: TCP]
    [Coloring Rule String: tcp]
Ethernet II, Src: SonyComp_ea:13:f9 (00:19:c5:ea:13:f9), Dst: ZyxelCom_8d:62:30 (40:4a:03:8d:62:30)
    Destination: ZyxelCom_8d:62:30 (40:4a:03:8d:62:30)
        Address: ZyxelCom_8d:62:30 (40:4a:03:8d:62:30)
        .... ...0 .... .... .... .... = IG bit: Individual address (unicast)
        .... ..0. .... .... .... .... = LG bit: Globally unique address (factory default)
    Source: SonyComp_ea:13:f9 (00:19:c5:ea:13:f9)
        Address: SonyComp_ea:13:f9 (00:19:c5:ea:13:f9)
        .... ...0 .... .... .... .... = IG bit: Individual address (unicast)
        .... ..0. .... .... .... .... = LG bit: Globally unique address (factory default)
    Type: IP (0x0800)
Internet Protocol Version 4, Src: 192.168.0.71 (192.168.0.71), Dst: 69.10.30.242 (69.10.30.242)
    Version: 4
    Header length: 20 bytes
    Differentiated Services Field: 0x00 (DSCP 0x00: Default; ECN: 0x00: Not-ECT (Not ECN-Capable Transport))
        0000 00.. = Differentiated Services Codepoint: Default (0x00)
        .... ..00 = Explicit Congestion Notification: Not-ECT (Not ECN-Capable Transport) (0x00)
    Total Length: 250
    Identification: 0x0091 (145)
    Flags: 0x02 (Don't Fragment)
        0... .... = Reserved bit: Not set
        .1.. .... = Don't fragment: Set
        ..0. .... = More fragments: Not set
    Fragment offset: 0
    Time to live: 64
    Protocol: TCP (6)
    Header checksum: 0x1482 [correct]
        [Good: True]
        [Bad: False]
    Source: 192.168.0.71 (192.168.0.71)
    Destination: 69.10.30.242 (69.10.30.242)
Transmission Control Protocol, Src Port: 58625 (58625), Dst Port: 29900 (29900), Seq: 1, Ack: 39, Len: 198
    Source port: 58625 (58625)
    Destination port: 29900 (29900)
    [Stream index: 0]
    Sequence number: 1    (relative sequence number)
    [Next sequence number: 199    (relative sequence number)]
    Acknowledgement number: 39    (relative ack number)
    Header length: 32 bytes
    Flags: 0x018 (PSH, ACK)
        000. .... .... = Reserved: Not set
        ...0 .... .... = Nonce: Not set
        .... 0... .... = Congestion Window Reduced (CWR): Not set
        .... .0.. .... = ECN-Echo: Not set
        .... ..0. .... = Urgent: Not set
        .... ...1 .... = Acknowledgement: Set
        .... .... 1... = Push: Set
        .... .... .0.. = Reset: Not set
        .... .... ..0. = Syn: Not set
        .... .... ...0 = Fin: Not set
    Window size value: 17520
    [Calculated window size: 17520]
    [Window size scaling factor: 1]
    Checksum: 0xe764 [validation disabled]
        [Good Checksum: False]
        [Bad Checksum: False]
    Options: (12 bytes)
        No-Operation (NOP)
        No-Operation (NOP)
        Timestamps: TSval 4780, TSecr 26298091
            Kind: Timestamp (8)
            Length: 10
            Timestamp value: 4780
            Timestamp echo reply: 26298091
    [SEQ/ACK analysis]
        [Bytes in flight: 199]
Data (198 bytes)
    Data: 5c6c6f67696e5c5c6368616c6c656e67655c485362416a4d...
    [Length: 198]

0000  40 4a 03 8d 62 30 00 19 c5 ea 13 f9 08 00 45 00   @J..b0........E.
0010  00 fa 00 91 40 00 40 06 14 82 c0 a8 00 47 45 0a   ....@.@......GE.
0020  1e f2 e5 01 74 cc b8 50 c3 63 20 c9 0f 15 80 18   ....t..P.c .....
0030  44 70 e7 64 00 00 01 01 08 0a 00 00 12 ac 01 91   Dp.d............
0040  46 eb 5c 6c 6f 67 69 6e 5c 5c 63 68 61 6c 6c 65   F.\login\\challe
0050  6e 67 65 5c 48 53 62 41 6a 4d 72 4d 68 57 4c 43   nge\HSbAjMrMhWLC
0060  68 61 5a 41 5a 65 31 4d 33 4b 56 4d 4e 77 4e 4f   haZAZe1M3KVMNwNO
0070  37 43 4e 38 5c 75 6e 69 71 75 65 6e 69 63 6b 5c   7CN8\uniquenick\
0080  62 61 6a 73 6d 61 6e 6e 65 6e 5c 72 65 73 70 6f   bajsmannen\respo
0090  6e 73 65 5c 32 34 39 38 34 66 65 38 37 62 64 63   nse\24984fe87bdc
00a0  39 35 64 36 32 65 30 65 63 37 37 65 31 66 34 36   95d62e0ec77e1f46
00b0  66 37 36 35 5c 66 69 72 65 77 61 6c 6c 5c 31 5c   f765\firewall\1\
00c0  70 6f 72 74 5c 30 5c 70 72 6f 64 75 63 74 69 64   port\0\productid
00d0  5c 31 30 33 30 37 5c 67 61 6d 65 6e 61 6d 65 5c   \10307\gamename\
00e0  62 66 69 65 6c 64 31 39 34 32 70 73 32 5c 6e 61   bfield1942ps2\na
00f0  6d 65 73 70 61 63 65 69 64 5c 31 33 5c 69 64 5c   mespaceid\13\id\
0100  31 5c 66 69 6e 61 6c 5c                           1\final\

No.     Time                       Source                Destination           Protocol Length Info
      5 2012-10-11 22:08:42.705273 192.168.0.71          69.10.24.135          TCP      74     58624 > http [SYN] Seq=0 Win=16384 Len=0 MSS=1460 WS=1 TSval=4780 TSecr=0

Frame 5: 74 bytes on wire (592 bits), 74 bytes captured (592 bits)
    Arrival Time: Oct 11, 2012 22:08:42.705273000 GTB Standard Time
    Epoch Time: 1349982522.705273000 seconds
    [Time delta from previous captured frame: 0.240879000 seconds]
    [Time delta from previous displayed frame: 0.240879000 seconds]
    [Time since reference or first frame: 0.700177000 seconds]
    Frame Number: 5
    Frame Length: 74 bytes (592 bits)
    Capture Length: 74 bytes (592 bits)
    [Frame is marked: False]
    [Frame is ignored: False]
    [Protocols in frame: eth:ip:tcp]
    [Coloring Rule Name: HTTP]
    [Coloring Rule String: http || tcp.port == 80]
Ethernet II, Src: SonyComp_ea:13:f9 (00:19:c5:ea:13:f9), Dst: ZyxelCom_8d:62:30 (40:4a:03:8d:62:30)
    Destination: ZyxelCom_8d:62:30 (40:4a:03:8d:62:30)
        Address: ZyxelCom_8d:62:30 (40:4a:03:8d:62:30)
        .... ...0 .... .... .... .... = IG bit: Individual address (unicast)
        .... ..0. .... .... .... .... = LG bit: Globally unique address (factory default)
    Source: SonyComp_ea:13:f9 (00:19:c5:ea:13:f9)
        Address: SonyComp_ea:13:f9 (00:19:c5:ea:13:f9)
        .... ...0 .... .... .... .... = IG bit: Individual address (unicast)
        .... ..0. .... .... .... .... = LG bit: Globally unique address (factory default)
    Type: IP (0x0800)
Internet Protocol Version 4, Src: 192.168.0.71 (192.168.0.71), Dst: 69.10.24.135 (69.10.24.135)
    Version: 4
    Header length: 20 bytes
    Differentiated Services Field: 0x00 (DSCP 0x00: Default; ECN: 0x00: Not-ECT (Not ECN-Capable Transport))
        0000 00.. = Differentiated Services Codepoint: Default (0x00)
        .... ..00 = Explicit Congestion Notification: Not-ECT (Not ECN-Capable Transport) (0x00)
    Total Length: 60
    Identification: 0x0092 (146)
    Flags: 0x02 (Don't Fragment)
        0... .... = Reserved bit: Not set
        .1.. .... = Don't fragment: Set
        ..0. .... = More fragments: Not set
    Fragment offset: 0
    Time to live: 64
    Protocol: TCP (6)
    Header checksum: 0x1baa [correct]
        [Good: True]
        [Bad: False]
    Source: 192.168.0.71 (192.168.0.71)
    Destination: 69.10.24.135 (69.10.24.135)
Transmission Control Protocol, Src Port: 58624 (58624), Dst Port: http (80), Seq: 0, Len: 0
    Source port: 58624 (58624)
    Destination port: http (80)
    [Stream index: 1]
    Sequence number: 0    (relative sequence number)
    Header length: 40 bytes
    Flags: 0x002 (SYN)
        000. .... .... = Reserved: Not set
        ...0 .... .... = Nonce: Not set
        .... 0... .... = Congestion Window Reduced (CWR): Not set
        .... .0.. .... = ECN-Echo: Not set
        .... ..0. .... = Urgent: Not set
        .... ...0 .... = Acknowledgement: Not set
        .... .... 0... = Push: Not set
        .... .... .0.. = Reset: Not set
        .... .... ..1. = Syn: Set
            [Expert Info (Chat/Sequence): Connection establish request (SYN): server port http]
                [Message: Connection establish request (SYN): server port http]
                [Severity level: Chat]
                [Group: Sequence]
        .... .... ...0 = Fin: Not set
    Window size value: 16384
    [Calculated window size: 16384]
    Checksum: 0xc567 [validation disabled]
        [Good Checksum: False]
        [Bad Checksum: False]
    Options: (20 bytes)
        Maximum segment size: 1460 bytes
        No-Operation (NOP)
        Window scale: 0 (multiply by 1)
            Kind: Window Scale (3)
            Length: 3
            Shift count: 0
            [Multiplier: 1]
        No-Operation (NOP)
        No-Operation (NOP)
        Timestamps: TSval 4780, TSecr 0
            Kind: Timestamp (8)
            Length: 10
            Timestamp value: 4780
            Timestamp echo reply: 0

0000  40 4a 03 8d 62 30 00 19 c5 ea 13 f9 08 00 45 00   @J..b0........E.
0010  00 3c 00 92 40 00 40 06 1b aa c0 a8 00 47 45 0a   .<..@.@......GE.
0020  18 87 e5 00 00 50 ba 4b 74 d7 00 00 00 00 a0 02   .....P.Kt.......
0030  40 00 c5 67 00 00 02 04 05 b4 01 03 03 00 01 01   @..g............
0040  08 0a 00 00 12 ac 00 00 00 00                     ..........

No.     Time                       Source                Destination           Protocol Length Info
      6 2012-10-11 22:08:42.705528 192.168.0.71          69.10.24.135          TCP      74     58623 > http [SYN] Seq=0 Win=16384 Len=0 MSS=1460 WS=1 TSval=4780 TSecr=0

Frame 6: 74 bytes on wire (592 bits), 74 bytes captured (592 bits)
    Arrival Time: Oct 11, 2012 22:08:42.705528000 GTB Standard Time
    Epoch Time: 1349982522.705528000 seconds
    [Time delta from previous captured frame: 0.000255000 seconds]
    [Time delta from previous displayed frame: 0.000255000 seconds]
    [Time since reference or first frame: 0.700432000 seconds]
    Frame Number: 6
    Frame Length: 74 bytes (592 bits)
    Capture Length: 74 bytes (592 bits)
    [Frame is marked: False]
    [Frame is ignored: False]
    [Protocols in frame: eth:ip:tcp]
Ethernet II, Src: SonyComp_ea:13:f9 (00:19:c5:ea:13:f9), Dst: ZyxelCom_8d:62:30 (40:4a:03:8d:62:30)
    Destination: ZyxelCom_8d:62:30 (40:4a:03:8d:62:30)
        Address: ZyxelCom_8d:62:30 (40:4a:03:8d:62:30)
        .... ...0 .... .... .... .... = IG bit: Individual address (unicast)
        .... ..0. .... .... .... .... = LG bit: Globally unique address (factory default)
    Source: SonyComp_ea:13:f9 (00:19:c5:ea:13:f9)
        Address: SonyComp_ea:13:f9 (00:19:c5:ea:13:f9)
        .... ...0 .... .... .... .... = IG bit: Individual address (unicast)
        .... ..0. .... .... .... .... = LG bit: Globally unique address (factory default)
    Type: IP (0x0800)
Internet Protocol Version 4, Src: 192.168.0.71 (192.168.0.71), Dst: 69.10.24.135 (69.10.24.135)
    Version: 4
    Header length: 20 bytes
    Differentiated Services Field: 0x00 (DSCP 0x00: Default; ECN: 0x00: Not-ECT (Not ECN-Capable Transport))
        0000 00.. = Differentiated Services Codepoint: Default (0x00)
        .... ..00 = Explicit Congestion Notification: Not-ECT (Not ECN-Capable Transport) (0x00)
    Total Length: 60
    Identification: 0x0093 (147)
    Flags: 0x02 (Don't Fragment)
        0... .... = Reserved bit: Not set
        .1.. .... = Don't fragment: Set
        ..0. .... = More fragments: Not set
    Fragment offset: 0
    Time to live: 64
    Protocol: TCP (6)
    Header checksum: 0x1ba9 [correct]
        [Good: True]
        [Bad: False]
    Source: 192.168.0.71 (192.168.0.71)
    Destination: 69.10.24.135 (69.10.24.135)
Transmission Control Protocol, Src Port: 58623 (58623), Dst Port: http (80), Seq: 0, Len: 0
    Source port: 58623 (58623)
    Destination port: http (80)
    [Stream index: 2]
    Sequence number: 0    (relative sequence number)
    Header length: 40 bytes
    Flags: 0x002 (SYN)
        000. .... .... = Reserved: Not set
        ...0 .... .... = Nonce: Not set
        .... 0... .... = Congestion Window Reduced (CWR): Not set
        .... .0.. .... = ECN-Echo: Not set
        .... ..0. .... = Urgent: Not set
        .... ...0 .... = Acknowledgement: Not set
        .... .... 0... = Push: Not set
        .... .... .0.. = Reset: Not set
        .... .... ..1. = Syn: Set
            [Expert Info (Chat/Sequence): Connection establish request (SYN): server port http]
                [Message: Connection establish request (SYN): server port http]
                [Severity level: Chat]
                [Group: Sequence]
        .... .... ...0 = Fin: Not set
    Window size value: 16384
    [Calculated window size: 16384]
    Checksum: 0x6318 [validation disabled]
        [Good Checksum: False]
        [Bad Checksum: False]
    Options: (20 bytes)
        Maximum segment size: 1460 bytes
        No-Operation (NOP)
        Window scale: 0 (multiply by 1)
            Kind: Window Scale (3)
            Length: 3
            Shift count: 0
            [Multiplier: 1]
        No-Operation (NOP)
        No-Operation (NOP)
        Timestamps: TSval 4780, TSecr 0
            Kind: Timestamp (8)
            Length: 10
            Timestamp value: 4780
            Timestamp echo reply: 0

0000  40 4a 03 8d 62 30 00 19 c5 ea 13 f9 08 00 45 00   @J..b0........E.
0010  00 3c 00 93 40 00 40 06 1b a9 c0 a8 00 47 45 0a   .<..@.@......GE.
0020  18 87 e4 ff 00 50 bb e3 d5 8f 00 00 00 00 a0 02   .....P..........
0030  40 00 63 18 00 00 02 04 05 b4 01 03 03 00 01 01   @.c.............
0040  08 0a 00 00 12 ac 00 00 00 00                     ..........

No.     Time                       Source                Destination           Protocol Length Info
      7 2012-10-11 22:08:42.705854 192.168.0.71          69.10.24.135          TCP      74     58622 > http [SYN] Seq=0 Win=16384 Len=0 MSS=1460 WS=1 TSval=4780 TSecr=0

Frame 7: 74 bytes on wire (592 bits), 74 bytes captured (592 bits)
    Arrival Time: Oct 11, 2012 22:08:42.705854000 GTB Standard Time
    Epoch Time: 1349982522.705854000 seconds
    [Time delta from previous captured frame: 0.000326000 seconds]
    [Time delta from previous displayed frame: 0.000326000 seconds]
    [Time since reference or first frame: 0.700758000 seconds]
    Frame Number: 7
    Frame Length: 74 bytes (592 bits)
    Capture Length: 74 bytes (592 bits)
    [Frame is marked: False]
    [Frame is ignored: False]
    [Protocols in frame: eth:ip:tcp]
Ethernet II, Src: SonyComp_ea:13:f9 (00:19:c5:ea:13:f9), Dst: ZyxelCom_8d:62:30 (40:4a:03:8d:62:30)
    Destination: ZyxelCom_8d:62:30 (40:4a:03:8d:62:30)
        Address: ZyxelCom_8d:62:30 (40:4a:03:8d:62:30)
        .... ...0 .... .... .... .... = IG bit: Individual address (unicast)
        .... ..0. .... .... .... .... = LG bit: Globally unique address (factory default)
    Source: SonyComp_ea:13:f9 (00:19:c5:ea:13:f9)
        Address: SonyComp_ea:13:f9 (00:19:c5:ea:13:f9)
        .... ...0 .... .... .... .... = IG bit: Individual address (unicast)
        .... ..0. .... .... .... .... = LG bit: Globally unique address (factory default)
    Type: IP (0x0800)
Internet Protocol Version 4, Src: 192.168.0.71 (192.168.0.71), Dst: 69.10.24.135 (69.10.24.135)
    Version: 4
    Header length: 20 bytes
    Differentiated Services Field: 0x00 (DSCP 0x00: Default; ECN: 0x00: Not-ECT (Not ECN-Capable Transport))
        0000 00.. = Differentiated Services Codepoint: Default (0x00)
        .... ..00 = Explicit Congestion Notification: Not-ECT (Not ECN-Capable Transport) (0x00)
    Total Length: 60
    Identification: 0x0094 (148)
    Flags: 0x02 (Don't Fragment)
        0... .... = Reserved bit: Not set
        .1.. .... = Don't fragment: Set
        ..0. .... = More fragments: Not set
    Fragment offset: 0
    Time to live: 64
    Protocol: TCP (6)
    Header checksum: 0x1ba8 [correct]
        [Good: True]
        [Bad: False]
    Source: 192.168.0.71 (192.168.0.71)
    Destination: 69.10.24.135 (69.10.24.135)
Transmission Control Protocol, Src Port: 58622 (58622), Dst Port: http (80), Seq: 0, Len: 0
    Source port: 58622 (58622)
    Destination port: http (80)
    [Stream index: 3]
    Sequence number: 0    (relative sequence number)
    Header length: 40 bytes
    Flags: 0x002 (SYN)
        000. .... .... = Reserved: Not set
        ...0 .... .... = Nonce: Not set
        .... 0... .... = Congestion Window Reduced (CWR): Not set
        .... .0.. .... = ECN-Echo: Not set
        .... ..0. .... = Urgent: Not set
        .... ...0 .... = Acknowledgement: Not set
        .... .... 0... = Push: Not set
        .... .... .0.. = Reset: Not set
        .... .... ..1. = Syn: Set
            [Expert Info (Chat/Sequence): Connection establish request (SYN): server port http]
                [Message: Connection establish request (SYN): server port http]
                [Severity level: Chat]
                [Group: Sequence]
        .... .... ...0 = Fin: Not set
    Window size value: 16384
    [Calculated window size: 16384]
    Checksum: 0x80e0 [validation disabled]
        [Good Checksum: False]
        [Bad Checksum: False]
    Options: (20 bytes)
        Maximum segment size: 1460 bytes
        No-Operation (NOP)
        Window scale: 0 (multiply by 1)
            Kind: Window Scale (3)
            Length: 3
            Shift count: 0
            [Multiplier: 1]
        No-Operation (NOP)
        No-Operation (NOP)
        Timestamps: TSval 4780, TSecr 0
            Kind: Timestamp (8)
            Length: 10
            Timestamp value: 4780
            Timestamp echo reply: 0

0000  40 4a 03 8d 62 30 00 19 c5 ea 13 f9 08 00 45 00   @J..b0........E.
0010  00 3c 00 94 40 00 40 06 1b a8 c0 a8 00 47 45 0a   .<..@.@......GE.
0020  18 87 e4 fe 00 50 bc d9 b6 d2 00 00 00 00 a0 02   .....P..........
0030  40 00 80 e0 00 00 02 04 05 b4 01 03 03 00 01 01   @...............
0040  08 0a 00 00 12 ac 00 00 00 00                     ..........

No.     Time                       Source                Destination           Protocol Length Info
      8 2012-10-11 22:08:42.725058 192.168.0.71          69.10.30.242          TCP      257    58625 > 29900 [PSH, ACK] Seq=199 Ack=200 Win=17520 Len=191 TSval=4780 TSecr=26298093

Frame 8: 257 bytes on wire (2056 bits), 257 bytes captured (2056 bits)
    Arrival Time: Oct 11, 2012 22:08:42.725058000 GTB Standard Time
    Epoch Time: 1349982522.725058000 seconds
    [Time delta from previous captured frame: 0.019204000 seconds]
    [Time delta from previous displayed frame: 0.019204000 seconds]
    [Time since reference or first frame: 0.719962000 seconds]
    Frame Number: 8
    Frame Length: 257 bytes (2056 bits)
    Capture Length: 257 bytes (2056 bits)
    [Frame is marked: False]
    [Frame is ignored: False]
    [Protocols in frame: eth:ip:tcp:data]
Ethernet II, Src: SonyComp_ea:13:f9 (00:19:c5:ea:13:f9), Dst: ZyxelCom_8d:62:30 (40:4a:03:8d:62:30)
    Destination: ZyxelCom_8d:62:30 (40:4a:03:8d:62:30)
        Address: ZyxelCom_8d:62:30 (40:4a:03:8d:62:30)
        .... ...0 .... .... .... .... = IG bit: Individual address (unicast)
        .... ..0. .... .... .... .... = LG bit: Globally unique address (factory default)
    Source: SonyComp_ea:13:f9 (00:19:c5:ea:13:f9)
        Address: SonyComp_ea:13:f9 (00:19:c5:ea:13:f9)
        .... ...0 .... .... .... .... = IG bit: Individual address (unicast)
        .... ..0. .... .... .... .... = LG bit: Globally unique address (factory default)
    Type: IP (0x0800)
Internet Protocol Version 4, Src: 192.168.0.71 (192.168.0.71), Dst: 69.10.30.242 (69.10.30.242)
    Version: 4
    Header length: 20 bytes
    Differentiated Services Field: 0x00 (DSCP 0x00: Default; ECN: 0x00: Not-ECT (Not ECN-Capable Transport))
        0000 00.. = Differentiated Services Codepoint: Default (0x00)
        .... ..00 = Explicit Congestion Notification: Not-ECT (Not ECN-Capable Transport) (0x00)
    Total Length: 243
    Identification: 0x0095 (149)
    Flags: 0x02 (Don't Fragment)
        0... .... = Reserved bit: Not set
        .1.. .... = Don't fragment: Set
        ..0. .... = More fragments: Not set
    Fragment offset: 0
    Time to live: 64
    Protocol: TCP (6)
    Header checksum: 0x1485 [correct]
        [Good: True]
        [Bad: False]
    Source: 192.168.0.71 (192.168.0.71)
    Destination: 69.10.30.242 (69.10.30.242)
Transmission Control Protocol, Src Port: 58625 (58625), Dst Port: 29900 (29900), Seq: 199, Ack: 200, Len: 191
    Source port: 58625 (58625)
    Destination port: 29900 (29900)
    [Stream index: 0]
    Sequence number: 199    (relative sequence number)
    [Next sequence number: 390    (relative sequence number)]
    Acknowledgement number: 200    (relative ack number)
    Header length: 32 bytes
    Flags: 0x018 (PSH, ACK)
        000. .... .... = Reserved: Not set
        ...0 .... .... = Nonce: Not set
        .... 0... .... = Congestion Window Reduced (CWR): Not set
        .... .0.. .... = ECN-Echo: Not set
        .... ..0. .... = Urgent: Not set
        .... ...1 .... = Acknowledgement: Set
        .... .... 1... = Push: Set
        .... .... .0.. = Reset: Not set
        .... .... ..0. = Syn: Not set
        .... .... ...0 = Fin: Not set
    Window size value: 17520
    [Calculated window size: 17520]
    [Window size scaling factor: 1]
    Checksum: 0x8bb5 [validation disabled]
        [Good Checksum: False]
        [Bad Checksum: False]
    Options: (12 bytes)
        No-Operation (NOP)
        No-Operation (NOP)
        Timestamps: TSval 4780, TSecr 26298093
            Kind: Timestamp (8)
            Length: 10
            Timestamp value: 4780
            Timestamp echo reply: 26298093
    [SEQ/ACK analysis]
        [Bytes in flight: 390]
Data (191 bytes)
    Data: 5c696e76697465746f5c5c736573736b65795c3130313634...
    [Length: 191]

0000  40 4a 03 8d 62 30 00 19 c5 ea 13 f9 08 00 45 00   @J..b0........E.
0010  00 f3 00 95 40 00 40 06 14 85 c0 a8 00 47 45 0a   ....@.@......GE.
0020  1e f2 e5 01 74 cc b8 50 c4 29 20 c9 0f b6 80 18   ....t..P.) .....
0030  44 70 8b b5 00 00 01 01 08 0a 00 00 12 ac 01 91   Dp..............
0040  46 ed 5c 69 6e 76 69 74 65 74 6f 5c 5c 73 65 73   F.\inviteto\\ses
0050  73 6b 65 79 5c 31 30 31 36 34 34 36 39 30 5c 70   skey\101644690\p
0060  72 6f 64 75 63 74 73 5c 31 30 33 30 37 5c 66 69   roducts\10307\fi
0070  6e 61 6c 5c 5c 67 65 74 70 72 6f 66 69 6c 65 5c   nal\\getprofile\
0080  5c 73 65 73 73 6b 65 79 5c 31 30 31 36 34 34 36   \sesskey\1016446
0090  39 30 5c 70 72 6f 66 69 6c 65 69 64 5c 34 31 31   90\profileid\411
00a0  30 31 30 37 30 32 5c 69 64 5c 34 5c 66 69 6e 61   010702\id\4\fina
00b0  6c 5c 5c 73 74 61 74 75 73 5c 31 5c 73 65 73 73   l\\status\1\sess
00c0  6b 65 79 5c 31 30 31 36 34 34 36 39 30 5c 73 74   key\101644690\st
00d0  61 74 73 74 72 69 6e 67 5c 52 65 73 74 69 6e 67   atstring\Resting
00e0  5c 6c 6f 63 73 74 72 69 6e 67 5c 62 66 69 65 6c   \locstring\bfiel
00f0  64 31 39 34 32 70 73 32 3a 2f 5c 66 69 6e 61 6c   d1942ps2:/\final
0100  5c                                                \

No.     Time                       Source                Destination           Protocol Length Info
      9 2012-10-11 22:08:42.725435 192.168.0.71          69.10.24.135          TCP      74     58621 > http [SYN] Seq=0 Win=16384 Len=0 MSS=1460 WS=1 TSval=4780 TSecr=0

Frame 9: 74 bytes on wire (592 bits), 74 bytes captured (592 bits)
    Arrival Time: Oct 11, 2012 22:08:42.725435000 GTB Standard Time
    Epoch Time: 1349982522.725435000 seconds
    [Time delta from previous captured frame: 0.000377000 seconds]
    [Time delta from previous displayed frame: 0.000377000 seconds]
    [Time since reference or first frame: 0.720339000 seconds]
    Frame Number: 9
    Frame Length: 74 bytes (592 bits)
    Capture Length: 74 bytes (592 bits)
    [Frame is marked: False]
    [Frame is ignored: False]
    [Protocols in frame: eth:ip:tcp]
Ethernet II, Src: SonyComp_ea:13:f9 (00:19:c5:ea:13:f9), Dst: ZyxelCom_8d:62:30 (40:4a:03:8d:62:30)
    Destination: ZyxelCom_8d:62:30 (40:4a:03:8d:62:30)
        Address: ZyxelCom_8d:62:30 (40:4a:03:8d:62:30)
        .... ...0 .... .... .... .... = IG bit: Individual address (unicast)
        .... ..0. .... .... .... .... = LG bit: Globally unique address (factory default)
    Source: SonyComp_ea:13:f9 (00:19:c5:ea:13:f9)
        Address: SonyComp_ea:13:f9 (00:19:c5:ea:13:f9)
        .... ...0 .... .... .... .... = IG bit: Individual address (unicast)
        .... ..0. .... .... .... .... = LG bit: Globally unique address (factory default)
    Type: IP (0x0800)
Internet Protocol Version 4, Src: 192.168.0.71 (192.168.0.71), Dst: 69.10.24.135 (69.10.24.135)
    Version: 4
    Header length: 20 bytes
    Differentiated Services Field: 0x00 (DSCP 0x00: Default; ECN: 0x00: Not-ECT (Not ECN-Capable Transport))
        0000 00.. = Differentiated Services Codepoint: Default (0x00)
        .... ..00 = Explicit Congestion Notification: Not-ECT (Not ECN-Capable Transport) (0x00)
    Total Length: 60
    Identification: 0x0096 (150)
    Flags: 0x02 (Don't Fragment)
        0... .... = Reserved bit: Not set
        .1.. .... = Don't fragment: Set
        ..0. .... = More fragments: Not set
    Fragment offset: 0
    Time to live: 64
    Protocol: TCP (6)
    Header checksum: 0x1ba6 [correct]
        [Good: True]
        [Bad: False]
    Source: 192.168.0.71 (192.168.0.71)
    Destination: 69.10.24.135 (69.10.24.135)
Transmission Control Protocol, Src Port: 58621 (58621), Dst Port: http (80), Seq: 0, Len: 0
    Source port: 58621 (58621)
    Destination port: http (80)
    [Stream index: 4]
    Sequence number: 0    (relative sequence number)
    Header length: 40 bytes
    Flags: 0x002 (SYN)
        000. .... .... = Reserved: Not set
        ...0 .... .... = Nonce: Not set
        .... 0... .... = Congestion Window Reduced (CWR): Not set
        .... .0.. .... = ECN-Echo: Not set
        .... ..0. .... = Urgent: Not set
        .... ...0 .... = Acknowledgement: Not set
        .... .... 0... = Push: Not set
        .... .... .0.. = Reset: Not set
        .... .... ..1. = Syn: Set
            [Expert Info (Chat/Sequence): Connection establish request (SYN): server port http]
                [Message: Connection establish request (SYN): server port http]
                [Severity level: Chat]
                [Group: Sequence]
        .... .... ...0 = Fin: Not set
    Window size value: 16384
    [Calculated window size: 16384]
    Checksum: 0x7cc0 [validation disabled]
        [Good Checksum: False]
        [Bad Checksum: False]
    Options: (20 bytes)
        Maximum segment size: 1460 bytes
        No-Operation (NOP)
        Window scale: 0 (multiply by 1)
            Kind: Window Scale (3)
            Length: 3
            Shift count: 0
            [Multiplier: 1]
        No-Operation (NOP)
        No-Operation (NOP)
        Timestamps: TSval 4780, TSecr 0
            Kind: Timestamp (8)
            Length: 10
            Timestamp value: 4780
            Timestamp echo reply: 0

0000  40 4a 03 8d 62 30 00 19 c5 ea 13 f9 08 00 45 00   @J..b0........E.
0010  00 3c 00 96 40 00 40 06 1b a6 c0 a8 00 47 45 0a   .<..@.@......GE.
0020  18 87 e4 fd 00 50 bd 71 ba 5b 00 00 00 00 a0 02   .....P.q.[......
0030  40 00 7c c0 00 00 02 04 05 b4 01 03 03 00 01 01   @.|.............
0040  08 0a 00 00 12 ac 00 00 00 00                     ..........

No.     Time                       Source                Destination           Protocol Length Info
     10 2012-10-11 22:08:42.725771 192.168.0.71          69.10.24.135          TCP      74     58620 > http [SYN] Seq=0 Win=16384 Len=0 MSS=1460 WS=1 TSval=4780 TSecr=0

Frame 10: 74 bytes on wire (592 bits), 74 bytes captured (592 bits)
    Arrival Time: Oct 11, 2012 22:08:42.725771000 GTB Standard Time
    Epoch Time: 1349982522.725771000 seconds
    [Time delta from previous captured frame: 0.000336000 seconds]
    [Time delta from previous displayed frame: 0.000336000 seconds]
    [Time since reference or first frame: 0.720675000 seconds]
    Frame Number: 10
    Frame Length: 74 bytes (592 bits)
    Capture Length: 74 bytes (592 bits)
    [Frame is marked: False]
    [Frame is ignored: False]
    [Protocols in frame: eth:ip:tcp]
Ethernet II, Src: SonyComp_ea:13:f9 (00:19:c5:ea:13:f9), Dst: ZyxelCom_8d:62:30 (40:4a:03:8d:62:30)
    Destination: ZyxelCom_8d:62:30 (40:4a:03:8d:62:30)
        Address: ZyxelCom_8d:62:30 (40:4a:03:8d:62:30)
        .... ...0 .... .... .... .... = IG bit: Individual address (unicast)
        .... ..0. .... .... .... .... = LG bit: Globally unique address (factory default)
    Source: SonyComp_ea:13:f9 (00:19:c5:ea:13:f9)
        Address: SonyComp_ea:13:f9 (00:19:c5:ea:13:f9)
        .... ...0 .... .... .... .... = IG bit: Individual address (unicast)
        .... ..0. .... .... .... .... = LG bit: Globally unique address (factory default)
    Type: IP (0x0800)
Internet Protocol Version 4, Src: 192.168.0.71 (192.168.0.71), Dst: 69.10.24.135 (69.10.24.135)
    Version: 4
    Header length: 20 bytes
    Differentiated Services Field: 0x00 (DSCP 0x00: Default; ECN: 0x00: Not-ECT (Not ECN-Capable Transport))
        0000 00.. = Differentiated Services Codepoint: Default (0x00)
        .... ..00 = Explicit Congestion Notification: Not-ECT (Not ECN-Capable Transport) (0x00)
    Total Length: 60
    Identification: 0x0097 (151)
    Flags: 0x02 (Don't Fragment)
        0... .... = Reserved bit: Not set
        .1.. .... = Don't fragment: Set
        ..0. .... = More fragments: Not set
    Fragment offset: 0
    Time to live: 64
    Protocol: TCP (6)
    Header checksum: 0x1ba5 [correct]
        [Good: True]
        [Bad: False]
    Source: 192.168.0.71 (192.168.0.71)
    Destination: 69.10.24.135 (69.10.24.135)
Transmission Control Protocol, Src Port: 58620 (58620), Dst Port: http (80), Seq: 0, Len: 0
    Source port: 58620 (58620)
    Destination port: http (80)
    [Stream index: 5]
    Sequence number: 0    (relative sequence number)
    Header length: 40 bytes
    Flags: 0x002 (SYN)
        000. .... .... = Reserved: Not set
        ...0 .... .... = Nonce: Not set
        .... 0... .... = Congestion Window Reduced (CWR): Not set
        .... .0.. .... = ECN-Echo: Not set
        .... ..0. .... = Urgent: Not set
        .... ...0 .... = Acknowledgement: Not set
        .... .... 0... = Push: Not set
        .... .... .0.. = Reset: Not set
        .... .... ..1. = Syn: Set
